pmid,title,source,abstract
33883000,DNA methylation biomarkers of myocardial infarction and cardiovascular disease.,Clin Epigenetics,"The epigenetic landscape underlying cardiovascular disease (CVD) is not completely understood and the clinical value of the identified biomarkers is still limited. We aimed to identify differentially methylated loci associated with acute myocardial infarction (AMI) and assess their validity as predictive and causal biomarkers.We designed a case-control, two-stage, epigenome-wide association study on AMI (ndiscovery = 391, nvalidation = 204). DNA methylation was assessed using the Infinium MethylationEPIC BeadChip. We performed a fixed-effects meta-analysis of the two samples. 34 CpGs were associated with AMI. Only 12 of them were available in two independent cohort studies (n ~ 1800 and n ~ 2500) with incident coronary and cardiovascular disease (CHD and CVD, respectively). The Infinium HumanMethylation450 BeadChip was used in those two studies. Four of the 12 CpGs were validated in association with incident CHD: AHRR-mapping cg05575921, PTCD2-mapping cg25769469, intergenic cg21566642 and MPO-mapping cg04988978. We then assessed whether methylation risk scores based on those CpGs improved the predictive capacity of the Framingham risk function, but they did not. Finally, we aimed to study the causality of those associations using a Mendelian randomization approach but only one of the CpGs had a genetic influence and therefore the results were not conclusive.We have identified 34 CpGs related to AMI. These loci highlight the relevance of smoking, lipid metabolism, and inflammation in the biological mechanisms related to AMI. Four were additionally associated with incident CHD and CVD but did not provide additional predictive information."
33872906,Effect of prenatal exposure to phthalates on epigenome-wide DNA methylations in cord blood and implications for fetal growth: The Hokkaido Study on Environment and Children's Health.,Sci Total Environ,"Prenatal exposure to phthalates negatively affects the offspring's health. In particular, epigenetic alterations, such as DNA methylation, may connect phthalate exposure with health outcomes. Here, we evaluated the association of di-2-ethylhexyl phthalate (DEHP) exposure in utero with cord blood epigenome-wide DNA methylation in 203 mother-child pairs enrolled in the Hokkaido Study on Environment and Children's Health, using the Illumina HumanMethylation450 BeadChip. Epigenome-wide association analysis demonstrated the predominant positive associations between the levels of the primary metabolite of DEHP, mono(2-ethylhexyl) phthalate (MEHP), in maternal blood and DNA methylation levels in cord blood. The genes annotated to the CpGs positively associated with MEHP levels were enriched for pathways related to metabolism, the endocrine system, and signal transduction. Among them, methylation levels of CpGs involved in metabolism were inversely associated with the offspring's ponderal index (PI). Further, clustering and mediation analyses suggested that multiple increased methylation changes may jointly mediate the association of DEHP exposure in utero with the offspring's PI at birth. Although further studies are required to assess the impact of these changes, this study suggests that differential DNA methylation may link phthalate exposure in utero to fetal growth and further imply that DNA methylation has predictive value for the offspring's obesity.Copyright © 2021. Published by Elsevier B.V."
33867313,Epigenome-wide association study of COVID-19 severity with respiratory failure.,EBioMedicine,"Patients infected with the severe acute respiratory syndrome coronavirus 2 (SARS-CoV-2), responsible for the coronavirus disease 2019 (COVID-19), exhibit a wide spectrum of disease behaviour. Since DNA methylation has been implicated in the regulation of viral infections and the immune system, we performed an epigenome-wide association study (EWAS) to identify candidate loci regulated by this epigenetic mark that could be involved in the onset of COVID-19 in patients without comorbidities.Peripheral blood samples were obtained from 407 confirmed COVID-19 patients ≤ 61 years of age and without comorbidities, 194 (47.7%) of whom had mild symptomatology that did not involve hospitalization and 213 (52.3%) had a severe clinical course that required respiratory support. The set of cases was divided into discovery (n = 207) and validation (n = 200) cohorts, balanced for age and sex of individuals. We analysed the DNA methylation status of 850,000 CpG sites in these patients.The DNA methylation status of 44 CpG sites was associated with the clinical severity of COVID-19. Of these loci, 23 (52.3%) were located in 20 annotated coding genes. These genes, such as the inflammasome component Absent in Melanoma 2 (AIM2) and the Major Histocompatibility Complex, class I C (HLA-C) candidates, were mainly involved in the response of interferon to viral infection. We used the EWAS-identified sites to establish a DNA methylation signature (EPICOVID) that is associated with the severity of the disease.We identified DNA methylation sites as epigenetic susceptibility loci for respiratory failure in COVID-19 patients. These candidate biomarkers, combined with other clinical, cellular and genetic factors, could be useful in the clinical stratification and management of patients infected with the SARS-CoV-2.The Unstoppable campaign of the Josep Carreras Leukaemia Foundation, the Cellex Foundation and the CERCA Programme/Generalitat de Catalunya.Copyright © 2021 The Authors. Published by Elsevier B.V. All rights reserved."
33862401,Residential surrounding greenness and DNA methylation: An epigenome-wide association study.,Environ Int,"DNA methylation is a potential biological mechanism through which residential greenness affects health, but little is known about its association with greenness and whether the association could be modified by genetic background. We aimed to evaluate the association between surrounding greenness and genome-wide DNA methylation and potential gene-greenness interaction effects on DNA methylation.We measured blood-derived DNA methylation using the HumanMethylation450 BeadChip array (Illumina) for 479 Australian women, including 66 monozygotic, 66 dizygotic twin pairs, and 215 sisters of these twins. Surrounding greenness was represented by Normalized Difference Vegetation Index (NDVI) and Enhanced Vegetation Index (EVI) within 300, 500, 1000 or 2000 m surrounding participants' home addresses. For each cytosine-guanine dinucleotide (CpG), the associations between its methylation level and NDVI or EVI were evaluated by generalized estimating equations, after adjusting for age, education, marital status, area-level socioeconomic status, smoking behavior, cell-type proportions, and familial clustering. We used comb-p and DMRcate to identify significant differentially methylated regions (DMRs). For each significant CpG, we evaluated the interaction effects of greenness and single-nucleotide polymorphisms (SNPs) within ±1 Mb window on its methylation level.We found associations between surrounding greenness and blood DNA methylation for one CpG (cg04720477, mapped to the promoter region of CNP gene) with false discovery rate [FDR] < 0.05, and for another 9 CpGs with 0.05 ≤ FDR < 0.10. For two of these CpGs, we found 33 SNPs significantly (FDR < 0.05) modified the greenness-methylation association. There were 35 significant DMRs related to surrounding greenness that were identified by both comb-p (Sidak p-value < 0.01) and DMRcate (FDR < 0.01). Those CpGs and DMRs were mapped to genes related to many human diseases, such as mental health disorders and neoplasms as well as nutritional and metabolic diseases.Surrounding greenness was associated with blood DNA methylation of many loci across human genome, and this association could be modified by genetic variations.Copyright © 2021 The Author(s). Published by Elsevier Ltd.. All rights reserved."
33903745,Origins of human disease: the chrono-epigenetic perspective.,Nat Rev Genet,"Epigenetics has enriched human disease studies by adding new interpretations to disease features that cannot be explained by genetic and environmental factors. However, identifying causal mechanisms of epigenetic origin has been challenging. New opportunities have risen from recent findings in intra-individual and cyclical epigenetic variation, which includes circadian epigenetic oscillations. Cytosine modifications display deterministic temporal rhythms, which may drive ageing and complex disease. Temporality in the epigenome, or the 'chrono' dimension, may help the integration of epigenetic, environmental and genetic disease studies, and reconcile several disparities stemming from the arbitrarily delimited research fields. The ultimate goal of chrono-epigenetics is to predict disease risk, age of onset and disease dynamics from within individual-specific temporal dynamics of epigenomes."
33937763,Human methylome variation across Infinium 450K data on the Gene Expression Omnibus.,NAR Genom Bioinform,"While DNA methylation (DNAm) is the most-studied epigenetic mark, few recent studies probe the breadth of publicly available DNAm array samples. We collectively analyzed 35 360 Illumina Infinium HumanMethylation450K DNAm array samples published on the Gene Expression Omnibus. We learned a controlled vocabulary of sample labels by applying regular expressions to metadata and used existing models to predict various sample properties including epigenetic age. We found approximately two-thirds of samples were from blood, one-quarter were from brain and one-third were from cancer patients. About 19% of samples failed at least one of Illumina's 17 prescribed quality assessments; signal distributions across samples suggest modifying manufacturer-recommended thresholds for failure would make these assessments more informative. We further analyzed DNAm variances in seven tissues (adipose, nasal, blood, brain, buccal, sperm and liver) and characterized specific probes distinguishing them. Finally, we compiled DNAm array data and metadata, including our learned and predicted sample labels, into database files accessible via the recountmethylation R/Bioconductor companion package. Its vignettes walk the user through some analyses contained in this paper.© The Author(s) 2021. Published by Oxford University Press on behalf of NAR Genomics and Bioinformatics."
33911272,The central role of DNA damage in the ageing process.,Nature,"Ageing is a complex, multifaceted process leading to widespread functional decline that affects every organ and tissue, but it remains unknown whether ageing has a unifying causal mechanism or is grounded in multiple sources. Phenotypically, the ageing process is associated with a wide variety of features at the molecular, cellular and physiological level-for example, genomic and epigenomic alterations, loss of proteostasis, declining overall cellular and subcellular function and deregulation of signalling systems. However, the relative importance, mechanistic interrelationships and hierarchical order of these features of ageing have not been clarified. Here we synthesize accumulating evidence that DNA damage affects most, if not all, aspects of the ageing phenotype, making it a potentially unifying cause of ageing. Targeting DNA damage and its mechanistic links with the ageing phenotype will provide a logical rationale for developing unified interventions to counteract age-related dysfunction and disease."
33926538,"Associations of circulating folate, vitamin B12 and homocysteine concentrations in early pregnancy and cord blood with epigenetic gestational age: the Generation R Study.",Clin Epigenetics,"Circulating folate, vitamin B12 and homocysteine concentrations during fetal development have been associated with health outcomes in childhood. Changes in fetal DNA methylation may be an underlying mechanism. This may be reflected in altered epigenetic aging of the fetus, as compared to chronological aging. The difference between gestational age derived in clinical practice and gestational age predicted from neonatal DNA methylation data is referred to as gestational age acceleration. Differences in circulating folate, vitamin B12 and homocysteine concentrations during fetal development may be associated with gestational age acceleration.Up to 1346 newborns participating in the Generation R Study, a population-based prospective cohort study, had both cord blood DNA methylation data available and information on plasma folate, serum total and active B12 and plasma homocysteine concentrations, measured in early pregnancy and/or in cord blood. A subgroup of 380 newborns had mothers with optimal pregnancy dating based on a regular menstrual cycle and a known date of last menstrual period. For comparison, gestational age acceleration was calculated based the method of both Bohlin and Knight. In the total study population, which was more similar to Bohlin's training population, one standard deviation score (SDS) higher maternal plasma homocysteine concentrations was nominally associated with positive gestational age acceleration [0.07 weeks, 95% confidence interval (CI) 0.02, 0.13] by Bohlin's method. In the subgroup with pregnancy dating based on last menstrual period, the method that was also used in Knight's training population, one SDS higher cord serum total and active B12 concentrations were nominally associated with negative gestational age acceleration [(- 0.16 weeks, 95% CI - 0.30, - 0.02) and (- 0.15 weeks, 95% CI - 0.29, - 0.01), respectively] by Knight's method.We found some evidence to support associations of higher maternal plasma homocysteine concentrations with positive gestational age acceleration, suggesting faster epigenetic than clinical gestational aging. Cord serum vitamin B12 concentrations may be associated with negative gestational age acceleration, indicating slower epigenetic than clinical gestational aging. Future studies could examine whether altered fetal epigenetic aging underlies the associations of circulating homocysteine and vitamin B12 blood concentrations during fetal development with long-term health outcomes."
33926514,Characteristics of epigenetic aging across gestational and perinatal tissues.,Clin Epigenetics,"Epigenetic clocks have been used to indicate differences in biological states between individuals of same chronological age. However, so far, only few studies have examined epigenetic aging in newborns-especially regarding different gestational or perinatal tissues. In this study, we investigated which birth- and pregnancy-related variables are most important in predicting gestational epigenetic age acceleration or deceleration (i.e., the deviation between gestational epigenetic age estimated from the DNA methylome and chronological gestational age) in chorionic villus, placenta and cord blood tissues from two independent study cohorts (ITU, n = 639 and PREDO, n = 966). We further characterized the correspondence of epigenetic age deviations between these tissues.Among the most predictive factors of epigenetic age deviations in single tissues were child sex, birth length, maternal smoking during pregnancy, maternal mental disorders until childbirth, delivery mode and parity. However, the specific factors related to epigenetic age deviation and the direction of association differed across tissues. In individuals with samples available from more than one tissue, relative epigenetic age deviations were not correlated across tissues.Gestational epigenetic age acceleration or deceleration was not related to more favorable or unfavorable factors in one direction in the investigated tissues, and the relative epigenetic age differed between tissues of the same person. This indicates that epigenetic age deviations associate with distinct, tissue specific, factors during the gestational and perinatal period. Our findings suggest that the epigenetic age of the newborn should be seen as a characteristic of a specific tissue, and less as a general characteristic of the child itself."
33870444,Ageing affects subtelomeric DNA methylation in blood cells from a large European population enrolled in the MARK-AGE study.,Geroscience,"Ageing leaves characteristic traces in the DNA methylation make-up of the genome. However, the importance of DNA methylation in ageing remains unclear. The study of subtelomeric regions could give promising insights into this issue. Previously reported associations between susceptibility to age-related diseases and epigenetic instability at subtelomeres suggest that the DNA methylation profile of subtelomeres undergoes remodelling during ageing. In the present work, this hypothesis has been tested in the context of the European large-scale project MARK-AGE. In this cross-sectional study, we profiled the DNA methylation of chromosomes 5 and 21 subtelomeres, in more than 2000 age-stratified women and men recruited in eight European countries. The study included individuals from the general population as well as the offspring of nonagenarians and Down syndrome subjects, who served as putative models of delayed and accelerated ageing, respectively. Significant linear changes of subtelomeric DNA methylation with increasing age were detected in the general population, indicating that subtelomeric DNA methylation changes are typical signs of ageing. Data also show that, compared to the general population, the dynamics of age-related DNA methylation changes are attenuated in the offspring of centenarian, while they accelerate in Down syndrome individuals. This result suggests that subtelomeric DNA methylation changes reflect the rate of ageing progression. We next attempted to trace the age-related changes of subtelomeric methylation back to the influence of diverse variables associated with methylation variations in the population, including demographics, dietary/health habits and clinical parameters. Results indicate that the effects of age on subtelomeric DNA methylation are mostly independent of all other variables evaluated."
33821798,High social status males experience accelerated epigenetic aging in wild baboons.,Elife,"Aging, for virtually all life, is inescapable. However, within populations, biological aging rates vary. Understanding sources of variation in this process is central to understanding the biodemography of natural populations. We constructed a DNA methylation-based age predictor for an intensively studied wild baboon population in Kenya. Consistent with findings in humans, the resulting 'epigenetic clock' closely tracks chronological age, but individuals are predicted to be somewhat older or younger than their known ages. Surprisingly, these deviations are not explained by the strongest predictors of lifespan in this population, early adversity and social integration. Instead, they are best predicted by male dominance rank: high-ranking males are predicted to be older than their true ages, and epigenetic age tracks changes in rank over time. Our results argue that achieving high rank for male baboons - the best predictor of reproductive success - imposes costs consistent with a 'live fast, die young' life-history strategy.© 2021, Anderson et al."
33875015,An EPIC predictor of gestational age and its application to newborns conceived by assisted reproductive technologies.,Clin Epigenetics,"Gestational age is a useful proxy for assessing developmental maturity, but correct estimation of gestational age is difficult using clinical measures. DNA methylation at birth has proven to be an accurate predictor of gestational age. Previous predictors of epigenetic gestational age were based on DNA methylation data from the Illumina HumanMethylation 27 K or 450 K array, which have subsequently been replaced by the Illumina MethylationEPIC 850 K array (EPIC). Our aims here were to build an epigenetic gestational age clock specific for the EPIC array and to evaluate its precision and accuracy using the embryo transfer date of newborns from the largest EPIC-derived dataset to date on assisted reproductive technologies (ART).We built an epigenetic gestational age clock using Lasso regression trained on 755 randomly selected non-ART newborns from the Norwegian Study of Assisted Reproductive Technologies (START)-a substudy of the Norwegian Mother, Father, and Child Cohort Study (MoBa). For the ART-conceived newborns, the START dataset had detailed information on the embryo transfer date and the specific ART procedure used for conception. The predicted gestational age was compared to clinically estimated gestational age in 200 non-ART and 838 ART newborns using MM-type robust regression. The performance of the clock was compared to previously published gestational age clocks in an independent replication sample of 148 newborns from the Prediction and Prevention of Preeclampsia and Intrauterine Growth Restrictions (PREDO) study-a prospective pregnancy cohort of Finnish women.Our new epigenetic gestational age clock showed higher precision and accuracy in predicting gestational age than previous gestational age clocks (R2 = 0.724, median absolute deviation (MAD) = 3.14 days). Restricting the analysis to CpGs shared between 450 K and EPIC did not reduce the precision of the clock. Furthermore, validating the clock on ART newborns with known embryo transfer date confirmed that DNA methylation is an accurate predictor of gestational age (R2 = 0.767, MAD = 3.7 days).We present the first EPIC-based predictor of gestational age and demonstrate its robustness and precision in ART and non-ART newborns. As more datasets are being generated on the EPIC platform, this clock will be valuable in studies using gestational age to assess neonatal development."
33863351,Identification of X-chromosomal genes that drive sex differences in embryonic stem cells through a hierarchical CRISPR screening approach.,Genome Biol,"X-chromosomal genes contribute to sex differences, in particular during early development, when both X chromosomes are active in females. Double X-dosage shifts female pluripotent cells towards the naive stem cell state by increasing pluripotency factor expression, inhibiting the differentiation-promoting MAP kinase (MAPK) signaling pathway, and delaying differentiation.To identify the genetic basis of these sex differences, we use a two-step CRISPR screening approach to comprehensively identify X-linked genes that cause the female pluripotency phenotype in murine embryonic stem cells. A primary chromosome-wide CRISPR knockout screen and three secondary screens assaying for different aspects of the female pluripotency phenotype allow us to uncover multiple genes that act in concert and to disentangle their relative roles. Among them, we identify Dusp9 and Klhl13 as two central players. While Dusp9 mainly affects MAPK pathway intermediates, Klhl13 promotes pluripotency factor expression and delays differentiation, with both factors jointly repressing MAPK target gene expression.Here, we elucidate the mechanisms that drive sex-induced differences in pluripotent cells and our approach serves as a blueprint to discover the genetic basis of the phenotypic consequences of other chromosomal effects."
33886023,"DNA Methylation, Preterm Birth and Blood Pressure in African American Children: The DPREG Study.",J Immigr Minor Health,"Preterm birth (< 37 weeks) has been associated with high blood pressure (BP) and cardiovascular disease in adulthood. Epigenetic mechanisms may explain how preterm birth influences later BP. In this study, we examined the association between DNA methylation (DNAm), preterm birth and BP in African American children. We recruited 100 children and collected clinical and birth history data. DNA was extracted from saliva and the Illumina EPIC BeadChip was used for epigenetic analyses. Preterm birth was not associated with systolic or diastolic BP. No significant DNAm sites were associated with preterm birth in candidate gene methylation analyses. Body mass index was associated with systolic BP (p = 0.01). We did not observe an effect of preterm birth on DNAm or BP in early childhood. Our study is one of the few, however, to examine these associations among African Americans."
