"pmid","title","source","abstract"
"37237996","BET Protein Inhibitor JQ1 Modulates Mitochondrial Dysfunction and Oxidative Stress Induced by Chronic Kidney Disease.","Antioxidants (Basel)","Among the mechanisms involved in the progression of kidney disease, mitochondrial dysfunction has special relevance. Epigenetic drugs such as inhibitors of extra-terminal domain proteins (iBET) have shown beneficial effects in experimental kidney disease, mainly by inhibiting proliferative and inflammatory responses. The impact of iBET on mitochondrial damage was explored in in vitro studies in renal cells stimulated with TGF-β1 and in vivo in murine unilateral ureteral obstruction (UUO) model of progressive kidney damage. In vitro, JQ1 pretreatment prevented the TGF-β1-induced downregulation of components of the oxidative phosphorylation chain (OXPHOS), such as cytochrome C and CV-ATP5a in human proximal tubular cells. In addition, JQ1 also prevented the altered mitochondrial dynamics by avoiding the increase in the DRP-1 fission factor. In UUO model, renal gene expression levels of cytochrome C and CV-ATP5a as well as protein levels of cytochrome C were reduced These changes were prevented by JQ1 administration. In addition, JQ1 decreased protein levels of the DRP1 fission protein and increased the OPA-1 fusion protein, restoring mitochondrial dynamics. Mitochondria also participate in the maintenance of redox balance. JQ1 restored the gene expression of antioxidant proteins, such as Catalase and Heme oxygenase 1 in TGF-β1-stimulated human proximal tubular cells and in murine obstructed kidneys. Indeed, in tubular cells, JQ1 decreased ROS production induced by stimulation with TGF-β1, as evaluated by MitoSOXTM. iBETs, such as JQ1, improve mitochondrial dynamics, functionality, and oxidative stress in kidney disease."
"37235346","A Novel Multicellular Placental Barrier Model to Investigate the Effect of Maternal Aflatoxin B(1) Exposure on Fetal-Side Neural Stem Cells.","Toxins (Basel)","Ingestion of food toxins such as aflatoxin B1(AFB1) during pregnancy may impair fetal neurodevelopment. However, animal model results may not be accurate due to the species' differences, and testing on humans is ethically impermissible. Here, we developed an in vitro human maternal-fetal multicellular model composed of a human hepatic compartment, a bilayer placental barrier, and a human fetal central nervous system compartment using neural stem cells (NSCs) to investigate the effect of AFB1on fetal-side NSCs. AFB1passed through the HepG2 hepatocellular carcinoma cells to mimic the maternal metabolic effects. Importantly, even at the limited concentration (0.0641 ± 0.0046 μM) of AFB1,close to the national safety level standard of China (GB-2761-2011), the mixture of AFB1crossing the placental barrier induced NSC apoptosis. The level of reactive oxygen species in NSCs was significantly elevated and the cell membrane was damaged, causing the release of intracellular lactate dehydrogenase (p< 0.05). The comet experiment and γ-H2AX immunofluorescence assay showed that AFB1caused significant DNA damage to NSCs (p< 0.05). This study provided a new model for the toxicological evaluation of the effect of food mycotoxin exposure during pregnancy on fetal neurodevelopment."
"37239629","Exposure to Disinfectants and Cleaning Products and Respiratory Health of Workers and Children in Daycares: The CRESPI Cohort Protocol.","Int J Environ Res Public Health","Although cleaning tasks are frequently performed in daycare, no study has focused on exposures in daycares in relation to respiratory health. The CRESPI cohort is an epidemiological study among workers (n~320) and children (n~540) attending daycares. The purpose is to examine the impact of daycare exposures to disinfectants and cleaning products (DCP) on the respiratory health of workers and children. A sample of 108 randomly selected daycares in the region of Paris has been visited to collect settled dust to analyze semi-volatile organic compounds and microbiota, as well as sample indoor air to analyze aldehydes and volatile organic compounds. Innovative tools (smartphone applications) are used to scan DCP barcodes in daycare and inform their use; a database then matches the barcodes with the products' compositions. At baseline, workers/parents completed a standardized questionnaire, collecting information on DCP used at home, respiratory health, and potential confounders. Follow-up regarding children's respiratory health (monthly report through a smartphone application and biannual questionnaires) is ongoing until the end of 2023. Associations between DCP exposures and the respiratory health of workers/children will be evaluated. By identifying specific environments or DCP substances associated with the adverse respiratory health of workers and children, this longitudinal study will contribute to the improvement of preventive measures."
"37218755","Recent Developments in Protein Lactylation in PTSD and CVD: Novel Strategies and Targets.","BioTech (Basel)","In 1938, Corneille Heymans received the Nobel Prize in physiology for discovering that oxygen sensing in the aortic arch and carotid sinus was mediated by the nervous system. The genetics of this process remained unclear until 1991 when Gregg Semenza while studying erythropoietin, came upon hypoxia-inducible factor 1, for which he obtained the Nobel Prize in 2019. The same year, Yingming Zhao found protein lactylation, a posttranslational modification that can alter the function of hypoxia-inducible factor 1, the master regulator of cellular senescence, a pathology implicated in both post-traumatic stress disorder (PTSD) and cardiovascular disease (CVD). The genetic correlation between PTSD and CVD has been demonstrated by many studies, of which the most recent one utilizes large-scale genetics to estimate the risk factors for these conditions. This study focuses on the role of hypertension and dysfunctional interleukin 7 in PTSD and CVD, the former caused by stress-induced sympathetic arousal and elevated angiotensin II, while the latter links stress to premature endothelial cell senescence and early vascular aging. This review summarizes the recent developments and highlights several novel PTSD and CVD pharmacological targets. They include lactylation of histone and non-histone proteins, along with the related biomolecular actors such as hypoxia-inducible factor 1α, erythropoietin, acid-sensing ion channels, basigin, and Interleukin 7, as well as strategies to delay premature cellular senescence by telomere lengthening and resetting the epigenetic clock."
"37233716","Molecular Mechanisms of Western Diet-Induced Obesity and Obesity-Related Carcinogenesis-A Narrative Review.","Metabolites","The present study aims to provide a narrative review of the molecular mechanisms of Western diet-induced obesity and obesity-related carcinogenesis. A literature search of the Cochrane Library, Embase and Pubmed databases, Google Scholar and the grey literature was conducted. Most of the molecular mechanisms that induce obesity are also involved in the twelve Hallmarks of Cancer, with the fundamental process being the consumption of a highly processed, energy-dense diet and the deposition of fat in white adipose tissue and the liver. The generation of crown-like structures, with macrophages surrounding senescent or necrotic adipocytes or hepatocytes, leads to a perpetual state of chronic inflammation, oxidative stress, hyperinsulinaemia, aromatase activity, activation of oncogenic pathways and loss of normal homeostasis. Metabolic reprogramming, epithelial mesenchymal transition, HIF-1α signalling, angiogenesis and loss of normal host immune-surveillance are particularly important. Obesity-associated carcinogenesis is closely related to metabolic syndrome, hypoxia, visceral adipose tissue dysfunction, oestrogen synthesis and detrimental cytokine, adipokine and exosomal miRNA release. This is particularly important in the pathogenesis of oestrogen-sensitive cancers, including breast, endometrial, ovarian and thyroid cancer, but also 'non-hormonal' obesity-associated cancers such as cardio-oesophageal, colorectal, renal, pancreatic, gallbladder and hepatocellular adenocarcinoma. Effective weight loss interventions may improve the future incidence of overall and obesity-associated cancer."
"37239938","NOD-like Receptors-Emerging Links to Obesity and Associated Morbidities.","Int J Mol Sci","Obesity and its associated metabolic morbidities have been and still are on the rise, posing a major challenge to health care systems worldwide. It has become evident over the last decades that a low-grade inflammatory response, primarily proceeding from the adipose tissue (AT), essentially contributes to adiposity-associated comorbidities, most prominently insulin resistance (IR), atherosclerosis and liver diseases. In mouse models, the release of pro-inflammatory cytokines such as TNF-alpha (TNF-α) and interleukin (IL)-1β and the imprinting of immune cells to a pro-inflammatory phenotype in AT play an important role. However, the underlying genetic and molecular determinants are not yet understood in detail. Recent evidence demonstrates that nucleotide-binding and oligomerization domain (NOD)-like receptor (NLR) family proteins, a group of cytosolic pattern recognition receptors (PRR), contribute to the development and control of obesity and obesity-associated inflammatory responses. In this article, we review the current state of research on the role of NLR proteins in obesity and discuss the possible mechanisms leading to and the outcomes of NLR activation in the obesity-associated morbidities IR, type 2 diabetes mellitus (T2DM), atherosclerosis and non-alcoholic fatty liver disease (NAFLD) and discuss emerging ideas about possibilities for NLR-based therapeutic interventions of metabolic diseases."
"37239934","Assessing the Differential Methylation Analysis Quality for Microarray and NGS Platforms.","Int J Mol Sci","Differential methylation (DM) is actively recruited in different types of fundamental and translational studies. Currently, microarray- and NGS-based approaches for methylation analysis are the most widely used with multiple statistical models designed to extract differential methylation signatures. The benchmarking of DM models is challenging due to the absence of gold standard data. In this study, we analyze an extensive number of publicly available NGS and microarray datasets with divergent and widely utilized statistical models and apply the recently suggested and validated rank-statistic-based approach Hobotnica to evaluate the quality of their results. Overall, microarray-based methods demonstrate more robust and convergent results, while NGS-based models are highly dissimilar. Tests on the simulated NGS data tend to overestimate the quality of the DM methods and therefore are recommended for use with caution. Evaluation of the top 10 DMC and top 100 DMC in addition to the not-subset signature also shows more stable results for microarray data. Summing up, given the observed heterogeneity in NGS methylation data, the evaluation of newly generated methylation signatures is a crucial step in DM analysis. The Hobotnica metric is coordinated with previously developed quality metrics and provides a robust, sensitive, and informative estimation of methods' performance and DM signatures' quality in the absence of gold standard data solving a long-existing problem in DM analysis."
"37239728","Support Provided by Caregivers for Community-Dwelling Obesity Individuals: Focus on Elderly and Hispanics.","Healthcare (Basel)","Obesity is a chronic disease marked by the buildup of extra adipose tissue and a higher chance of developing concomitant illnesses such as heart disease, diabetes, high blood pressure, and some malignancies. Over the past few decades, there has been a global increase in the prevalence of obesity, which now affects around one-third of the world's population. According to recent studies, a variety of factors, including genetics and biology as well as environmental, physiological, and psychosocial factors, may have a role in the development of obesity. The prevalence of obesity is often higher among Hispanic American groups than among White people in the U.S. Obesity is a widespread condition with a high risk of morbidity and death, and it is well-recognized that the prevalence of comorbidities rises with rising levels of obesity or body mass index. To combat the rising prevalence of obesity in the USA, especially among Hispanics, one of the fastest-growing racial/ethnic groups in the country, there is an urgent need for obesity therapies. The exact cause of this disparity is unclear, but some responsible factors are a lack of education, high unemployment rates, high levels of food insecurity, an unhealthy diet, inadequate access to physical activity resources, a lack of health insurance, and constricted access to culturally adequate healthcare. Additionally, managing obesity and giving needed/timely support to obese people is a difficult responsibility for medical professionals and their loved ones. The need for caregivers is increasing with the increased number of individuals with obesity, particularly Hispanics. Our article summarizes the status of obesity, focusing on Hispanic populations, and we also highlight specific factors that contribute to obesity, including genetics, epigenetics, biological, physiological, and psychosocial factors, medication and disease, environment, and socio-demographics. This article also reviews caregiver duties and challenges associated with caring for people with obesity."
"37237488","TNFÎ± Effects on Adipocytes Are Influenced by the Presence of Lysine Methyltransferases, G9a (EHMT2) and GLP (EHMT1).","Biology (Basel)","Impaired adipocyte function contributes to systemic metabolic dysregulation, and altered fat mass or function increases the risk of Type 2 diabetes. EHMTs 1 and 2 (euchromatic histone lysine methyltransferases 1 and 2), also known as the G9a-like protein (GLP) and G9a, respectively, catalyze the mono- and di-methylation of histone 3 lysine 9 (H3K9) and also methylate nonhistone substrates; in addition, they can act as transcriptional coactivators independent of their methyltransferase activity. These enzymes are known to contribute to adipocyte development and function, and in vivo data indicate a role for G9a and GLP in metabolic disease states; however, the mechanisms involved in the cell-autonomous functions of G9a and GLP in adipocytes are largely unknown. Tumor necrosis factor alpha (TNFα) is a proinflammatory cytokine typically induced in adipose tissue in conditions of insulin resistance and Type 2 diabetes. Using an siRNA approach, we have determined that the loss of G9a and GLP enhances TNFα-induced lipolysis and inflammatory gene expression in adipocytes. Furthermore, we show that G9a and GLP are present in a protein complex with nuclear factor kappa B (NF-κB) in TNFα-treated adipocytes. These novel observations provide mechanistic insights into the association between adipocyte G9a and GLP expression and systemic metabolic health."
"37205403","Collection of Biospecimens from the Inspiration4 Mission Establishes the Standards for the Space Omics and Medical Atlas (SOMA).","bioRxiv","The SpaceX Inspiration4 mission provided a unique opportunity to study the impact of spaceflight on the human body. Biospecimen samples were collected from the crew at different stages of the mission, including before (L-92, L-44, L-3 days), during (FD1, FD2, FD3), and after (R+1, R+45, R+82, R+194 days) spaceflight, creating a longitudinal sample set. The collection process included samples such as venous blood, capillary dried blood spot cards, saliva, urine, stool, body swabs, capsule swabs, SpaceX Dragon capsule HEPA filter, and skin biopsies, which were processed to obtain aliquots of serum, plasma, extracellular vesicles, and peripheral blood mononuclear cells. All samples were then processed in clinical and research laboratories for optimal isolation and testing of DNA, RNA, proteins, metabolites, and other biomolecules. This paper describes the complete set of collected biospecimens, their processing steps, and long-term biobanking methods, which enable future molecular assays and testing. As such, this study details a robust framework for obtaining and preserving high-quality human, microbial, and environmental samples for aerospace medicine in the Space Omics and Medical Atlas (SOMA) initiative, which can also aid future experiments in human spaceflight and space biology."
"37237151","Comparative analysis of deeply phenotyped GBM cohorts of 'short-term' and 'long-term' survivors.","J Neurooncol","Glioblastoma (GBM) is an aggressive brain cancer that typically results in death in the first 15 months after diagnosis. There have been limited advances in finding new treatments for GBM. In this study, we investigated molecular differences between patients with extremely short (≤ 9 months, Short term survivors, STS) and long survival (≥ 36 months, Long term survivors, LTS).Patients were selected from an in-house cohort (GLIOTRAIN-cohort), using defined inclusion criteria (Karnofsky score > 70; age < 70 years old; Stupp protocol as first line treatment, IDH wild type), and a multi-omic analysis of LTS and STS GBM samples was performed.Transcriptomic analysis of tumour samples identified cilium gene signatures as enriched in LTS. Moreover, Immunohistochemical analysis confirmed the presence of cilia in the tumours of LTS. Notably, reverse phase protein array analysis (RPPA) demonstrated increased phosphorylated GAB1 (Y627), SRC (Y527), BCL2 (S70) and RAF (S338) protein expression in STS compared to LTS. Next, we identified 25 unique master regulators (MR) and 13 transcription factors (TFs) belonging to ontologies of integrin signalling and cell cycle to be upregulated in STS.Overall, comparison of STS and LTS GBM patients, identifies novel biomarkers and potential actionable therapeutic targets for the management of GBM.© 2023. The Author(s)."
"37242535","Network Biology-Inspired Machine Learning Features Predict Cancer Gene Targets and Reveal Target Coordinating Mechanisms.","Pharmaceuticals (Basel)","Anticipating and understanding cancers' need for specific gene activities is key for novel therapeutic development. Here we utilized DepMap, a cancer gene dependency screen, to demonstrate that machine learning combined with network biology can produce robust algorithms that both predict what genes a cancer is dependent on and what network features coordinate such gene dependencies. Using network topology and biological annotations, we constructed four groups of novel engineered machine learning features that produced high accuracies when predicting binary gene dependencies. We found that in all examined cancer types, F1 scores were greater than 0.90, and model accuracy remained robust under multiple hyperparameter tests. We then deconstructed these models to identify tumor type-specific coordinators of gene dependency and identified that in certain cancers, such as thyroid and kidney, tumors' dependencies are highly predicted by gene connectivity. In contrast, other histologies relied on pathway-based features such as lung, where gene dependencies were highly predictive by associations with cell death pathway genes. In sum, we show that biologically informed network features can be a valuable and robust addition to predictive pharmacology models while simultaneously providing mechanistic insights."
"37237254","Comprehensive bioinformatic analysis of the expression and prognostic significance of TSC22D domain family genes in adult acute myeloid leukemia.","BMC Med Genomics","TSC22D domain family genes, including TSC22D1-4, play a principal role in cancer progression. However, their expression profiles and prognostic significance in adult acute myeloid leukemia (AML) remain unknown.The online databases, including HPA, CCLE, EMBL-EBI, GEPIA2, BloodSpot, GENT2, UCSCXenaShiny, GSCALite, cBioportal, and GenomicScape, utilized the data of TCGA and GEO to investigate gene expression, mutation, copy number variation (CNV), and prognostic significance of the TSC22D domain family in adult AML. Computational analysis of resistance (CARE) was used to explore the effect of TSC22D3 expression on drug response. Functional enrichment analysis of TSC22D3 was performed in the TRRUST Version 2 database. The STRING, Pathway Commons, and AnimalTFDB3.0 databases were used to investigate the protein-protein interaction (PPI) network of TSC22D3. Harmonizome was used to predict target genes and kinases regulated by TSC22D3. The StarBase v2.0 and CancermiRNome databases were used to predict miRNAs regulated by TSC22D3. UCSCXenaShiny was used to investigate the correlation between TSC22D3 expression and immune infiltration.Compared with normal adult hematopoietic stem cells (HSCs), the expression of TSC22D3 and TSC22D4 in adult AML tissues was markedly up-regulated, whereas TSC22D1 expression was markedly down-regulated. The expression of TSC22D1 and TSC22D3 was significantly increased in adult AML tissues compared to normal adult tissues. High TSC22D3 expression was significantly associated with poor overall survival (OS) and event-free survival (EFS) in adult AML patients. Univariate and multivariate Cox analysis showed that overexpression of TSC22D3 was independently associated with adverse OS of adult AML patients. High TSC22D3 expression had a adverse impact on OS and EFS of adult AML patients in the chemotherapy group. TSC22D3 expression correlated with drug resistance to BCL2 inhibitors. Functional enrichment analysis indicated that TSC22D3 might promote AML progression. MIR143-3p sponging TSC22D3 might have anti-leukemia effect in adult AML.A significant increase in TSC22D3 expression was observed in adult AML tissues compared to normal adult HSCs and tissues. The prognosis of adult AML patients with high TSC22D3 expression was unfavorable, which could severe as a new prognostic biomarker and potential target for adult AML.© 2023. The Author(s)."
"37231268","Nonmonotone invasion landscape by noise-aware control of metastasis activator levels.","Nat Chem Biol","A major pharmacological assumption is that lowering disease-promoting protein levels is generally beneficial. For example, inhibiting metastasis activator BACH1 is proposed to decrease cancer metastases. Testing such assumptions requires approaches to measure disease phenotypes while precisely adjusting disease-promoting protein levels. Here we developed a two-step strategy to integrate protein-level tuning, noise-aware synthetic gene circuits into a well-defined human genomic safe harbor locus. Unexpectedly, engineered MDA-MB-231 metastatic human breast cancer cells become more, then less and then more invasive as we tune BACH1 levels up, irrespective of the native BACH1. BACH1 expression shifts in invading cells, and expression of BACH1's transcriptional targets confirm BACH1's nonmonotone phenotypic and regulatory effects. Thus, chemical inhibition of BACH1 could have unwanted effects on invasion. Additionally, BACH1's expression variability aids invasion at high BACH1 expression. Overall, precisely engineered, noise-aware protein-level control is necessary and important to unravel disease effects of genes to improve clinical drug efficacy.© 2023. The Author(s)."
"37226094","Drug mechanism enrichment analysis improves prioritization of therapeutics for repurposing.","BMC Bioinformatics","There is a pressing need for improved methods to identify effective therapeutics for diseases. Many computational approaches have been developed to repurpose existing drugs to meet this need. However, these tools often output long lists of candidate drugs that are difficult to interpret, and individual drug candidates may suffer from unknown off-target effects. We reasoned that an approach which aggregates information from multiple drugs that share a common mechanism of action (MOA) would increase on-target signal compared to evaluating drugs on an individual basis. In this study, we present drug mechanism enrichment analysis (DMEA), an adaptation of gene set enrichment analysis (GSEA), which groups drugs with shared MOAs to improve the prioritization of drug repurposing candidates.First, we tested DMEA on simulated data and showed that it can sensitively and robustly identify an enriched drug MOA. Next, we used DMEA on three types of rank-ordered drug lists: (1) perturbagen signatures based on gene expression data, (2) drug sensitivity scores based on high-throughput cancer cell line screening, and (3) molecular classification scores of intrinsic and acquired drug resistance. In each case, DMEA detected the expected MOA as well as other relevant MOAs. Furthermore, the rankings of MOAs generated by DMEA were better than the original single-drug rankings in all tested data sets. Finally, in a drug discovery experiment, we identified potential senescence-inducing and senolytic drug MOAs for primary human mammary epithelial cells and then experimentally validated the senolytic effects of EGFR inhibitors.DMEA is a versatile bioinformatic tool that can improve the prioritization of candidates for drug repurposing. By grouping drugs with a shared MOA, DMEA increases on-target signal and reduces off-target effects compared to analysis of individual drugs. DMEA is publicly available as both a web application and an R package at https://belindabgarana.github.io/DMEA .© 2023. The Author(s)."
