person,ec,date,category,pmid,title,source,abstract
,Yes,20230504,ewas,37093107,A meta-analysis of epigenome-wide association studies on pregnancy vitamin B12 concentrations and offspring DNA methylation.,Epigenetics,"Circulating vitamin B12 concentrations during pregnancy are associated with offspring health. Foetal DNA methylation changes could underlie these associations. Within the Pregnancy And Childhood Epigenetics Consortium, we meta-analysed epigenome-wide associations of circulating vitamin B12 concentrations in mothers during pregnancy (n = 2,420) or cord blood (n = 1,029), with cord blood DNA methylation. Maternal and newborn vitamin B12 concentrations were associated with DNA methylation at 109 and 7 CpGs, respectively (False Discovery RateP-value <0.05). Persistent associations with DNA methylation in the peripheral blood of up to 482 children aged 4-10 y were observed for 40.7% of CpGs associated with maternal vitamin B12 and 57.1% of CpGs associated with newborn vitamin B12. Of the CpGs identified in the maternal meta-analyses, 4.6% were associated with either birth weight or gestational age in a previous work. For the newborn meta-analysis, this was the case for 14.3% of the identified CpGs. Also, of the CpGs identified in the newborn meta-analysis, 14.3% and 28.6%, respectively, were associated with childhood cognitive skills and nonverbal IQ. Of the 109 CpGs associated with maternal vitamin B12, 18.3% were associated with nearby gene expression. In this study, we showed that maternal and newborn vitamin B12 concentrations are associated with DNA methylation at multiple CpGs in offspring blood (PFDR<0.05). Whether this differential DNA methylation underlies associations of vitamin B12 concentrations with child health outcomes, such as birth weight, gestational age, and childhood cognition, should be further examined in future studies."
,Yes,20230504,ewas,37088033,Umbilical cord DNA methylation is associated with body mass index trajectories from birth to adolescence.,EBioMedicine,"DNA methylation (DNAm) in cord blood has been associated with various prenatal factors and birth outcomes. This study sought to fill an important knowledge gap: the link of cord DNAm with child postnatal growth trajectories from birth to age 18 years (y).Using data from a US predominantly urban, low-income, multi-ethnic birth cohort (N = 831), we first applied non-parametric methods to identify body-mass-index percentile (BMIPCT) trajectories from birth to age 18 y (the outcome); then, conducted epigenome-wide association study (EWAS) of the outcome, interrogating over 700,000 CpG sites profiled by the Illumina Infinium MethylationEPIC BeadChip. Multivariate linear regression models and likelihood ratio tests (LRT) were applied to examine the DNAm-outcome association in the overall sample and sex strata.We identified four distinct patterns of BMIPCT trajectories: normal weight (NW), Early overweight or obesity (OWO), Late OWO, and normal to very late OWO. DNAm at CpG18582997 annotated to TPGS1, CpG15241084 of TLR7, and cg24350936 of RAB31 were associated with BMIPCT at birth-to-3 y, 10 y, and 14 y, respectively (LRT FDR < 0.05 for all).In this prospective birth cohort study, we identified 4 distinct and robust patterns of growth trajectories from birth to 18 y, which were associated with variations in cord blood DNAm at genes implicated in inflammation induction pathways. These findings, if further replicated, raise the possibility that these DNAm markers along with early assessment of BMIPCT trajectories may help identify young children at high-risk for obesity later in life.Detailed in the Acknowledgements section.Copyright © 2023. Published by Elsevier B.V."
,No,20230504,ewas,37085889,The X-factor in ART: does the use of assisted reproductive technologies influence DNA methylation on the X chromosome?,Hum Genomics,"Assisted reproductive technologies (ART) may perturb DNA methylation (DNAm) in early embryonic development. Although a handful of epigenome-wide association studies of ART have been published, none have investigated CpGs on the X chromosome. To bridge this knowledge gap, we leveraged one of the largest collections of mother-father-newborn trios of ART and non-ART (natural) conceptions to date to investigate sex-specific DNAm differences on the X chromosome. The discovery cohort consisted of 982 ART and 963 non-ART trios from the Norwegian Mother, Father, and Child Cohort Study (MoBa). To verify our results from the MoBa cohort, we used an external cohort of 149 ART and 58 non-ART neonates from the Australian 'Clinical review of the Health of adults conceived following Assisted Reproductive Technologies' (CHART) study. The Illumina EPIC array was used to measure DNAm in both datasets. In the MoBa cohort, we performed a set of X-chromosome-wide association studies ('XWASs' hereafter) to search for sex-specific DNAm differences between ART and non-ART newborns. We tested several models to investigate the influence of various confounders, including parental DNAm. We also searched for differentially methylated regions (DMRs) and regions of co-methylation flanking the most significant CpGs. Additionally, we ran an analogous model to our main model on the external CHART dataset.In the MoBa cohort, we found more differentially methylated CpGs and DMRs in girls than boys. Most of the associations persisted after controlling for parental DNAm and other confounders. Many of the significant CpGs and DMRs were in gene-promoter regions, and several of the genes linked to these CpGs are expressed in tissues relevant for both ART and sex (testis, placenta, and fallopian tube). We found no support for parental DNAm-dependent features as an explanation for the observed associations in the newborns. The most significant CpG in the boys-only analysis was in UBE2DNL, which is expressed in testes but with unknown function. The most significant CpGs in the girls-only analysis were in EIF2S3 and AMOT. These three loci also displayed differential DNAm in the CHART cohort.Genes that co-localized with the significant CpGs and DMRs associated with ART are implicated in several key biological processes (e.g., neurodevelopment) and disorders (e.g., intellectual disability and autism). These connections are particularly compelling in light of previous findings indicating that neurodevelopmental outcomes differ in ART-conceived children compared to those naturally conceived.© 2023. The Author(s)."
,No,20230504,mr,37085538,Role of DNA methylation in the relationship between glioma risk factors and glioma incidence: a two-step Mendelian randomization study.,Sci Rep,"Genetic evidence suggests glioma risk is altered by leukocyte telomere length, allergic disease (asthma, hay fever or eczema), alcohol consumption, childhood obesity, low-density lipoprotein cholesterol (LDLc) and triglyceride levels. DNA methylation (DNAm) variation influences many of these glioma-related traits and is an established feature of glioma. Yet the causal relationship between DNAm variation with both glioma incidence and glioma risk factors is unknown. We applied a two-step Mendelian randomization (MR) approach and several sensitivity analyses (including colocalization and Steiger filtering) to assess the association of DNAm with glioma risk factors and glioma incidence. We used data from a recently published catalogue of germline genetic variants robustly associated with DNAm variation in blood (32,851 participants) and data from a genome-wide association study of glioma risk (12,488 cases and 18,169 controls, sub-divided into 6191 glioblastoma cases and 6305 non-glioblastoma cases). MR evidence indicated that DNAm at 3 CpG sites (cg01561092, cg05926943, cg01584448) in one genomic region (HEATR3) had a putative association with glioma and glioblastoma risk (False discovery rate [FDR] < 0.05). Steiger filtering provided evidence against reverse causation. Colocalization presented evidence against genetic confounding and suggested that differential DNAm at the 3 CpG sites and glioma were driven by the same genetic variant. MR provided little evidence to suggest that DNAm acts as a mediator on the causal pathway between risk factors previously examined and glioma onset. To our knowledge, this is the first study to use MR to appraise the causal link of DNAm with glioma risk factors and glioma onset. Subsequent analyses are required to improve the robustness of our results and rule out horizontal pleiotropy.© 2023. The Author(s)."
,No,20230504,methods,37074140,Effects of Repeated Freeze and Thaw Cycles on the Genome-Wide DNA Methylation Profile of Isolated Genomic DNA.,Biopreserv Biobank,"The characterization of DNA methylation patterns to identify epigenetic markers for complex human diseases is an important and rapidly evolving part in biomedical research. DNA samples collected and stored in clinical biobanks over the past years are an important source for future epigenetic studies. Isolated gDNA is considered stable when stored at low temperatures for several years. However, the effect of multiple use and the associated repeated thawing of long-term stored DNA samples on DNA methylation patterns has not yet been investigated. In this study, we examined the influence of up to 10 freeze and thaw cycles on global DNA methylation by comparing genome-wide methylation profiles. DNA samples from 19 healthy volunteers were either frozen at -80°C or subjected to up to 10 freeze and thaw cycles. Genome-wide DNA methylation was analyzed after 0, 1, 3, 5, or 10 thaw cycles using the Illumina Infinium MethylationEPIC BeadChip. Evaluation of the global DNA methylation profile by beta-value density plots and multidimensional scaling plots revealed an expected clear participant-dependent variability, but a very low variability depending on the freeze and thaw cycles. In accordance, no significant difference in any of the methylated cytosine/guanine sites studied could be detected in the performed statistical analyses. Our results suggest that long-term frozen DNA samples are still suitable for epigenetic studies after multiple thaw cycles."
,No,20230504,dnamage,37107599,"Changes in Loneliness, BDNF, and Biological Aging Predict Trajectories in a Blood-Based Epigenetic Measure of Cortical Aging: A Study of Older Black Americans.",Genes (Basel),"A recent epigenetic measure of aging has developed based on human cortex tissue. This cortical clock (CC) dramatically outperformed extant blood-based epigenetic clocks in predicting brain age and neurological degeneration. Unfortunately, measures that require brain tissue are of limited utility to investigators striving to identify everyday risk factors for dementia. The present study investigated the utility of using the CpG sites included in the CC to formulate a peripheral blood-based cortical measure of brain age (CC-Bd). To establish the utility of CC-Bd, we used growth curves with individually varying time points and longitudinal data from a sample of 694 aging African Americans. We examined whether three risk factors that have been linked to cognitive decline-loneliness, depression, and BDNFm-predicted CC-Bd after controlling for several factors, including three new-generation epigenetic clocks. Our findings showed that two clocks-DunedinPACE and PoAm-predicted CC-BD, but that increases in loneliness and BDNFm continued to be robust predictors of accelerated CC-Bd even after taking these effects into account. This suggests that CC-Bd is assessing something more than the pan-tissue epigenetic clocks but that, at least in part, brain health is also associated with the general aging of the organism."
,Yes,20230504,ewas,37120575,Prenatal phthalate exposure and cord blood DNA methylation.,Sci Rep,"Exposure to phthalates has been shown to impede the human endocrine system, resulting in deleterious effects on pregnant women and their children. Phthalates modify DNA methylation patterns in infant cord blood. We examined the association between prenatal phthalate exposure and DNA methylation patterns in cord blood in a Korean birth cohort. Phthalate levels were measured in 274 maternal urine samples obtained during late pregnancy and 102 neonatal urine samples obtained at birth, and DNA methylation levels were measured in cord blood samples. For each infant in the cohort, associations between CpG methylation and both maternal and neonate phthalate levels were analyzed using linear mixed models. The results were combined with those from a meta-analysis of the levels of phthalates in maternal and neonatal urine samples, which were also analyzed for MEOHP, MEHHP, MnBP, and DEHP. This meta-analysis revealed significant associations between the methylation levels of CpG sites near the CHN2 and CUL3 genes, which were also associated with MEOHP and MnBP in neonatal urine. When the data were stratified by the sex of the infant, MnBP concentration was found to be associated with one CpG site near the OR2A2 and MEGF11 genes in female infants. In contrast, the concentrations of the three maternal phthalates showed no significant association with CpG site methylation. Furthermore, the data identified distinct differentially methylated regions in maternal and neonatal urine samples following exposure to phthalates. The CpGs with methylation levels that were positively associated with phthalate levels (particularly MEOHP and MnBP) were found to be enriched genes and related pathways. These results indicate that prenatal phthalate exposure is significantly associated with DNA methylation at multiple CpG sites. These alterations in DNA methylation may serve as biomarkers of maternal exposure to phthalates in infants and are potential candidates for investigating the mechanisms by which phthalates impact maternal and neonatal health.© 2023. The Author(s)."
,No,20230504,dnamage,37076473,Multi-omic underpinnings of epigenetic aging and human longevity.,Nat Commun,"Biological aging is accompanied by increasing morbidity, mortality, and healthcare costs; however, its molecular mechanisms are poorly understood. Here, we use multi-omic methods to integrate genomic, transcriptomic, and metabolomic data and identify biological associations with four measures of epigenetic age acceleration and a human longevity phenotype comprising healthspan, lifespan, and exceptional longevity (multivariate longevity). Using transcriptomic imputation, fine-mapping, and conditional analysis, we identify 22 high confidence associations with epigenetic age acceleration and seven with multivariate longevity. FLOT1, KPNA4, and TMX2 are novel, high confidence genes associated with epigenetic age acceleration. In parallel, cis-instrument Mendelian randomization of the druggable genome associates TPMT and NHLRC1 with epigenetic aging, supporting transcriptomic imputation findings. Metabolomics Mendelian randomization identifies a negative effect of non-high-density lipoprotein cholesterol and associated lipoproteins on multivariate longevity, but not epigenetic age acceleration. Finally, cell-type enrichment analysis implicates immune cells and precursors in epigenetic age acceleration and, more modestly, multivariate longevity. Follow-up Mendelian randomization of immune cell traits suggests lymphocyte subpopulations and lymphocytic surface molecules affect multivariate longevity and epigenetic age acceleration. Our results highlight druggable targets and biological pathways involved in aging and facilitate multi-omic comparisons of epigenetic clocks and human longevity.© 2023. This is a U.S. Government work and not under copyright protection in the US; foreign copyright protection may apply."
,No,20230504,single-cell,37034737,A single-nucleus transcriptome-wide association study implicates novel genes in depression pathogenesis.,medRxiv,"Depression is a common psychiatric illness and global public health problem. However, our limited understanding of the biological basis of depression has hindered the development of novel treatments and interventions.To identify new candidate genes for therapeutic development, we examined single-nucleus RNA sequencing (snucRNAseq) data from the dorsolateral prefrontal cortex (N=424) in relation to ante-mortem depressive symptoms. To complement these direct analyses, we also used genome- wide association study (GWAS) results for depression (N=500,199) along with genetic tools for inferring the expression of 22,159 genes in 7 cell types and 55 cell subtypes to perform transcriptome-wide association studies (TWAS) of depression followed by Mendelian randomization (MR).Our single-nucleus TWAS analysis identified 71 causal genes in depression that have a role in specific neocortical cell subtypes; 59 of 71 genes were novel compared to previous studies. Depression TWAS genes showed a cell type specific pattern, with the greatest enrichment being in both excitatory and inhibitory neurons as well as astrocytes. Gene expression in different neuron subtypes have different directions of effect on depression risk. Compared to lower genetically correlated traits (e.g. body mass index) with depression, higher correlated traits (e.g., neuroticism) have more common TWAS genes with depression. In parallel, we performed differential gene expression analysis in relation to depression in 55 cortical cell subtypes, and we found that genes such asANKRD36,MADD,TAOK3,SCAIandCHUKare associated with depression in specific cell subtypes.These two sets of analyses illustrate the utility of large snucRNAseq data to uncover both genes whose expression is altered in specific cell subtypes in the context of depression and to enhance the interpretation of well-powered GWAS so that we can prioritize specific susceptibility genes for further analysis and therapeutic development."
,No,20230504,omics,37082508,Multi-omic integration via similarity network fusion to detect molecular subtypes of ageing.,Brain Commun,"Molecular subtyping of brain tissue provides insights into the heterogeneity of common neurodegenerative conditions, such as Alzheimer's disease. However, existing subtyping studies have mostly focused on single data modalities and only those individuals with severe cognitive impairment. To address these gaps, we applied similarity network fusion, a method capable of integrating multiple high-dimensional multi-omic data modalities simultaneously, to an elderly sample spanning the full spectrum of cognitive ageing trajectories. We analyzed human frontal cortex brain samples characterized by five omic modalities: bulk RNA sequencing (18 629 genes), DNA methylation (53 932 CpG sites), histone acetylation (26 384 peaks), proteomics (7737 proteins) and metabolomics (654 metabolites). Similarity network fusion followed by spectral clustering was used for subtype detection, and subtype numbers were determined by Eigen-gap and rotation cost statistics. Normalized mutual information determined the relative contribution of each modality to the fused network. Subtypes were characterized by associations with 13 age-related neuropathologies and cognitive decline. Fusion of all five data modalities (n= 111) yielded two subtypes (nS1= 53,nS2= 58), which were nominally associated with diffuse amyloid plaques; however, this effect was not significant after correction for multiple testing. Histone acetylation (normalized mutual information = 0.38), DNA methylation (normalized mutual information = 0.18) and RNA abundance (normalized mutual information = 0.15) contributed most strongly to this network. Secondary analysis integrating only these three modalities in a larger subsample (n= 513) indicated support for both three- and five-subtype solutions, which had significant overlap, but showed varying degrees of internal stability and external validity. One subtype showed marked cognitive decline, which remained significant even after correcting for tests across both three- and five-subtype solutions (pBonf= 5.9 × 10-3). Comparison to single-modality subtypes demonstrated that the three-modal subtypes were able to uniquely capture cognitive variability. Comprehensive sensitivity analyses explored influences of sample size and cluster number parameters. We identified highly integrative molecular subtypes of ageing derived from multiple high dimensional, multi-omic data modalities simultaneously. Fusing RNA abundance, DNA methylation, and histone acetylation measures generated subtypes that were associated with cognitive decline. This work highlights the potential value and challenges of multi-omic integration in unsupervised subtyping of post-mortem brain.© The Author(s) 2023. Published by Oxford University Press on behalf of the Guarantors of Brain."
