"pmid","title","source","abstract"
"35452290","Genome-wide pleiotropy analysis of coronary artery disease and pneumonia identifies shared immune pathways.","Sci Adv","Coronary artery disease (CAD) remains the leading cause of death despite scientific advances. Elucidating shared CAD/pneumonia pathways may reveal novel insights regarding CAD pathways. We performed genome-wide pleiotropy analyses of CAD and pneumonia, examined the causal effects of the expression of genes near independently replicated SNPs and interacting genes with CAD and pneumonia, and tested interactions between disruptive coding mutations of each pleiotropic gene and smoking status on CAD and pneumonia risks. Identified pleiotropic SNPs were annotated toADAMTS7andIL6R. IncreasedADAMTS7expression across tissues consistently showed decreased risk for CAD and increased risk for pneumonia; increasedIL6Rexpression showed increased risk for CAD and decreased risk for pneumonia. We similarly observed opposing CAD/pneumonia effects forNLRP3. ReducedADAMTS7expression conferred a reduced CAD risk without increased pneumonia risk only among never-smokers. Genetic immune-inflammatory axes of CAD linked to respiratory infections implicateADAMTS7andIL6R, and related genes."
"35441136","Unbiased metabolome screen leads to personalized medicine strategy for amyotrophic lateral sclerosis.","Brain Commun","Amyotrophic lateral sclerosis is a rapidly progressive neurodegenerative disease that affects 1/350 individuals in the United Kingdom. The cause of amyotrophic lateral sclerosis is unknown in the majority of cases. Two-sample Mendelian randomization enables causal inference between an exposure, such as the serum concentration of a specific metabolite, and disease risk. We obtained genome-wide association study summary statistics for serum concentrations of 566 metabolites which were population matched with a genome-wide association study of amyotrophic lateral sclerosis. For each metabolite, we performed Mendelian randomization using an inverse variance weighted estimate for significance testing. After stringent Bonferroni multiple testing correction, our unbiased screen revealed three metabolites that were significantly linked to the risk of amyotrophic lateral sclerosis: Estrone-3-sulphate and bradykinin were protective, which is consistent with literature describing a male preponderance of amyotrophic lateral sclerosis and a preventive effect of angiotensin-converting enzyme inhibitors which inhibit the breakdown of bradykinin. Serum isoleucine was positively associated with amyotrophic lateral sclerosis risk. All three metabolites were supported by robust Mendelian randomization measures and sensitivity analyses; estrone-3-sulphate and isoleucine were confirmed in a validation amyotrophic lateral sclerosis genome-wide association study. Estrone-3-sulphate is metabolized to the more active estradiol by the enzyme 17β-hydroxysteroid dehydrogenase 1; further, Mendelian randomization demonstrated a protective effect of estradiol and rare variant analysis showed that missense variants withinHSD17B1, the gene encoding 17β-hydroxysteroid dehydrogenase 1, modify risk for amyotrophic lateral sclerosis. Finally, in a zebrafish model ofC9ORF72-amyotrophic lateral sclerosis, we present evidence that estradiol is neuroprotective. Isoleucine is metabolized via methylmalonyl-CoA mutase encoded by the geneMMUTin a reaction that consumes vitamin B12. Multivariable Mendelian randomization revealed that the toxic effect of isoleucine is dependent on the depletion of vitamin B12; consistent with this, rare variants which reduce the function ofMMUTare protective against amyotrophic lateral sclerosis. We propose that amyotrophic lateral sclerosis patients and family members with high serum isoleucine levels should be offered supplementation with vitamin B12.© The Author(s) 2022. Published by Oxford University Press on behalf of the Guarantors of Brain."
"35441133","The role of critical immune genes in brain disorders: insights from neuroimaging immunogenetics.","Brain Commun","Genetic variants in the human leukocyte antigen and killer cell immunoglobulin-like receptor regions have been associated with many brain-related diseases, but how they shape brain structure and function remains unclear. To identify the genetic variants inHLAandKIRgenes associated with human brain phenotypes, we performed a genetic association study of ∼30 000 European unrelated individuals using brain MRI phenotypes generated by the UK Biobank (UKB). We identified 15HLAalleles inHLAclass I and class II genes significantly associated with at least one brain MRI-based phenotypes (P < 5 × 10-8). These associations converged on several main haplotypes within theHLA. In particular, the human leukocyte antigen alleles within an ancestral haplotype 8.1 were associated with multiple MRI measures, including grey matter volume, cortical thickness (TH) and diffusion MRI (dMRI) metrics. These alleles have been strongly associated with schizophrenia. Additionally, associations were identified betweenHLA-DRB1*04∼DQA1*03:01∼DQB1*03:02 and isotropic volume fraction of diffusion MRI in multiple white matter tracts. This haplotype has been reported to be associated with Parkinson's disease. These findings suggest shared genetic associations between brain MRI biomarkers and brain-related diseases. Additionally, we identified 169 associations between the complement component 4 (C4) gene and imaging phenotypes. We found thatC4gene copy number was associated with cortical TH and dMRI metrics. NoKIRgene copy numbers were associated with image-derived phenotypes at genome-wide threshold. To address the multiple testing burden in the phenome-wide association study, we performed a multi-trait association analysis using trait-based association test that uses extended Simes procedure and identified MRI image-specific associations. This study contributes to insight into how critical immune genes affect brain-related traits as well as the development of neurological and neuropsychiatric disorders.© The Author(s) 2022. Published by Oxford University Press on behalf of the Guarantors of Brain."
"35494246","Genomic and dietary discontinuities during the Mesolithic and Neolithic in Sicily.","iScience","Sicily is a key region for understanding the agricultural transition in the Mediterranean because of its central position. Here, we present genomic and stable isotopic data for 19 prehistoric Sicilians covering the Mesolithic to Bronze Age periods (10,700-4,100 yBP). We find that Early Mesolithic hunter-gatherers (HGs) from Sicily are a highly drifted lineage of the Early Holocene western European HGs, whereas Late Mesolithic HGs carry ∼20% ancestry related to northern and (south) eastern European HGs, indicating substantial gene flow. Early Neolithic farmers are genetically most similar to farmers from the Balkans and Greece, with only ∼7% of ancestry from local Mesolithic HGs. The genetic discontinuities during the Mesolithic and Early Neolithic match the changes in material culture and diet. Three outlying individuals dated to ∼8,000 yBP; however, suggest that hunter-gatherers interacted with incoming farmers atGrotta dell'Uzzo, resulting in a mixed economy and diet for a brief interlude at the Mesolithic-Neolithic transition.© 2022 The Author(s)."
"35547816","Effects of the Zbtb1 Gene on Chromatin Spatial Structure and Lymphatic Development: Combined Analysis of Hi-C, ATAC-Seq and RNA-Seq.","Front Cell Dev Biol","Zbtb1 (zinc finger and BTB domain containing 1) is a member of mammalian zbtb gene family. A series of bioinformatics analysis was carried out for the EL4 cell and the Zbtb1-deficient EL4 cell by Hi-C, ATAC-seq and RNA-seq techniques. Finally, Hi-C results showed that the intensity of chromatin interaction in the deletion group decreased with distance, the degree of chromosome interaction decreased significantly, the AB division region changed significantly, and the compactness of TAD structure decreased; The results of ATAC-seq showed that the open area and degree of chromatin in the deletion group decreased; 7778 differentially expressed mRNAs were found by RNA-seq. Our experimental results for the first time expounded the significance of Zbtb1 gene for T cell development, lymphocyte production and apoptosis from the aspects of chromosome spatial structure and chromatin opening degree, and provided relevant theoretical basis and data support for the in-depth study of related Zbtb1 genes in the future.Copyright © 2022 Wang, Shi, Cheng, Lu, Zhang, Li, Sun, Li, Li, Zeng, Wang and Cao."
"35505076","Can adult polygenic scores improve prediction of body mass index in childhood?","Int J Obes (Lond)","Modelling genetic pre-disposition may identify children at risk of obesity. However, most polygenic scores (PGSs) have been derived in adults, and lack validation during childhood. This study compared the utility of existing large-scale adult-derived PGSs to predict common anthropometric traits (body mass index (BMI), waist circumference, and body fat) in children and adults, and examined whether childhood BMI prediction could be improved by combining PGSs and non-genetic factors (maternal and earlier child BMI).Participants (n = 1365 children, and n = 2094 adults made up of their parents) were drawn from the Longitudinal Study of Australian Children. Children were weighed and measured every two years from 0-1 to 12-13 years, and adults were measured or self-reported measurements were obtained concurrently (average analysed). Participants were genotyped from blood or oral samples, and PGSs were derived based on published genome-wide association studies. We used linear regression to compare the relative utility of these PGSs to predict their respective traits at different ages.BMI PGSs explained up to 12% of child BMI z-score variance in 10-13 year olds, compared with up to 15% in adults. PGSs for waist circumference and body fat explained less variance (up to 8%). An interaction between BMI PGSs and puberty (p = 0.001-0.002) suggests the effect of some variants may differ across the life course. Individual BMI measures across childhood predicted 10-60% of the variance in BMI at 12-13 years, and maternal BMI and BMI PGS each added 1-9% above this.Adult-derived PGSs for BMI, particularly those derived by modelling between-variant interactions, may be useful for predicting BMI during adolescence with similar accuracy to that obtained in adulthood. The level of precision presented here to predict BMI during childhood may be relevant to public health, but is likely to be less useful for individual clinical purposes.© 2022. The Author(s), under exclusive licence to Springer Nature Limited."
"35459784","Genetic susceptibility to patient-reported xerostomia among long-term oropharyngeal cancer survivors.","Sci Rep","Genetic susceptibility for xerostomia, a common sequela of radiotherapy and chemoradiotherapy for head and neck cancer, is unknown. Therefore, to identify genetic variants associated with moderate to severe xerostomia, we conducted a GWAS of 359 long-term oropharyngeal cancer (OPC) survivors using 579,956 autosomal SNPs. Patient-reported cancer treatment-related xerostomia was assessed using the MD Anderson Symptom Inventory. Patient response was dichotomized as moderate to severe or none to mild symptoms. In our study, 39.2% of OPC survivors reported moderate to severe xerostomia. Our GWAS identified eight SNPs suggestively associated with higher risk of moderate to severe xerostomia in six genomic regions (2p13.3, rs6546481, Minor Allele (MA) = A, ANTXR1, P = 4.3 × 10-7; 5p13.2-p13.1, rs16903936, MA = G, EGFLAM, P = 5.1 × 10-6; 4q21.1, rs10518156, MA = G, SHROOM3, P = 7.1 × 10-6; 19q13.42, rs11882068, MA = G, NLRP9, P = 1.7 × 10-5; 12q24.33, rs4760542, MA = G, GLT1D1, P = 1.8 × 10-5; and 3q27.3, rs11714564, MA = G, RTP1, P = 2.9 × 10-5. Seven SNPs were associated with lower risk of moderate to severe xerostomia, of which only one mapped to specific genomic region (15q21.3, rs4776140, MA = G, LOC105370826, a ncRNA class RNA gene, P = 1.5 × 10-5). Although our small exploratory study did not reach genome-wide statistical significance, our study provides, for the first time, preliminary evidence of genetic susceptibility to xerostomia. Further studies are needed to elucidate the role of genetic susceptibility to xerostomia.© 2022. The Author(s)."
"35575915","Machine learning: its challenges and opportunities in plant system biology.","Appl Microbiol Biotechnol","Sequencing technologies are evolving at a rapid pace, enabling the generation of massive amounts of data in multiple dimensions (e.g., genomics, epigenomics, transcriptomic, metabolomics, proteomics, and single-cell omics) in plants. To provide comprehensive insights into the complexity of plant biological systems, it is important to integrate different omics datasets. Although recent advances in computational analytical pipelines have enabled efficient and high-quality exploration and exploitation of single omics data, the integration of multidimensional, heterogenous, and large datasets (i.e., multi-omics) remains a challenge. In this regard, machine learning (ML) offers promising approaches to integrate large datasets and to recognize fine-grained patterns and relationships. Nevertheless, they require rigorous optimizations to process multi-omics-derived datasets. In this review, we discuss the main concepts of machine learning as well as the key challenges and solutions related to the big data derived from plant system biology. We also provide in-depth insight into the principles of data integration using ML, as well as challenges and opportunities in different contexts including multi-omics, single-cell omics, protein function, and protein-protein interaction. KEY POINTS: • The key challenges and solutions related to the big data derived from plant system biology have been highlighted. • Different methods of data integration have been discussed. • Challenges and opportunities of the application of machine learning in plant system biology have been highlighted and discussed.© 2022. The Author(s), under exclusive licence to Springer-Verlag GmbH Germany, part of Springer Nature."
"35529103","Asymmetric Predictive Relationships Across Histone Modifications.","Nat Mach Intell","Decoding the epigenomic landscapes in diverse tissues and cell types is fundamental to understanding molecular mechanisms underlying many essential cellular processes and human diseases. Recent advances in artificial intelligence provide new methods and strategies for imputing unknown epigenomes based on existing data, yet how to reveal the predictive relationships among epigenetic marks remains largely unexplored. Here we present a machine learning approach for epigenomic imputation and interpretation. Through dissection of the spatial contributions from six histone marks, we reveal the prevalent and asymmetric cross-prediction relationships among these marks. Meanwhile, our approach achieved high predictive performance on held-out prospective epigenomes and outperformed the state-of-the-art. To facilitate future research, we further applied this approach to impute a total of 527 and 2,455 unavailable genome-wide histone modification signal tracks for the ENCODE3 and Roadmap datasets, respectively."
"35564961","The Interaction Effect of Parental Rejection and Oxytocin Receptor Gene Polymorphism on Depression: A Cross-Cultural Study in Non-Clinical Samples.","Int J Environ Res Public Health","Parental rejection has been consistently empirically implicated in a wide array of developmental, behavioural and psychological problems worldwide. However, the interaction effect between parental rejection in childhood and the oxytocin receptor genotype on psychological adjustment has yet to be investigated. The present study aimed to investigate gene-environment interaction effects between parental rejection (maternal and paternal) and oxytocin receptor (OXTR) gene polymorphisms (rs53576 and rs2254298) on depressive symptoms in adults in different cultural contexts. Adults from Italy and Japan (N= 133, age = 18-27 years, females = 68) were preliminarily genotyped and then completed the Parental Acceptance-Rejection Questionnaire for mothers and fathers and the Beck Depression Inventory. Hierarchical multiple regression analysis showed that paternal rejection was related to self-reported depression and that the effect of parental rejection was moderated by OXTR gene polymorphisms and nationality. Among Italians, OXTR rs2254298 A-carriers showed resilience to negative early parental care, whereas among Japanese, OXTR rs53576 non-A-carriers showed resistance to negative early paternal care. These findings align with expected relations between perceived acceptance-rejection and an individual's psychological adjustment, as proposed by interpersonal acceptance-rejection theory, and indicate the need for future studies adopting a multicultural and multilevel approach to better understand how the effects of parental rejection extend into adulthood."
"35545683","A multi-step genomic approach prioritized TBKBP1 gene as relevant for multiple sclerosis susceptibility.","J Neurol","Over 200 genetic loci have been associated with multiple sclerosis (MS) explaining ~ 50% of its heritability, suggesting that additional mechanisms may account for the ""missing heritability"" phenomenon.To analyze a large cohort of Italian individuals to identify markers associated with MS with potential functional impact in the disease.We studied 2571 MS and 3234 healthy controls (HC) of continental Italian origin. Discovery phase included a genome wide association study (1727 MS, 2258 HC), with SNPs selected according to their association in the Italian cohort only or in a meta-analysis of signals with a cohort of European ancestry (4088 MS, 7144 HC). Top associated loci were then tested in two Italian cohorts through array-based genotyping (903 MS, 884 HC) and pool-based target sequencing (588 MS, 408 HC). Finally, functional prioritization through conditional eQTL and mQTL has been performed.Top associated signals overlap with already known MS loci on chromosomes 3 and 17. Three SNPs (rs4267364, rs8070463, rs67919208), all involved in the regulation of TBKBP1, were prioritized to be functionally relevant.No evidence of novel signal of association with MS specific for the Italian continental population has been found; nevertheless, two MS loci seems to play a relevant role, raising the interest to further investigations for TBKBP1 gene.© 2022. The Author(s)."
"35440538","High-quality genome and methylomes illustrate features underlying evolutionary success of oaks.","Nat Commun","The genus Quercus, which emerged ∼55 million years ago during globally warm temperatures, diversified into ∼450 extant species. We present a high-quality de novo genome assembly of a California endemic oak, Quercus lobata, revealing features consistent with oak evolutionary success. Effective population size remained large throughout history despite declining since early Miocene. Analysis of 39,373 mapped protein-coding genes outlined copious duplications consistent with genetic and phenotypic diversity, both by retention of genes created during the ancient γ whole genome hexaploid duplication event and by tandem duplication within families, including numerous resistance genes and a very large block of duplicated DUF247 genes, which have been found to be associated with self-incompatibility in grasses. An additional surprising finding is that subcontext-specific patterns of DNA methylation associated with transposable elements reveal broadly-distributed heterochromatin in intergenic regions, similar to grasses. Collectively, these features promote genetic and phenotypic variation that would facilitate adaptability to changing environments.© 2022. The Author(s)."
"35501679","Bringing machine learning to research on intellectual and developmental disabilities: taking inspiration from neurological diseases.","J Neurodev Disord","Intellectual and Developmental Disabilities (IDDs), such as Down syndrome, Fragile X syndrome, Rett syndrome, and autism spectrum disorder, usually manifest at birth or early childhood. IDDs are characterized by significant impairment in intellectual and adaptive functioning, and both genetic and environmental factors underpin IDD biology. Molecular and genetic stratification of IDDs remain challenging mainly due to overlapping factors and comorbidity. Advances in high throughput sequencing, imaging, and tools to record behavioral data at scale have greatly enhanced our understanding of the molecular, cellular, structural, and environmental basis of some IDDs. Fueled by the ""big data"" revolution, artificial intelligence (AI) and machine learning (ML) technologies have brought a whole new paradigm shift in computational biology. Evidently, the ML-driven approach to clinical diagnoses has the potential to augment classical methods that use symptoms and external observations, hoping to push the personalized treatment plan forward. Therefore, integrative analyses and applications of ML technology have a direct bearing on discoveries in IDDs. The application of ML to IDDs can potentially improve screening and early diagnosis, advance our understanding of the complexity of comorbidity, and accelerate the identification of biomarkers for clinical research and drug development. For more than five decades, the IDDRC network has supported a nexus of investigators at centers across the USA, all striving to understand the interplay between various factors underlying IDDs. In this review, we introduced fast-increasing multi-modal data types, highlighted example studies that employed ML technologies to illuminate factors and biological mechanisms underlying IDDs, as well as recent advances in ML technologies and their applications to IDDs and other neurological diseases. We discussed various molecular, clinical, and environmental data collection modes, including genetic, imaging, phenotypical, and behavioral data types, along with multiple repositories that store and share such data. Furthermore, we outlined some fundamental concepts of machine learning algorithms and presented our opinion on specific gaps that will need to be filled to accomplish, for example, reliable implementation of ML-based diagnosis technology in IDD clinics. We anticipate that this review will guide researchers to formulate AI and ML-based approaches to investigate IDDs and related conditions.© 2022. The Author(s)."
"35468996","Drivers of genomic loss of heterozygosity in leiomyosarcoma are distinct from carcinomas.","NPJ Precis Oncol","Leiomyosarcoma (LMS) is a rare, aggressive, mesenchymal tumor. Subsets of LMS have been identified to harbor genomic alterations associated with homologous recombination deficiency (HRD); particularly alterations in BRCA2. Whereas genomic loss of heterozygosity (gLOH) has been used as a surrogate marker of HRD in other solid tumors, the prognostic or clinical value of gLOH in LMS (gLOH-LMS) remains poorly defined. We explore the genomic drivers associated with gLOH-LMS and their clinical import. Although the distribution of gLOH-LMS scores are similar to that of carcinomas, outside of BRCA2, there was no overlap with previously published gLOH-associated genes from studies in carcinomas. We note that early stage tumors with elevated gLOH demonstrated a longer disease-free interval following resection in LMS patients. Taken together, and despite similarities to carcinomas in gLOH distribution and clinical import, gLOH-LMS are driven by different genomic signals. Additional studies will be required to isolate and confirm the unique differences in biological factors driving these differences.© 2022. The Author(s)."
