"pmid","title","source","abstract"
"35559253","Immune-Associated Gene Signatures and Subtypes to Predict the Progression of Atherosclerotic Plaques Based on Machine Learning.","Front Pharmacol","Objective:Experimental and clinical evidence suggests that atherosclerosis is a chronic inflammatory disease. Our study was conducted for uncovering the roles of immune-associated genes during atherosclerotic plaque progression.Methods:Gene expression profiling of GSE28829, GSE43292, GSE41571, and GSE120521 datasets was retrieved from the GEO database. Three machine learning algorithms, least absolute shrinkage, and selection operator (LASSO), random forest, and support vector machine-recursive feature elimination (SVM-RFE) were utilized for screening characteristic genes among atherosclerotic plaque progression- and immune-associated genes. ROC curves were generated for estimating the diagnostic efficacy. Immune cell infiltrations were estimated via ssGSEA, and immune checkpoints were quantified. CMap analysis was implemented to screen potential small-molecule compounds. Atherosclerotic plaque specimens were classified using a consensus clustering approach.Results:Seven characteristic genes (TNFSF13B, CCL5, CCL19, ITGAL, CD14, GZMB, and BTK) were identified, which enabled the prediction of progression of atherosclerotic plaques. Higher immune cell infiltrations and immune checkpoint expressions were found in advanced-stage than in early-stage atherosclerotic plaques and were positively linked to characteristic genes. Patients could clinically benefit from the characteristic gene-based nomogram. Several small molecular compounds were predicted based on the characteristic genes. Two subtypes, namely, C1 immune subtype and C2 non-immune subtype, were classified across atherosclerotic plaques. The characteristic genes presented higher expression in C1 than in C2 subtypes.Conclusion:Our findings provide several promising atherosclerotic plaque progression- and immune-associated genes as well as immune subtypes, which might enable to assist the design of more accurately tailored cardiovascular immunotherapy.Copyright © 2022 Yang, Yi, Cai, Zhang and Xu."
"35479513","Analyzing and validating the prognostic value and immune microenvironment of clear cell renal cell carcinoma.","Anim Cells Syst (Seoul)","Tumor immune microenvironment (TIME) plays an important role in tumor diagnosis, prevention, treatment and prognosis. However, the correlation and potential mechanism between clear cell renal cell carcinoma(ccRCC) and its TIME are not clear. Therefore, we aimed to identify potential prognostic biomarkers related to TIME of ccRCC. Unsupervised consensus clustering analysis was performed to divide patients into different immune subgroups according to their single-sample gene set enrichment analysis (ssGSEA) scores. Then, we validated the differences in immune cell infiltration, prognosis, clinical characteristics and expression levels of HLA and immune checkpoint genes between different immune subgroups. Weighted gene coexpression network analysis (WGCNA) was used to identify the significant modules and hub genes that were related to the immune subgroups. A nomogram was established to predict the overall survival (OS) outcomes after independent prognostic factors were identified by least absolute shrinkage and selection operator (LASSO) regression and multivariate Cox regression analyses. Five clusters (immune subgroups) were identified. There was no significant difference in age, sex or N stage. And there were significant differences in race, T stage, M stage, grade, prognosis and tumor microenvironment. WGCNA revealed that the red module has an important relationship with TIME, and obtained 14 hub genes. In addition, the nomogram containingLAG3andGZMKaccurately predicted OS outcomes of ccRCC patients.LAG3andGZMKhave a certain correlation with the prognosis of ccRCC patients, and play an important role in the TIME. These two hub genes deserve further study as biomarkers of the TIME.© 2022 The Author(s). Published by Informa UK Limited, trading as Taylor & Francis Group."
"35585555","Temporal relationship among adiposity, gut microbiota, and insulin resistance in a longitudinal human cohort.","BMC Med","The temporal relationship between adiposity and gut microbiota was unexplored. Whether some gut microbes lie in the pathways from adiposity to insulin resistance is less clear. Our study aims to reveal the temporal relationship between adiposity and gut microbiota and investigate whether gut microbiota may mediate the association of adiposity with insulin resistance in a longitudinal human cohort study.We obtained repeated-measured gut shotgun metagenomic and anthropometric data from 426 Chinese participants over ~3 years of follow-up. Cross-lagged path analysis was used to examine the temporal relationship between BMI and gut microbial features. The associations between the gut microbes and insulin resistance-related phenotypes were examined using a linear mixed-effect model. We examined the mediation effect of gut microbes on the association between adiposity and insulin resistance-related phenotypes. Replication was performed in the HMP cohort.Baseline BMI was prospectively associated with levels of ten gut microbial species. Among them, results of four species (Adlercreutzia equolifaciens, Parabacteroides unclassified, Lachnospiraceae bacterium 3 1 57FAA CT1, Lachnospiraceae bacterium 7 1 58FAA) were replicated in the independent HMP cohort. Lachnospiraceae bacterium 3 1 57FAA CT1 was inversely associated with HOMA-IR and fasting insulin. Lachnospiraceae bacterium 3 1 57FAA CT1 mediated the association of overweight/obesity with HOMA-IR (FDR<0.05). Furthermore, Lachnospiraceae bacterium 3 1 57FAA CT1 was positively associated with the butyrate-producing pathway PWY-5022 (p < 0.001).Our study identified one potentially beneficial microbe Lachnospiraceae bacterium 3 1 57FAA CT1, which might mediate the effect of adiposity on insulin resistance. The identified microbes are helpful for the discovery of novel therapeutic targets, as to mitigate the impact of adiposity on insulin resistance.© 2022. The Author(s)."
"35551445","Altered DNA methylation at age-associated CpG sites in children with growth disorders: impact on age estimation?","Int J Legal Med","Age estimation based on DNA methylation (DNAm) can be applied to children, adolescents and adults, but many CG dinucleotides (CpGs) exhibit different kinetics of age-associated DNAm across these age ranges. Furthermore, it is still unclear how growth disorders impact epigenetic age predictions, and this may be particularly relevant for a forensic application. In this study, we analyzed buccal mucosa samples from 95 healthy children and 104 children with different growth disorders. DNAm was analysed by pyrosequencing for 22 CpGs in the genes PDE4C, ELOVL2, RPA2, EDARADD and DDO. The relationship between DNAm and age in healthy children was tested by Spearman's rank correlation. Differences in DNAm between the groups ""healthy children"" and the (sub-)groups of children with growth disorders were tested by ANCOVA. Models for age estimation were trained (1) based on the data from 11 CpGs with a close correlation between DNAm and age (R ≥ 0.75) and (2) on five CpGs that also did not present significant differences in DNAm between healthy and diseased children. Statistical analysis revealed significant differences between the healthy group and the group with growth disorders (11 CpGs), the subgroup with a short stature (12 CpGs) and the non-short stature subgroup (three CpGs). The results are in line with the assumption of an epigenetic regulation of height-influencing genes. Age predictors trained on 11 CpGs with high correlations between DNAm and age revealed higher mean absolute errors (MAEs) in the group of growth disorders (mean MAE 2.21 years versus MAE 1.79 in the healthy group) as well as in the short stature (sub-)groups; furthermore, there was a clear tendency for overestimation of ages in all growth disorder groups (mean age deviations: total growth disorder group 1.85 years, short stature group 1.99 years). Age estimates on samples from children with growth disorders were more precise when using a model containing only the five CpGs that did not present significant differences in DNAm between healthy and diseased children (mean age deviations: total growth disorder group 1.45 years, short stature group 1.66 years). The results suggest that CpGs in genes involved in processes relevant for growth and development should be avoided in age prediction models for children since they may be sensitive for alterations in the DNAm pattern in cases of growth disorders.© 2022. The Author(s)."
"35581654","Structural and functional specificity of H3K36 methylation.","Epigenetics Chromatin","The methylation of histone H3 at lysine 36 (H3K36me) is essential for maintaining genomic stability. Indeed, this methylation mark is essential for proper transcription, recombination, and DNA damage response. Loss- and gain-of-function mutations in H3K36 methyltransferases are closely linked to human developmental disorders and various cancers. Structural analyses suggest that nucleosomal components such as the linker DNA and a hydrophobic patch constituted by histone H2A and H3 are likely determinants of H3K36 methylation in addition to the histone H3 tail, which encompasses H3K36 and the catalytic SET domain. Interaction of H3K36 methyltransferases with the nucleosome collaborates with regulation of their auto-inhibitory changes fine-tunes the precision of H3K36me in mediating dimethylation by NSD2 and NSD3 as well as trimethylation by Set2/SETD2. The identification of specific structural features and various cis-acting factors that bind to different forms of H3K36me, particularly the di-(H3K36me2) and tri-(H3K36me3) methylated forms of H3K36, have highlighted the intricacy of H3K36me functional significance. Here, we consolidate these findings and offer structural insight to the regulation of H3K36me2 to H3K36me3 conversion. We also discuss the mechanisms that underlie the cooperation between H3K36me and other chromatin modifications (in particular, H3K27me3, H3 acetylation, DNA methylation and N6-methyladenosine in RNAs) in the physiological regulation of the epigenomic functions of chromatin.© 2022. The Author(s)."
"35534561","The disordered N-terminal domain of DNMT3A recognizes H2AK119ub and is required for postnatal development.","Nat Genet","DNA methyltransferase 3a (DNMT3A) plays a crucial role during mammalian development. Two isoforms of DNMT3A are differentially expressed from stem cells to somatic tissues, but their individual functions remain largely uncharacterized. Here we report that the long isoform DNMT3A1, but not the short DNMT3A2, is essential for mouse postnatal development. DNMT3A1 binds to and regulates bivalent neurodevelopmental genes in the brain. Strikingly, Dnmt3a1 knockout perinatal lethality could be partially rescued by DNMT3A1 restoration in the nervous system. We further show that the intrinsically disordered N terminus of DNMT3A1 is required for normal development and DNA methylation at DNMT3A1-enriched regions. Mechanistically, a ubiquitin-interacting motif embedded in a putative α-helix within the N terminus binds to mono-ubiquitinated histone H2AK119, probably mediating recruitment of DNMT3A1 to Polycomb-regulated regions. These data demonstrate an isoform-specific role for DNMT3A1 in mouse postnatal development and reveal the N terminus as a necessary regulatory domain for DNMT3A1 chromatin occupancy and functions in the nervous system.© 2022. The Author(s), under exclusive licence to Springer Nature America, Inc."
"35527295","Hypersexuality as a tip of the iceberg of a primary psychopathology: a joined position statement of the Italian Society of Andrology and Sexual Medicine (SIAMS) and of the Italian Society of Psychopathology (SOPSI).","J Endocrinol Invest","In the last years, hypersexual behavior has been broadly scientifically studied. The interest in this topic, belonging to psycho-sexology and sexual medicine, has been due to its still unclear aetiology, nature, and its manifestation in relationship with several organic and psychopathological conditions. So, the specialist (the psychologist, psychiatrist, endocrinologist, neurologist) may encounter some difficulties in diagnosing and managing this symptom. The first main objective of this position statement, which has been developed in collaboration between the Italian Society of Andrology and Sexual Medicine (SIAMS) and the Italian Society of Psychopathology (SOPSI) is to give to the reader evidence about the necessity to consider hypersexuality as a symptom related to another underlying condition. Following this consideration, the second main objective is to give specific statements, for the biopsychosocial assessment and the diagnosis of hypersexual behavior, developed on the basis of the most recent literature evidence. To develop a psycho-pharmacological treatment tailored on patients' needs, our suggestion is to assess the presence of specific comorbid psychopathological and organic conditions, and the impact of pharmacological treatments on the presence of an excess of sexual behavior. Finally, a suggestion of a standardized psychometric evaluation of hypersexuality will be given.© 2022. The Author(s), under exclusive licence to Italian Society of Endocrinology (SIE)."
"35585070","Extended intergenic DNA contributes to neuron-specific expression of neighboring genes in the mammalian nervous system.","Nat Commun","Mammalian genomes comprise largely intergenic noncoding DNA with numerous cis-regulatory elements. Whether and how the size of intergenic DNA affects gene expression in a tissue-specific manner remain unknown. Here we show that genes with extended intergenic regions are preferentially expressed in neural tissues but repressed in other tissues in mice and humans. Extended intergenic regions contain twice as many active enhancers in neural tissues compared to other tissues. Neural genes with extended intergenic regions are globally co-expressed with neighboring neural genes controlled by distinct enhancers in the shared intergenic regions. Moreover, generic neural genes expressed in multiple tissues have significantly longer intergenic regions than neural genes expressed in fewer tissues. The intergenic regions of the generic neural genes have many tissue-specific active enhancers containing distinct transcription factor binding sites specific to each neural tissue. We also show that genes with extended intergenic regions are enriched for neural genes only in vertebrates. The expansion of intergenic regions may reflect the regulatory complexity of tissue-type-specific gene expression in the nervous system.© 2022. The Author(s)."
"35508662","Transcriptional coupling of distant regulatory genes in living embryos.","Nature","The prevailing view of metazoan gene regulation is that individual genes are independently regulated by their own dedicated sets of transcriptional enhancers. Past studies have reported long-range gene-gene associations1-3, but their functional importance in regulating transcription remains unclear. Here we used quantitative single-cell live imaging methods to provide a demonstration of co-dependent transcriptional dynamics of genes separated by large genomic distances in living Drosophila embryos. We find extensive physical and functional associations of distant paralogous genes, including co-regulation by shared enhancers and co-transcriptional initiation over distances of nearly 250 kilobases. Regulatory interconnectivity depends on promoter-proximal tethering elements, and perturbations in these elements uncouple transcription and alter the bursting dynamics of distant genes, suggesting a role of genome topology in the formation and stability of co-transcriptional hubs. Transcriptional coupling is detected throughout the fly genome and encompasses a broad spectrum of conserved developmental processes, suggesting a general strategy for long-range integration of gene activity.© 2022. The Author(s), under exclusive licence to Springer Nature Limited."
"35504952","Investigating how the accuracy of teacher expectations of pupil performance relate to socioeconomic and genetic factors.","Sci Rep","Teacher expectations of pupil ability can influence educational progression, impacting subsequent streaming and exam level. Systematic discrepancies between teacher expectations of pupil achievement may therefore have a detrimental effect on children's education. Associations between socioeconomic and demographic factors with teacher expectation accuracy have been demonstrated, but it is not known how teacher expectations of achievement may relate to genetic factors. We investigated these relationships using nationally standardized exam results at ages 11 and 14 from a UK longitudinal cohort study. We found that teacher expectation of achievement was strongly correlated with educational test scores. Furthermore, the accuracy of teacher expectation was patterned by pupil socioeconomic background but not teacher characteristics. The accuracy of teacher expectation related to pupil's genetic liability to education as captured by a polygenic score for educational attainment. Despite correlation with the polygenic score, we found no strong evidence for genomewide SNP heritability in teacher reporting accuracy.© 2022. The Author(s)."
"35560143","A protocol for recruiting and analyzing the disease-oriented Russian disc degeneration study (RuDDS) biobank for functional omics studies of lumbar disc degeneration.","PLoS One","Lumbar intervertebral disc degeneration (DD) disease is one of the main risk factors for low back pain and a leading cause of population absenteeism and disability worldwide. Despite a variety of biological studies, lumbar DD is not yet fully understood, partially because there are only few studies that use systematic and integrative approaches. This urges the need for studies that integrate different omics (including genomics and transcriptomics) measured on samples within a single cohort. This protocol describes a disease-oriented Russian disc degeneration study (RuDDS) biobank recruitment and analyses aimed to facilitate further omics studies of lumbar DD integrating genomic, transcriptomic and glycomic data. A total of 1,100 participants aged over 18 with available lumbar MRI scans, medical histories and biological material (whole blood, plasma and intervertebral disc tissue samples from surgically treated patients) will be enrolled during the three-year period from two Russian clinical centers. Whole blood, plasma and disc tissue specimens will be used for genotyping with genome-wide SNP-arrays, glycome profiling and RNA sequencing, respectively. Omics data will be further used for a genome-wide association study of lumbar DD with in silico functional annotation, analysis of plasma glycome and lumbar DD disease interactions and transcriptomic data analysis including an investigation of differential expression patterns associated with lumbar DD disease. Statistical tests applied in each of the analyses will meet the standard criteria specific to the attributed study field. In a long term, the results of the study will expand fundamental knowledge about lumbar DD development and contribute to the elaboration of novel personalized approaches for disease prediction and therapy. Additionally to the lumbar disc degeneration study, a RuDDS cohort could be used for other genetic studies, as it will have unique omics data. Trial registration number NCT04600544."
"35484127","Kronos scRT: a uniform framework for single-cell replication timing analysis.","Nat Commun","Mammalian genomes are replicated in a cell type-specific order and in coordination with transcription and chromatin organization. Currently, single-cell replication studies require individual processing of sorted cells, yielding a limited number (<100) of cells. Here, we develop Kronos scRT, a software for single-cell Replication Timing (scRT) analysis. Kronos scRT does not require a specific platform or cell sorting, which allows investigating large datasets obtained from asynchronous cells. By applying our tool to published data as well as droplet-based single-cell whole-genome sequencing data generated in this study, we exploit scRT from thousands of cells for different mouse and human cell lines. Our results demonstrate that although genomic regions are frequently replicated around their population average RT, replication can occur stochastically throughout S phase. Altogether, Kronos scRT allows fast and comprehensive investigations of the RT programme at the single-cell resolution for both homogeneous and heterogeneous cell populations.© 2022. The Author(s)."
"35524165","CircMiMi: a stand-alone software for constructing circular RNA-microRNA-mRNA interactions across species.","BMC Bioinformatics","Circular RNAs (circRNAs) are a class of non-coding RNAs formed by pre-mRNA back-splicing, which are widely expressed in animal/plant cells and often play an important role in regulating microRNA (miRNA) activities. While numerous databases have collected a large amount of predicted circRNA candidates and provided the corresponding circRNA-regulated interactions, a stand-alone package for constructing circRNA-miRNA-mRNA interactions based on user-identified circRNAs across species is lacking.We present CircMiMi (circRNA-miRNA-mRNA interactions), a modular, Python-based software to identify circRNA-miRNA-mRNA interactions across 18 species (including 16 animals and 2 plants) with the given coordinates of circRNA junctions. The CircMiMi-constructed circRNA-miRNA-mRNA interactions are derived from circRNA-miRNA and miRNA-mRNA axes with the support of computational predictions and/or experimental data. CircMiMi also allows users to examine alignment ambiguity of back-splice junctions for checking circRNA reliability and examine reverse complementary sequences residing in the sequences flanking the circularized exons for investigating circRNA formation. We further employ CircMiMi to identify circRNA-miRNA-mRNA interactions based on the circRNAs collected in NeuroCirc, a large-scale database of circRNAs in the human brain. We construct circRNA-miRNA-mRNA interactions comprising differentially expressed circRNAs, and miRNAs in autism spectrum disorder (ASD) and cross-species analyze the relevance of the targets to ASD. We thus provide a rich set of ASD-associated circRNA-miRNA-mRNA axes and a useful starting point for investigation of regulatory mechanisms in ASD pathophysiology.CircMiMi allows users to identify circRNA-mediated interactions in multiple species, shedding light on regulatory roles of circRNAs. The software package and web interface are freely available at https://github.com/TreesLab/CircMiMi and http://circmimi.genomics.sinica.edu.tw/ , respectively.© 2022. The Author(s)."
"35440779","Genomics, convergent neuroscience and progress in understanding autism spectrum disorder.","Nat Rev Neurosci","More than a hundred genes have been identified that, when disrupted, impart large risk for autism spectrum disorder (ASD). Current knowledge about the encoded proteins - although incomplete - points to a very wide range of developmentally dynamic and diverse biological processes. Moreover, the core symptoms of ASD involve distinctly human characteristics, presenting challenges to interpreting evolutionarily distant model systems. Indeed, despite a decade of striking progress in gene discovery, an actionable understanding of pathobiology remains elusive. Increasingly, convergent neuroscience approaches have been recognized as an important complement to traditional uses of genetics to illuminate the biology of human disorders. These methods seek to identify intersection among molecular-level, cellular-level and circuit-level functions across multiple risk genes and have highlighted developing excitatory neurons in the human mid-gestational prefrontal cortex as an important pathobiological nexus in ASD. In addition, neurogenesis, chromatin modification and synaptic function have emerged as key potential mediators of genetic vulnerability. The continued expansion of foundational 'omics' data sets, the application of higher-throughput model systems and incorporating developmental trajectories and sex differences into future analyses will refine and extend these results. Ultimately, a systems-level understanding of ASD genetic risk holds promise for clarifying pathobiology and advancing therapeutics.© 2022. Springer Nature Limited."
