"pmid","title","source","abstract"
"35444348","Histochemistry, Cytochemistry and Epigenetics.","Acta Histochem Cytochem","Over the past few decades, many researchers have individually identified tumor-related genes, and have accumulated information on their basic research in a database. With the development of technology that can comprehensively test the expression status within a short time, oncogene panel testing has become attainable. On the other hand, changes in gene expression that do not depend on changes in base sequences, that is, epigenetics, or more comprehensively, epigenomes, are also highly involved in the development and progression of disease. Oncogene panel tests tend to focus on DNA base mutations such as point mutations, deletions, duplications, and chimera formation. Elucidation leads to correct interpretation of diseases and treatment choices, and we are in an era where integrated understanding of the genome and epigenome is indispensable. In this review, we make every effort to cover a wide range of knowledge, including data on histone protein modification, non-coding (nc)RNA and DNA methylation, and recent application trials for demonstrating epigenetic alterations in histologic and cytologic specimens. We hope this review will help marshal the knowledge accumulated by researchers involved in genomic and epigenomic studies.2022 The Japan Society of Histochemistry and Cytochemistry."
"35444240","TRMT6/61A-dependent base methylation of tRNA-derived fragments regulates gene-silencing activity and the unfolded protein response in bladder cancer.","Nat Commun","RNA modifications are important regulatory elements of RNA functions. However, most genome-wide mapping of RNA modifications has focused on messenger RNAs and transfer RNAs, but such datasets have been lacking for small RNAs. Here we mapped N1-methyladenosine (m1A) in the cellular small RNA space. Benchmarked with synthetic m1A RNAs, our workflow identified specific groups of m1A-containing small RNAs, which are otherwise disproportionally under-represented. In particular, 22-nucleotides long 3' tRNA-fragments are highly enriched for TRMT6/61A-dependent m1A located within the seed region. TRMT6/61A-dependent m1A negatively affects gene silencing by tRF-3s. In urothelial carcinoma of the bladder, where TRMT6/61A is over-expressed, higher m1A modification on tRFs is detected, correlated with a dysregulation of tRF targetome. Lastly, TRMT6/61A regulates tRF-3 targets involved in unfolded protein response. Together, our results reveal a mechanism of regulating gene expression via base modification of small RNA.© 2022. The Author(s)."
"35440009","Epigenome-wide contributions to individual differences in childhood phenotypes: a GREML approach.","Clin Epigenetics","DNA methylation is an epigenetic mechanism involved in human development. Numerous epigenome-wide association studies (EWAS) have investigated the associations of DNA methylation at single CpG sites with childhood outcomes. However, the overall contribution of DNA methylation across the genome (R2Methylation) towards childhood phenotypes is unknown. An estimate of R2Methylationwould provide context regarding the importance of DNA methylation explaining variance in health outcomes. We therefore estimated the variance explained by epigenome-wide cord blood methylation (R2Methylation) for five childhood phenotypes: gestational age, birth weight, and body mass index (BMI), IQ and ADHD symptoms at school age. We adapted a genome-based restricted maximum likelihood (GREML) approach with cross-validation (CV) to DNA methylation data and applied it in two population-based birth cohorts: ALSPAC (n = 775) and Generation R (n = 1382).Using information from > 470,000 autosomal probes we estimated that DNA methylation at birth explains 32% (SDCV = 0.06) of gestational age variance and 5% (SDCV = 0.02) of birth weight variance. The R2Methylationestimates for BMI, IQ and ADHD symptoms at school age estimates were near 0% across almost all cross-validation iterations.The results suggest that cord blood methylation explains a moderate degree of variance in gestational age and birth weight, in line with the success of previous EWAS in identifying numerous CpG sites associated with these phenotypes. In contrast, we could not obtain a reliable estimate for school-age BMI, IQ and ADHD symptoms. This may reflect a null bias due to insufficient sample size to detect variance explained in more weakly associated phenotypes, although the true R2Methylationfor these phenotypes is likely below that of gestational age and birth weight when using DNA methylation at birth.© 2022. The Author(s)."
"35550596","The early-life exposome modulates the effect of polymorphic inversions on DNA methylation.","Commun Biol","Polymorphic genomic inversions are chromosomal variants with intrinsic variability that play important roles in evolution, environmental adaptation, and complex traits. We investigated the DNA methylation patterns of three common human inversions, at 8p23.1, 16p11.2, and 17q21.31 in 1,009 blood samples from children from the Human Early Life Exposome (HELIX) project and in 39 prenatal heart tissue samples. We found inversion-state specific methylation patterns within and nearby flanking each inversion region in both datasets. Additionally, numerous inversion-exposure interactions on methylation levels were identified from early-life exposome data comprising 64 exposures. For instance, children homozygous at inv-8p23.1 and higher meat intake were more susceptible to TDH hypermethylation (P = 3.8 × 10-22); being the inversion, exposure, and gene known risk factors for adult obesity. Inv-8p23.1 associated hypermethylation of GATA4 was also detected across numerous exposures. Our data suggests that the pleiotropic influence of inversions during development and lifetime could be substantially mediated by allele-specific methylation patterns which can be modulated by the exposome.© 2022. The Author(s)."
"35547813","Placental Abnormalities are Associated With Specific Windows of Embryo Culture in a Mouse Model.","Front Cell Dev Biol","Assisted Reproductive Technologies (ART) employ gamete/embryo handling and culturein vitroto produce offspring. ART pregnancies have an increased risk of low birth weight, abnormal placentation, pregnancy complications, and imprinting disorders. Embryo culture induces low birth weight, abnormal placental morphology, and lower levels of DNA methylation in placentas in a mouse model of ART. Whether preimplantation embryos at specific stages of development are more susceptible to these perturbations remains unresolved. Accordingly, we performed embryo culture for several discrete periods of preimplantation development and following embryo transfer, assessed fetal and placental outcomes at term. We observed a reduction in fetal:placental ratio associated with two distinct windows of preimplantation embryo development, one prior to the morula stage and the other from the morula to blastocyst stage, whereas placental morphological abnormalities and reduced imprinting control region methylation were only associated with culture prior to the morula stage. Extended culture to the blastocyst stage also induces additional placental DNA methylation changes compared to embryos transferred at the morula stage, and female concepti exhibited a higher loss of DNA methylation than males. By identifying specific developmental windows of susceptibility, this study provides a framework to optimize further culture conditions to minimize risks associated with ART pregnancies.Copyright © 2022 Vrooman, Rhon-Calderon, Suri, Dahiya, Lan, Schultz and Bartolomei."
"35501397","Making sense of the ageing methylome.","Nat Rev Genet","Over time, the human DNA methylation landscape accrues substantial damage, which has been associated with a broad range of age-related diseases, including cardiovascular disease and cancer. Various age-related DNA methylation changes have been described, including at the level of individual CpGs, such as differential and variable methylation, and at the level of the whole methylome, including entropy and correlation networks. Here, we review these changes in the ageing methylome as well as the statistical tools that can be used to quantify them. We detail the evidence linking DNA methylation to ageing phenotypes and the longevity strategies aimed at altering both DNA methylation patterns and machinery to extend healthspan and lifespan. Lastly, we discuss theories on the mechanistic causes of epigenetic ageing.© 2022. Springer Nature Limited."
"35471549","Vitamin B12 Transport Genes and Nonsyndromic Cleft Lip With or Without Cleft Palate in Chile.","Reprod Sci","The aims of this study were to assess the association between polymorphisms within genes involved in vitamin B12 transport and nonsyndromic cleft lip with or without cleft palate (NSCL/P) and global DNA methylation in Chile. From 247 cases and 453 controls, we obtained variant genotypes for CBLIF, CUBN, AMN, ABCC1, CD320, and TCN2 from a single nucleotide polymorphisms array. Global DNA methylation in 95 controls was obtained through LINE-1 methylation. After multiple comparison corrections, only rs780807 in CUBN remains associated with NSCL/P at dominant model (OR 0.564, p-value = 0.0006, q-value = 0.0450). Carriers of protective allele showed lower levels of DNA methylation than non-carriers (p = 0.0259). Further studies are necessary in order to explain relations with the phenotype and DNA methylation due to the absence of functional evidence for rs780807 in CUBN.© 2022. Society for Reproductive Investigation."
"35568878","Characterising sex differences of autosomal DNA methylation in whole blood using the Illumina EPIC array.","Clin Epigenetics","Sex differences are known to play a role in disease aetiology, progression and outcome. Previous studies have revealed autosomal epigenetic differences between males and females in some tissues, including differences in DNA methylation patterns. Here, we report for the first time an analysis of autosomal sex differences in DNAme using the Illumina EPIC array in human whole blood by performing a discovery (n = 1171) and validation (n = 2471) analysis.We identified and validated 396 sex-associated differentially methylated CpG sites (saDMPs) with the majority found to be female-biased CpGs (74%). These saDMP's are enriched in CpG islands and CpG shores and located preferentially at 5'UTRs, 3'UTRs and enhancers. Additionally, we identified 266 significant sex-associated differentially methylated regions overlapping genes, which have previously been shown to exhibit epigenetic sex differences, and novel genes. Transcription factor binding site enrichment revealed enrichment of transcription factors related to critical developmental processes and sex determination such as SRY and ESR1.Our study reports a reliable catalogue of sex-associated CpG sites and elucidates several characteristics of these sites using large-scale discovery and validation data sets. This resource will benefit future studies aiming to investigate sex specific epigenetic signatures and further our understanding of the role of DNA methylation in sex differences in human whole blood.© 2022. The Author(s)."
"35562603","Vitamin D supplementation is associated with slower epigenetic aging.","Geroscience","Adverse effects of low vitamin D level on mortality and morbidity are controversially discussed. Especially older people are at risk for vitamin D deficiency and therefore exposed to its potentially harmful consequences. A way of measuring differences in the biological age is through DNA methylation age (DNAm age) and its deviation from chronological age, DNAm age acceleration (DNAmAA). We previously reported on an association between vitamin D deficiency and higher 7-CpG DNAmAA in participants of the Berlin Aging Study II (BASE-II). In this study, we employ a quasi-interventional study design to assess the relationship between DNAmAA of five epigenetic clocks and vitamin D supplementation. Longitudinal data were available for 1,036 participants of BASE-II that were reexamined on average 7.4 years later in the GendAge study (mean age at follow-up: 75.6 years, SD = 3.8 years, age range: 64.9-94.1 years, 51.9% female). DNAmAA was estimated with the 7-CpG clock, Horvath's clock, Hannum's clock, PhenoAge, and GrimAge. Methylation data were obtained through methylation-sensitive single nucleotide primer extension (MS-SNuPE) or Illumina's Infinium ""MethylationEPIC"" array. Vitamin D-deficient participants who chose to start vitamin D supplementation after baseline examination showed a 2.6-year lower 7-CpG DNAmAA (p = 0.011) and 1.3-year lower Horvath DNAmAA (p = 0.042) compared to untreated and vitamin D-deficient participants. DNAmAA did not statistically differ between participants with successfully treated vitamin D deficiency and healthy controls (p > 0.16). Therefore, we conclude that intake of vitamin D supplement is associated with lower DNAmAA in participants with vitamin D deficiency.© 2022. The Author(s)."
"35488174","The Placental Epigenome as a Molecular Link Between Prenatal Exposures and Fetal Health Outcomes Through the DOHaD Hypothesis.","Curr Environ Health Rep","The developmental origins of health and disease (DOHaD) hypothesis posits that the perinatal environment can impact fetal and later life health. The placenta is uniquely situated to assess prenatal exposures in the context of DOHaD because it is an essential ephemeral fetal organ that manages the transport of oxygen, nutrients, waste, and endocrine signals between the mother and fetus. The purpose of this review is to summarize recent studies that evaluated the DOHaD hypothesis in human placentas using epigenomics, including DNA methylation and transcriptomic studies of mRNA, lncRNA, and microRNAs.Between 2016 and 2021, 28 articles evaluated associations between prenatal exposures and placental epigenomics across broad exposure categories including maternal smoking, psychosocial stressors, chemicals, air pollution, and metals. Sixteen of these studies connected exposures to health outcome such as birth weight, fetal growth, or infant neurobehavior through mediation analysis, identification of shared associations between exposure and outcome, or network analysis. These aspects of infant and childhood health serve as a foundation for future studies that aim to use placental epigenetics to understand relationships between the prenatal environment and perinatal complications (such as preterm birth or fetal growth restriction) or later life childhood health. Placental DNA methylation and RNA expression have been linked to numerous prenatal exposures, such as PM2.5 air pollution, metals, and maternal smoking, as well as infant and childhood health outcomes, including fetal growth and birth weight. Placental epigenomics provides a unique opportunity to expand the DOHaD premise, particularly if research applies novel methodologies such as multi-omics analysis, sequencing of non-coding RNAs, mixtures analysis, and assessment of health outcomes beyond early childhood.© 2022. The Author(s)."
"35455649","Epigenetics in Precision Nutrition.","J Pers Med","Precision nutrition is an emerging area of nutrition research, with primary focus on the individual variability in response to dietary and lifestyle factors, which are mainly determined by an individual's intrinsic variations, such as those in genome, epigenome, and gut microbiome. The current research on precision nutrition is heavily focused on genome and gut microbiome, while epigenome (DNA methylation, non-coding RNAs, and histone modification) is largely neglected. The epigenome acts as the interface between the human genome and environmental stressors, including diets and lifestyle. Increasing evidence has suggested that epigenetic modifications, particularly DNA methylation, may determine the individual variability in metabolic health and response to dietary and lifestyle factors and, therefore, hold great promise in discovering novel markers for precision nutrition and potential targets for precision interventions. This review summarized recent studies on DNA methylation with obesity, diabetes, and cardiovascular disease, with more emphasis put in the relations of DNA methylation with nutrition and diet/lifestyle interventions. We also briefly reviewed other epigenetic events, such as non-coding RNAs, in relation to human health and nutrition, and discussed the potential role of epigenetics in the precision nutrition research."
"35449591","Cell models for Down syndrome-Alzheimer's disease research.","Neuronal Signal","Down syndrome (DS) is the most common chromosomal abnormality and leads to intellectual disability, increased risk of cardiac defects, and an altered immune response. Individuals with DS have an extra full or partial copy of chromosome 21 (trisomy 21) and are more likely to develop early-onset Alzheimer's disease (AD) than the general population. Changes in expression of human chromosome 21 (Hsa21)-encoded genes, such as amyloid precursor protein (APP), play an important role in the pathogenesis of AD in DS (DS-AD). However, the mechanisms of DS-AD remain poorly understood. To date, several mouse models with an extra copy of genes syntenic to Hsa21 have been developed to characterise DS-AD-related phenotypes. Nonetheless, due to genetic and physiological differences between mouse and human, mouse models cannot faithfully recapitulate all features of DS-AD. Cells differentiated from human-induced pluripotent stem cells (iPSCs), isolated from individuals with genetic diseases, can be used to model disease-related cellular and molecular pathologies, including DS. In this review, we will discuss the limitations of mouse models of DS and how these can be addressed using recent advancements in modelling DS using human iPSCs and iPSC-mouse chimeras, and potential applications of iPSCs in preclinical studies for DS-AD.© 2022 The Author(s)."
"35585103","Obesity and accelerated epigenetic aging in a high-risk cohort of children.","Sci Rep","New insights into mechanisms linking obesity to poor health outcomes suggest a role for cellular aging pathways, casting obesity as a disease of accelerated biological aging. Although obesity has been linked to accelerated epigenetic aging in middle-aged adults, the impact during childhood remains unclear. We tested the association between body mass index (BMI) and accelerated epigenetic aging in a cohort of high-risk children. Participants were children (N = 273, aged 8 to 14 years, 82% investigated for maltreatment) recruited to the Child Health Study, an ongoing prospective study of youth investigated for maltreatment and a comparison youth. BMI was measured as a continuous variable. Accelerated epigenetic aging of blood leukocytes was defined as the age-adjusted residuals of several established epigenetic aging clocks (Horvath, Hannum, GrimAge, PhenoAge) along with a newer algorithm, the DunedinPoAm, developed to quantify the pace-of-aging. Hypotheses were tested with generalized linear models. Higher age-and sex- adjusted z-scored BMI was significantly correlated with household income, blood cell counts, and three of the accelerated epigenetic aging measures: GrimAge (r = 0.31, P < .0001), PhenoAge (r = 0.24, P < .0001), and DunedinPoAm (r = 0.38, P < .0001). In fully adjusted models, GrimAge (β = 0.07; P = .0009) and DunedinPoAm (β = 0.0017; P < .0001) remained significantly associated with higher age- and sex-adjusted z-scored BMI. Maltreatment-status was not associated with accelerated epigenetic aging. In a high-risk cohort of children, higher BMI predicted epigenetic aging as assessed by two epigenetic aging clocks. These results suggest the association between obesity and accelerated epigenetic aging begins in early life, with implications for future morbidity and mortality risk.© 2022. The Author(s)."
"35513492","Epigenetics of type 2 diabetes mellitus and weight change - a tool for precision medicine?","Nat Rev Endocrinol","Pioneering studies performed over the past few decades demonstrate links between epigenetics and type 2 diabetes mellitus (T2DM), the metabolic disorder with the most rapidly increasing prevalence in the world. Importantly, these studies identified epigenetic modifications, including altered DNA methylation, in pancreatic islets, adipose tissue, skeletal muscle and the liver from individuals with T2DM. As non-genetic factors that affect the risk of T2DM, such as obesity, unhealthy diet, physical inactivity, ageing and the intrauterine environment, have been associated with epigenetic modifications in healthy individuals, epigenetics probably also contributes to T2DM development. In addition, genetic factors associated with T2DM and obesity affect the epigenome in human tissues. Notably, causal mediation analyses found DNA methylation to be a potential mediator of genetic associations with metabolic traits and disease. In the past few years, translational studies have identified blood-based epigenetic markers that might be further developed and used for precision medicine to help patients with T2DM receive optimal therapy and to identify patients at risk of complications. This Review focuses on epigenetic mechanisms in the development of T2DM and the regulation of body weight in humans, with a special focus on precision medicine.© 2022. Springer Nature Limited."
"35481978","The aging epigenome.","Elife","A new approach helps to assess the impact of accelerated epigenetic aging on the risk of cancer.© 2022, Pierce."
"35466328","Does Modulation of an Epigenetic Clock Define a Geroprotector?","Adv Geriatr Med Res","There is growing interest in the development of interventions (e.g., drugs, diets, dietary supplements, behavioral therapies, etc.) that can enhance health during the aging process, prevent or delay multiple age-related diseases, and ultimately extend lifespan. However, proving that such 'geroprotectors' do what they are hypothesized to do in relevant clinical trials is not trivial. We briefly discuss some of the more salient issues surrounding the design and interpretation of clinical trials of geroprotectors, including, importantly, how one defines a geroprotector. We also discuss whether emerging surrogate endpoints, such as epigenetic clocks, should be treated as primary or secondary endpoints in such trials. Simply put, geroprotectors should provide overt health and disease prevention benefits but the time-dependent relationships between epigenetic clocks and health-related phenomena are complex and in need of further scrutiny. Therefore, studies that enable understanding of the relationships between epigenetic clocks and disease processes while simultaneously testing the efficacy of a candidate geroprotector are crucial to move the field forward."
"35440567","Accelerated biological aging in COVID-19 patients.","Nat Commun","Chronological age is a risk factor for SARS-CoV-2 infection and severe COVID-19. Previous findings indicate that epigenetic age could be altered in viral infection. However, the epigenetic aging in COVID-19 has not been well studied. In this study, DNA methylation of the blood samples from 232 healthy individuals and 413 COVID-19 patients is profiled using EPIC methylation array. Epigenetic ages of each individual are determined by applying epigenetic clocks and telomere length estimator to the methylation profile of the individual. Epigenetic age acceleration is calculated and compared between groups. We observe strong correlations between the epigenetic clocks and individual's chronological age (r > 0.8, p < 0.0001). We also find the increasing acceleration of epigenetic aging and telomere attrition in the sequential blood samples from healthy individuals and infected patients developing non-severe and severe COVID-19. In addition, the longitudinal DNA methylation profiling analysis find that the accumulation of epigenetic aging from COVID-19 syndrome could be partly reversed at late clinic phases in some patients. In conclusion, accelerated epigenetic aging is associated with the risk of SARS-CoV-2 infection and developing severe COVID-19. In addition, the accumulation of epigenetic aging from COVID-19 may contribute to the post-COVID-19 syndrome among survivors.© 2022. The Author(s)."
"35493788","The embryo culture media in the era of epigenetics: is it time to go back to nature?","Anim Reprod","This review is intended to draw attention to the importance of the culture media composition on the health of the embryos, fetuses, newborns, and adults derived from assisted reproductive technologies (ART). Although current research and industry trends are to use chemically defined media because of their suitability for manufacturing, commercialization, and regulatory purposes, compelling evidence indicates that those media fail to adequately account for the biological demands of early embryogenesis. Here, we list the main undesirable consequences of the ART described in the literature and results we and others have obtained over the past decade exploring an alternative and more natural way to support embryo growthin vitro: inclusion of endogenous reproductive fluids as additives in the ART culture media for pigs, cows, and humans. This review systematically assesses the pros and cons of using reproductive fluid additives, as well as the requirements to implement this approach in the future."
