"pmid","title","source","abstract"
"37398566","Recent insights into autophagy and metals/nanoparticles exposure.","Toxicol Res","Some anthropogenic pollutants, such as heavy metals and nanoparticles (NPs), are widely distributed and a major threat to environmental safety and public health. In particular, lead (Pb), cadmium (Cd), chromium (Cr), arsenic (As), and mercury (Hg) have systemic toxicity even at extremely low concentrations, so they are listed as priority metals in relation to their significant public health burden. Aluminum (Al) is also toxic to multiple organs and is linked to Alzheimer's disease. As the utilization of many metal nanoparticles (MNPs) gradually gain traction in industrial and medical applications, they are increasingly being investigated to address potential toxicity by impairing certain biological barriers. The dominant toxic mechanism of these metals and MNPs is the induction of oxidative stress, which subsequently triggers lipid peroxidation, protein modification, and DNA damage. Notably, a growing body of research has revealed the linkage between dysregulated autophagy and some diseases, including neurodegenerative diseases and cancers. Among them, some metals or metal mixtures can act as environmental stimuli and disturb basal autophagic activity, which has an underlying adverse health effect. Some studies also revealed that specific autophagy inhibitors or activators could modify the abnormal autophagic flux attributed to continuous exposure to metals. In this review, we have gathered recent data about the contribution of the autophagy/mitophagy mediated toxic effects and focused on the involvement of some key regulatory factors of autophagic signaling during exposure to selected metals, metal mixtures, as well as MNPs in the real world. Besides this, we summarized the potential significance of interactions between autophagy and excessive reactive oxygen species (ROS)-mediated oxidative damage in the regulation of cell survival response to metals/NPs. A critical view is given on the application of autophagy activators/inhibitors to modulate the systematic toxicity of various metals/MNPs.© The Author(s) under exclusive licence to Korean Society of Toxicology 2023. Springer Nature or its licensor (e.g. a society or other partner) holds exclusive rights to this article under a publishing agreement with the author(s) or other rightsholder(s); author self-archiving of the accepted manuscript version of this article is solely governed by the terms of such publishing agreement and applicable law."
"37389783","Maternal weight and its association with risk of overweight in offspring: a trajectory analysis from a birth cohort in China.","World J Pediatr","Most studies on the association of maternal pregnancy weight with offspring weight trajectory have a short follow-up time. This study aimed to explore the associations of maternal prepregnancy body mass index (BMI) and gestational weight gain (GWG) with childhood weight trajectories in a 7-year birth cohort.A total of 946 mother-child pairs (467 boys and 479 girls) from a longitudinal birth cohort in Tianjin City, China, were included in this study, ranging from pregnancy to offspring at 7 years. The outcome variable was defined as overweight or not overweight in offspring at the last round. A group-based trajectory model was applied to identify childhood BMI trajectory groups.Five discrete BMI trajectory groups were identified and characterized as constant underweight (25.2%), constant normal weight (42.8%), and high or increasing trajectory [at risk of overweight (16.9%), progressive overweight (11.0%) and progressive obesity (4.1%)]. Maternal prepregnancy overweight was associated with 1.72 (95% CI 1.14-2.60, P = 0.01) to 4.02 (95% CI 1.94-8.36, P < 0.001) times the risk of all high or increasing trajectory groups, and excessive GWG was related to groups at risk of overweight [relative risk ratio (RRR) 2.09, 95% CI 1.27-3.46, P = 0.004] and progressive obesity (RRR 3.33, 95% CI 1.13-9.79, P = 0.029). Children in all high or increasing trajectory groups were associated with greater overweight risk at the last round [risk ratios (RRs) ranged from 3.54 (95% CI 2.53-4.95, P < 0.001) to 6.18 (95% CI 4.05-9.42, P < 0.001)].Maternal prepregnancy overweight and excessive gestational weight gain were associated with increasing or high-level childhood body mass index trajectories as well as a greater risk of overweight at 7 years.© 2023. Children's Hospital, Zhejiang University School of Medicine."
"37397501","In silico analysis of the solute carrier (SLC) family in cancer indicates a link among DNA methylation, metabolic adaptation, drug response, and immune reactivity.","Front Pharmacol","Introduction:The oncogenic transformation is driven by genetic and epigenetic alterations influencing cancer cell fate. These alterations also result in metabolic reprogramming by modulating the expression of membrane Solute Carrier (SLC) transporters involved in biomolecules trafficking. SLCs act as tumor suppressors or promoters influencing cancer methylome, tumor growth, immune-escape, and chemoresistance.Methods:Thisin silicostudy aimed to identify the deregulated SLCs in various tumor types compared to normal tissues by analyzing the TCGA Target GTEx dataset. Furthermore, the relationship between SLCs expression and the most relevant tumor features was tackled along with their genetic regulation mediated by DNA methylation.Results:We identified 62 differentially expressed SLCs, including the downregulatedSLC25A27andSLC17A7, as well as the upregulatedSLC27A2andSLC12A8. Notably,SLC4A4andSLC7A11expression was associated with favorable and unfavorable outcome, respectively. Moreover,SLC6A14, SLC34A2,andSLC1A2were linked to tumor immune responsiveness. Interestingly,SLC24A5andSLC45A2positively correlated with anti-MEK and anti-RAF sensitivity. The expression of relevant SLCs was correlated with hypo- and hyper-methylation of promoter and body region, showing an established DNA methylation pattern. Noteworthy, the positive association of cg06690548 (SLC7A11) methylation with cancer outcome suggests the independent predictive role of DNA methylation at a single nucleotide resolution.Discussion:Although ourin silicooverview revealed a wide heterogeneity depending on different SLCs functions and tumor types, we identified key SLCs and pointed out the role of DNA methylation as regulatory mechanism of their expression. Overall, these findings deserve further studies to identify novel cancer biomarkers and promising therapeutic targets.Copyright © 2023 Lavoro, Falzone, Tomasello, Conti, Libra and Candido."
"37386258","Considerations for reproducible omics in aging research.","Nat Aging","Technical advancements over the past two decades have enabled the measurement of the panoply of molecules of cells and tissues including transcriptomes, epigenomes, metabolomes and proteomes at unprecedented resolution. Unbiased profiling of these molecular landscapes in the context of aging can reveal important details about mechanisms underlying age-related functional decline and age-related diseases. However, the high-throughput nature of these experiments creates unique analytical and design demands for robustness and reproducibility. In addition, 'omic' experiments are generally onerous, making it crucial to effectively design them to eliminate as many spurious sources of variation as possible as well as account for any biological or technical parameter that may influence such measures. In this Perspective, we provide general guidelines on best practices in the design and analysis of omic experiments in aging research from experimental design to data analysis and considerations for long-term reproducibility and validation of such studies.© 2023. Springer Nature America, Inc."
"37393393","Effects of an aged tissue niche on the immune potency of dendritic cells using simulated microgravity.","NPJ Aging","Microgravity accelerates the aging of various physiological systems, and it is well acknowledged that aged individuals and astronauts both have increased susceptibility to infections and poor response to vaccination. Immunologically, dendritic cells (DCs) are the key players in linking innate and adaptive immune responses. Their distinct and optimized differentiation and maturation phases play a critical role in presenting antigens and mounting effective lymphocyte responses for long-term immunity. Despite their importance, no studies to date have effectively investigated the effects of microgravity on DCs in their native microenvironment, which is primarily located within tissues. Here, we address a significantly outstanding research gap by examining the effects of simulated microgravity via a random positioning machine on both immature and mature DCs cultured in biomimetic collagen hydrogels, a surrogate for tissue matrices. Furthermore, we explored the effects of loose and dense tissues via differences in collagen concentration. Under these various environmental conditions, the DC phenotype was characterized using surface markers, cytokines, function, and transcriptomic profiles. Our data indicate that aged or loose tissue and exposure to RPM-induced simulated microgravity both independently alter the immunogenicity of immature and mature DCs. Interestingly, cells cultured in denser matrices experience fewer effects of simulated microgravity at the transcriptome level. Our findings are a step forward to better facilitate healthier future space travel and enhance our understanding of the aging immune system on Earth.© 2023. The Author(s)."
"37380641","Next generation of astronauts or ESA astronaut 2.0 concept and spotlight on immunity.","NPJ Microgravity","Although we have sent humans into space for more than 50 years, crucial questions regarding immune response in space conditions remain unanswered. There are many complex interactions between the immune system and other physiological systems in the human body. This makes it difficult to study the combined long-term effects of space stressors such as radiation and microgravity. In particular, exposure to microgravity and cosmic radiation may produce changes in the performance of the immune system at the cellular and molecular levels and in the major physiological systems of the body. Consequently, abnormal immune responses induced in the space environment may have serious health consequences, especially in future long-term space missions. In particular, radiation-induced immune effects pose significant health challenges for long-duration space exploration missions with potential risks to reduce the organism's ability to respond to injuries, infections, and vaccines, and predispose astronauts to the onset of chronic diseases (e.g., immunosuppression, cardiovascular and metabolic diseases, gut dysbiosis). Other deleterious effects encountered by radiation may include cancer and premature aging, induced by dysregulated redox and metabolic processes, microbiota, immune cell function, endotoxin, and pro-inflammatory signal production1,2. In this review, we summarize and highlight the current understanding of the effects of microgravity and radiation on the immune system and discuss knowledge gaps that future studies should address.© 2023. The Author(s)."
"37400539","Dissolution of oncofusion transcription factor condensates for cancer therapy.","Nat Chem Biol","Cancer-associated chromosomal rearrangements can result in the expression of numerous pathogenic fusion proteins. The mechanisms by which fusion proteins contribute to oncogenesis are largely unknown, and effective therapies for fusion-associated cancers are lacking. Here we comprehensively scrutinized fusion proteins found in various cancers. We found that many fusion proteins are composed of phase separation-prone domains (PSs) and DNA-binding domains (DBDs), and these fusions have strong correlations with aberrant gene expression patterns. Furthermore, we established a high-throughput screening method, named DropScan, to screen drugs capable of modulating aberrant condensates. One of the drugs identified via DropScan, LY2835219, effectively dissolved condensates in reporter cell lines expressing Ewing sarcoma fusions and partially rescued the abnormal expression of target genes. Our results indicate that aberrant phase separation is likely a common mechanism for these PS-DBD fusion-related cancers and suggest that modulating aberrant phase separation is a potential route to treat these diseases.© 2023. The Author(s), under exclusive licence to Springer Nature America, Inc."
"37400477","LncRNA miR663AHG represses the development of colon cancer in a miR663a-dependent manner.","Cell Death Discov","The MIR663AHG gene encodes both miR663AHG and miR663a. While miR663a contributes to the defense of host cells against inflammation and inhibits colon cancer development, the biological function of lncRNA miR663AHG has not been previously reported. In this study, the subcellular localization of lncRNA miR663AHG was determined by RNA-FISH. miR663AHG and miR663a were measured by qRT-PCR. The effects of miR663AHG on the growth and metastasis of colon cancer cells were investigated in vitro and in vivo. CRISPR/Cas9, RNA pulldown, and other biological assays were used to explore the underlying mechanism of miR663AHG. We found that miR663AHG was mainly distributed in the nucleus of Caco2 and HCT116 cells and the cytoplasm of SW480 cells. The expression level of miR663AHG was positively correlated with the level of miR663a (r = 0.179, P = 0.015) and significantly downregulated in colon cancer tissues relative to paired normal tissues from 119 patients (P < 0.008). Colon cancers with low miR663AHG expression were associated with advanced pTNM stage (P = 0.021), lymph metastasis (P = 0.041), and shorter overall survival (hazard ratio = 2.026; P = 0.021). Experimentally, miR663AHG inhibited colon cancer cell proliferation, migration, and invasion. The growth of xenografts from RKO cells overexpressing miR663AHG was slower than that of xenografts from vector control cells in BALB/c nude mice (P = 0.007). Interestingly, either RNA-interfering or resveratrol-inducing expression changes of miR663AHG or miR663a can trigger negative feedback regulation of transcription of the MIR663AHG gene. Mechanistically, miR663AHG could bind to miR663a and its precursor pre-miR663a, and prevent the degradation of miR663a target mRNAs. Disruption of the negative feedback by knockout of the MIR663AHG promoter, exon-1, and pri-miR663A-coding sequence entirely blocked these effects of miR663AHG, which was restored in cells transfected with miR663a expression vector in rescue experiment. In conclusion, miR663AHG functions as a tumor suppressor that inhibits the development of colon cancer through its cis-binding to miR663a/pre-miR663a. The cross talk between miR663AHG and miR663a expression may play dominant roles in maintaining the functions of miR663AHG in colon cancer development.© 2023. The Author(s)."
"37380628","A landscape of response to drug combinations in non-small cell lung cancer.","Nat Commun","Combination of anti-cancer drugs is broadly seen as way to overcome the often-limited efficacy of single agents. The design and testing of combinations are however very challenging. Here we present a uniquely large dataset screening over 5000 targeted agent combinations across 81 non-small cell lung cancer cell lines. Our analysis reveals a profound heterogeneity of response across the tumor models. Notably, combinations very rarely result in a strong gain in efficacy over the range of response observable with single agents. Importantly, gain of activity over single agents is more often seen when co-targeting functionally proximal genes, offering a strategy for designing more efficient combinations. Because combinatorial effect is strongly context specific, tumor specificity should be achievable. The resource provided, together with an additional validation screen sheds light on major challenges and opportunities in building efficacious combinations against cancer and provides an opportunity for training computational models for synergy prediction.© 2023. The Author(s)."
"37370065","WEE1 and PARP-1 play critical roles in myelodysplastic syndrome and acute myeloid leukemia treatment.","Cancer Cell Int","Myelodysplastic syndrome (MDS) is a clonal bone marrow disorder defined by cytopenia and is associated with an increased risk of transformation to acute myeloid leukemia (AML). The outcome of MDS is poor, so alternative therapeutic approaches are needed to improve survival. The inhibition of the DNA damage response pathway, including poly (ADP-ribose) polymerase-1 (PARP-1), has been approved to treat several cancers. In addition, WEE1, a nuclear kinase, is overexpressed in many cancers. Therefore, a WEE1 inhibitor combined with a PARP-1 inhibitor could inhibit the proliferation of MDS and AML.We analyzed whether WEE1 was regulated in the progression of MDS and AML. We also evaluated the efficacy of MK-1775 (WEE1 inhibitor) and talazoparib (PARP-1 inhibitor).PARP-1 expression was higher in the AML cells than in the MDS cells. However, WEE1 expression remained unchanged. MK-1775 or talazoparib alone inhibited MDS and AML cells after 72 h, and cellular cytotoxicity and caspase 3/7 activity were increased. The combined use of MK-1775 and talazoparib produced superior efficacy than either drug alone and SKM-1 colony formation was reduced. Significant cell populations in the sub-G1 phase were found in the cell-cycle analyses. Additionally, γ-H2AX expression and caspase 3 activity were increased. The combined treatment also changed the mitochondrial membrane potential.The combination of a WEE1 inhibitor and PARP-1 inhibitor had enhanced efficacy and is proposed as a new therapeutic option for patients with MDS or AML. Our findings have clinical implications for a potential novel therapeutic strategy for MDS and AML patients.© 2023. The Author(s)."
"37333221","Single-cell transcriptomic profiling of human pancreatic islets reveals genes responsive to glucose exposure over 24 hours.","bioRxiv","Disruption of pancreatic islet function and glucose homeostasis can lead to the development of sustained hyperglycemia, beta cell glucotoxicity, and ultimately type 2 diabetes (T2D). In this study, we sought to explore the effects of hyperglycemia on human pancreatic islet (HPI) gene expression by exposing HPIs from two donors to low (2.8mM) and high (15.0mM) glucose concentrations over 24 hours, assaying the transcriptome at seven time points using single-cell RNA sequencing (scRNA-seq). We modeled time as both a discrete and continuous variable to determine momentary and longitudinal changes in transcription associated with islet time in culture or glucose exposure. Across all cell types, we identified 1,528 genes associated with time, 1,185 genes associated with glucose exposure, and 845 genes associated with interaction effects between time and glucose. We clustered differentially expressed genes across cell types and found 347 modules of genes with similar expression patterns across time and glucose conditions, including two beta cell modules enriched in genes associated with T2D. Finally, by integrating genomic features from this study and genetic summary statistics for T2D and related traits, we nominate 374 candidate effector genes that may underlie genetic associations for T2D and related traits."
"37308294","Accurate integration of multiple heterogeneous single-cell RNA-seq data sets by learning contrastive biological variation.","Genome Res","For most biological and medical applications of single-cell transcriptomics, an integrative study of multiple heterogeneous single-cell RNA sequencing (scRNA-seq) data sets is crucial. However, present approaches are unable to integrate diverse data sets from various biological conditions effectively because of the confounding effects of biological and technical differences. We introduce single-cell integration (scInt), an integration method based on accurate, robust cell-cell similarity construction and unified contrastive biological variation learning from multiple scRNA-seq data sets. scInt provides a flexible and effective approach to transfer knowledge from the already integrated reference to the query. We show that scInt outperforms 10 other cutting-edge approaches using both simulated and real data sets, particularly in the case of complex experimental designs. Application of scInt to mouse developing tracheal epithelial data shows its ability to integrate development trajectories from different developmental stages. Furthermore, scInt successfully identifies functionally distinct condition-specific cell subpopulations in single-cell heterogeneous samples from a variety of biological conditions.© 2023 Zhou et al.; Published by Cold Spring Harbor Laboratory Press."
"37381037","Exploratory analysis of L1 retrotransposons expression in autismï»¿.","Mol Autism","Autism spectrum disorder (ASD) is a set of highly heterogeneous neurodevelopmental diseases whose genetic etiology is not completely understood. Several investigations have relied on transcriptome analysis from peripheral tissues to dissect ASD into homogenous molecular phenotypes. Recently, analysis of changes in gene expression from postmortem brain tissues has identified sets of genes that are involved in pathways previously associated with ASD etiology. In addition to protein-coding transcripts, the human transcriptome is composed by a large set of non-coding RNAs and transposable elements (TEs). Advancements in sequencing technologies have proven that TEs can be transcribed in a regulated fashion, and their dysregulation might have a role in brain diseases.We exploited published datasets comprising RNA-seq data from (1) postmortem brain of ASD subjects, (2) in vitro cell cultures where ten different ASD-relevant genes were knocked out and (3) blood of discordant siblings. We measured the expression levels of evolutionarily young full-length transposable L1 elements and characterized the genomic location of deregulated L1s assessing their potential impact on the transcription of ASD-relevant genes. We analyzed every sample independently, avoiding to pool together the disease subjects to unmask the heterogeneity of the molecular phenotypes.We detected a strong upregulation of intronic full-length L1s in a subset of postmortem brain samples and in in vitro differentiated neurons from iPSC knocked out for ATRX. L1 upregulation correlated with an high number of deregulated genes and retained introns. In the anterior cingulate cortex of one subject, a small number of significantly upregulated L1s overlapped with ASD-relevant genes that were significantly downregulated, suggesting the possible existence of a negative effect of L1 transcription on host transcripts.Our analyses must be considered exploratory and will need to be validated in bigger cohorts. The main limitation is given by the small sample size and by the lack of replicates for postmortem brain samples. Measuring the transcription of locus-specific TEs is complicated by the repetitive nature of their sequence, which reduces the accuracy in mapping sequencing reads to the correct genomic locus.L1 upregulation in ASD appears to be limited to a subset of subjects that are also characterized by a general deregulation of the expression of canonical genes and an increase in intron retention. In some samples from the anterior cingulate cortex, L1s upregulation seems to directly impair the expression of some ASD-relevant genes by a still unknown mechanism. L1s upregulation may therefore identify a group of ASD subjects with common molecular features and helps stratifying individuals for novel strategies of therapeutic intervention.© 2023. The Author(s)."
"37308292","Characterizing the targets of transcription regulators by aggregating ChIP-seq and perturbation expression data sets.","Genome Res","Mapping the gene targets of chromatin-associated transcription regulators (TRs) is a major goal of genomics research. ChIP-seq of TRs and experiments that perturb a TR and measure the differential abundance of gene transcripts are a primary means by which direct relationships are tested on a genomic scale. It has been reported that there is a poor overlap in the evidence across gene regulation strategies, emphasizing the need for integrating results from multiple experiments. Although research consortia interested in gene regulation have produced a valuable trove of high-quality data, there is an even greater volume of TR-specific data throughout the literature. In this study, we show a workflow for the identification, uniform processing, and aggregation of ChIP-seq and TR perturbation experiments for the ultimate purpose of ranking human and mouse TR-target interactions. Focusing on an initial set of eight regulators (ASCL1, HES1, MECP2, MEF2C, NEUROD1, PAX6, RUNX1, and TCF4), we identified 497 experiments suitable for analysis. We used this corpus to examine data concordance, to identify systematic patterns of the two data types, and to identify putative orthologous interactions between human and mouse. We build upon commonly used strategies to forward a procedure for aggregating and combining these two genomic methodologies, assessing these rankings against independent literature-curated evidence. Beyond a framework extensible to other TRs, our work also provides empirically ranked TR-target listings, as well as transparent experiment-level gene summaries for community use.© 2023 Morin et al.; Published by Cold Spring Harbor Laboratory Press."
