"pmid","title","source","abstract"
"37387182","AttOmics: attention-based architecture for diagnosis and prognosis from omics data.","Bioinformatics","The increasing availability of high-throughput omics data allows for considering a new medicine centered on individual patients. Precision medicine relies on exploiting these high-throughput data with machine-learning models, especially the ones based on deep-learning approaches, to improve diagnosis. Due to the high-dimensional small-sample nature of omics data, current deep-learning models end up with many parameters and have to be fitted with a limited training set. Furthermore, interactions between molecular entities inside an omics profile are not patient specific but are the same for all patients.In this article, we propose AttOmics, a new deep-learning architecture based on the self-attention mechanism. First, we decompose each omics profile into a set of groups, where each group contains related features. Then, by applying the self-attention mechanism to the set of groups, we can capture the different interactions specific to a patient. The results of different experiments carried out in this article show that our model can accurately predict the phenotype of a patient with fewer parameters than deep neural networks. Visualizing the attention maps can provide new insights into the essential groups for a particular phenotype.The code and data are available at https://forge.ibisc.univ-evry.fr/abeaude/AttOmics. TCGA data can be downloaded from the Genomic Data Commons Data Portal.© The Author(s) 2023. Published by Oxford University Press."
"37386584","Anesthesia and cancer recurrence: an overview.","J Anesth Analg Crit Care","Several perioperative factors are responsible for the dysregulation or suppression of the immune system with a possible impact on cancer cell growth and the development of new metastasis. These factors have the potential to directly suppress the immune system and activate hypothalamic-pituitary-adrenal axis and the sympathetic nervous system with a consequent further immunosuppressive effect.Anesthetics and analgesics used during the perioperative period may modulate the innate and adaptive immune system, inflammatory system, and angiogenesis, with a possible impact on cancer recurrence and long-term outcome. Even if the current data are controversial and contrasting, it is crucial to increase awareness about this topic among healthcare professionals for a future better and conscious choice of anesthetic techniques.In this article, we aimed to provide an overview regarding the relationship between anesthesia and cancer recurrence. We reviewed the effects of surgery, perioperative factors, and anesthetic agents on tumor cell survival and tumor recurrence.© 2022. The Author(s)."
"37396553","Non-small cell lung carcinoma (NSCLC): Implications on molecular pathology and advances in early diagnostics and therapeutics.","Genes Dis","Continuous revision of the histologic and stage-wise classification of lung cancer by the World Health Organization (WHO) provides the foundation for therapeutic advances by promoting molecular targeted and immunotherapies and ensuring accurate diagnosis. Cancer epidemiologic data provide helpful information for cancer prevention, diagnosis, and management, supporting health-care interventions. Global cancer mortality projections from 2016 to 2060 show that cancer will overtake ischemic heart diseases (IHD) as the leading cause of death (18.9 million) immediately after 2030, surpassing non-small cell lung cancer (NSCLC), which accounts for 85 percent of lung cancers. The clinical stage at the diagnosis is the main prognostic factor in NSCLC therapies. Advanced early diagnostic methods are essential as the initial stages of cancer show reduced mortality compared to the advanced stages. Sophisticated approaches to proper histological classification and NSCLC management have improved clinical efficiency. Although immune checkpoint inhibitors (ICIs) and targeted molecular therapies have refined the therapeutic management of late-stage NSCLC, the specificity and sensitivity of cancer biomarkers should be improved by focusing on prospective studies, followed by their use as therapeutic tools. The liquid biopsy candidates such as circulating tumor cells (CTCs), circulating cell-free tumor DNA (cfDNA), tumor educated platelets (TEP), and extracellular vesicles (EVs) possess cancer-derived biomolecules and aid in tracing: driver mutations leading to cancer, acquired resistance caused by various generations of therapeutic agents, refractory disease, prognosis, and surveillance.© 2022 The Authors. Publishing services by Elsevier B.V. on behalf of KeAi Communications Co., Ltd."
"37398946","High-Fat Diet Promotes Adipogenesis in Offspring Female Rats Induced by Perinatal Exposure to 4-Nonylphenol.","Biomed Res Int","Both high-fat diet (HFD) and 4-nonylphenol (4-NP) could affect fat formation in adipose tissue individually. We investigated whether HFD promote abnormal adipose tissue formation caused by early exposure to 4-NP in life and preliminarily explore the possible mechanisms involved.The first-generation rats were treated with HFD on postnatal day after pregnant rats exposure to 5 ug/kg/day 4-NP. Then, the second generation rats started to only receive normal diet without 4-NP or HFD. We analyzed organ coefficient and histopathology of fat tissues, biochemical index, and gene level involved in lipid metabolism in female offspring rats.HFD and 4-NP interaction synergistically increased birth weight, body weight, and organ coefficients of adipose tissue in offspring female rats. HFD accelerately aggravated abnormal lipid metabolism and increased the adipocyte mean areas around the uterus of the offspring female rats induced by prenatal exposure to 4-NP. HFD also facilitate the regulation of gene expression involved lipid metabolism in offspring female rats induced by perinatal exposure to 4-NP, even passed on to the second generation of female rats. Moreover, HFD and 4-NP interaction synergistically declined the gene and protein expression of estrogen receptor (ER) in the adipose tissue of second-generation female rats.HFD and 4-NP synergistically regulate the expression of lipid metabolism genes in adipose tissue of F2 female rats and promote adipose tissue generation, leading to obesity in offspring rats, which is closely related to low expression of ER. Therefore, ER genes and proteins may be involved in the synergistic effect of HFD and 4-NP.Copyright © 2023 Hongyu Zhang et al."
"37382627","Single-cell chromatin accessibility profiling reveals a self-renewing muscle satellite cell state.","J Cell Biol","A balance between self-renewal and differentiation is critical for the regenerative capacity of tissue-resident stem cells. In skeletal muscle, successful regeneration requires the orchestrated activation, proliferation, and differentiation of muscle satellite cells (MuSCs) that are normally quiescent. A subset of MuSCs undergoes self-renewal to replenish the stem cell pool, but the features that identify and define self-renewing MuSCs remain to be elucidated. Here, through single-cell chromatin accessibility analysis, we reveal the self-renewal versus differentiation trajectories of MuSCs over the course of regeneration in vivo. We identify Betaglycan as a unique marker of self-renewing MuSCs that can be purified and efficiently contributes to regeneration after transplantation. We also show that SMAD4 and downstream genes are genetically required for self-renewal in vivo by restricting differentiation. Our study unveils the identity and mechanisms of self-renewing MuSCs, while providing a key resource for comprehensive analysis of muscle regeneration.© 2023 Okafor et al."
"37396986","Epigenetic Inheritance and Transgenerational Environmental Justice.","Yale J Biol Med","Many chemicals and toxicants are released into our ecosystem and environment every day, which can cause harmful effects on human populations. Agricultural compounds are used in most crop production and have been shown to cause negative health impacts, including effects on reproduction and other pathologies. Although these chemicals can be helpful for pest and weed control, the compounds indirectly impact humans. Several compounds have been banned in the European Union but continue to be used in the United States. Recent work has shown most toxicants affect transgenerational generations more than the directly exposed generations through epigenetic inheritance. While some toxicants do not impact the directly exposed generation, the later generations that are transgenerational or ancestrally exposed suffer health impacts. Due to impacts to future generations, exposure becomes an environmental justice concern. The term ""environmental justice"" denotes the application of fair strategies when resolving unjust environmental contamination. Fair treatment means that no group should bear a disproportionate share of negative environmental consequences resulting from industrial, municipal, and commercial operations. This article illustrates how research on directly exposed generations is often prioritized over studies on transgenerational generations. However, research on the latter generations suggests the need to take environmental justice concerns seriously moving forward, as future generations could be unduly shouldering harms, while not enjoying benefits of production.Copyright ©2023, Yale Journal of Biology and Medicine."
"37397254","Epigenetic mechanisms of MÃ¼ller glial reprogramming mediating retinal regeneration.","Front Cell Dev Biol","Retinal degenerative diseases, characterized by retinal neuronal death and severe vision loss, affect millions of people worldwide. One of the most promising treatment methods for retinal degenerative diseases is to reprogram non-neuronal cells into stem or progenitor cells, which then have the potential to re-differentiate to replace the dead neurons, thereby promoting retinal regeneration. Müller glia are the major glial cell type and play an important regulatory role in retinal metabolism and retinal cell regeneration. Müller glia can serve as a source of neurogenic progenitor cells in organisms with the ability to regenerate the nervous system. Current evidence points toward the reprogramming process of Müller glia, involving changes in the expression of pluripotent factors and other key signaling molecules that may be regulated by epigenetic mechanisms. This review summarizes recent knowledge of epigenetic modifications involved in the reprogramming process of Müller glia and the subsequent changes to gene expression and the outcomes. In living organisms, epigenetic mechanisms mainly include DNA methylation, histone modification, and microRNA-mediated miRNA degradation, all of which play a crucial role in the reprogramming process of Müller glia. The information presented in this review will improve the understanding of the mechanisms underlying the Müller glial reprogramming process and provide a research basis for the development of Müller glial reprogramming therapy for retinal degenerative diseases.Copyright © 2023 Si, Li, Zhang, Su, Liu, Chen, Peng, Cao and Zang."
"37387176","UNADON: transformer-based model to predict genome-wide chromosome spatial position.","Bioinformatics","The spatial positioning of chromosomes relative to functional nuclear bodies is intertwined with genome functions such as transcription. However, the sequence patterns and epigenomic features that collectively influence chromatin spatial positioning in a genome-wide manner are not well understood.Here, we develop a new transformer-based deep learning model called UNADON, which predicts the genome-wide cytological distance to a specific type of nuclear body, as measured by TSA-seq, using both sequence features and epigenomic signals. Evaluations of UNADON in four cell lines (K562, H1, HFFc6, HCT116) show high accuracy in predicting chromatin spatial positioning to nuclear bodies when trained on a single cell line. UNADON also performed well in an unseen cell type. Importantly, we reveal potential sequence and epigenomic factors that affect large-scale chromatin compartmentalization in nuclear bodies. Together, UNADON provides new insights into the principles between sequence features and large-scale chromatin spatial localization, which has important implications for understanding nuclear structure and function.The source code of UNADON can be found at https://github.com/ma-compbio/UNADON.© The Author(s) 2023. Published by Oxford University Press."
"37378767","Proteomic Investigation of COVID-19 Severity During the Tsunamic Second Wave in Mumbai.","Adv Exp Med Biol","Maharashtra was severely affected during the noxious second wave of COVID-19, with the highest number of cases recorded across India. The emergence of new symptoms and dysregulation of multiple organs resulted in high disease severity during the second wave which led to increased difficulties in understanding the molecular mechanisms behind the disease pathology. Exploring the underlying factors can help to relieve the burden on the medical communities to some extent by prioritizing the patients and, at the same time, opening avenues for improved treatments. In the current study, we have performed a mass-spectrometry-based proteomic analysis to investigate the disease pathology using nasopharyngeal swab samples collected from the COVID-19 patients in the Mumbai region of Maharashtra over the period of March-June 2021, the peak of the second wave. A total of 59 patients, including 32 non-severe and 27 severe cases, were considered for this proteomic study. We identified 23 differentially regulated proteins in severe patients as a host response to infection. In addition to the previously identified innate mechanisms of neutrophil and platelet degranulation, this study revealed significant alterations of anti-microbial peptide pathways in severe conditions, illustrating its role in the severity of the infectious strain of COVID-19 during the second wave. Furthermore, myeloperoxidase, cathepsin G, and profilin-1 were identified as potential therapeutic targets of the FDA-approved drugs dabrafenib, ZINC4097343, and ritonavir. This study has enlightened the role of the anti-microbial peptide pathway associated with the second wave in India and proposed its importance in potential therapeutics for COVID-19.© 2023. The Author(s), under exclusive license to Springer Nature Switzerland AG."
"37403156","Characterization of large-scale genomic differences in the first complete human genome.","Genome Biol","The first telomere-to-telomere (T2T) human genome assembly (T2T-CHM13) release is a milestone in human genomics. The T2T-CHM13 genome assembly extends our understanding of telomeres, centromeres, segmental duplication, and other complex regions. The current human genome reference (GRCh38) has been widely used in various human genomic studies. However, the large-scale genomic differences between these two important genome assemblies are not characterized in detail yet.Here, in addition to the previously reported ""non-syntenic"" regions, we find 67 additional large-scale discrepant regions and precisely categorize them into four structural types with a newly developed website tool called SynPlotter. The discrepant regions (~ 21.6 Mbp) excluding telomeric and centromeric regions are highly structurally polymorphic in humans, where the deletions or duplications are likely associated with various human diseases, such as immune and neurodevelopmental disorders. The analyses of a newly identified discrepant region-the KLRC gene cluster-show that the depletion of KLRC2 by a single-deletion event is associated with natural killer cell differentiation in ~ 20% of humans. Meanwhile, the rapid amino acid replacements observed within KLRC3 are probably a result of natural selection in primate evolution.Our study provides a foundation for understanding the large-scale structural genomic differences between the two crucial human reference genomes, and is thereby important for future human genomics studies.© 2023. The Author(s)."
"37397494","Mitochondrial homeostasis: a potential target for delaying renal aging.","Front Pharmacol","Mitochondria, which are the energy factories of the cell, participate in many life activities, and the kidney is a high metabolic organ that contains abundant mitochondria. Renal aging is a degenerative process associated with the accumulation of harmful processes. Increasing attention has been given to the role of abnormal mitochondrial homeostasis in renal aging. However, the role of mitochondrial homeostasis in renal aging has not been reviewed in detail. Here, we summarize the current biochemical markers associated with aging and review the changes in renal structure and function during aging. Moreover, we also review in detail the role of mitochondrial homeostasis abnormalities, including mitochondrial function, mitophagy and mitochondria-mediated oxidative stress and inflammation, in renal aging. Finally, we describe some of the current antiaging compounds that target mitochondria and note that maintaining mitochondrial homeostasis is a potential strategy against renal aging.Copyright © 2023 Yang, Liu, Jiang, Liu, Luo, Li, Zhao, Han, Chen, Li, Xiao and Sun."
"37386214","Readout of histone methylation by Trim24 locally restricts chromatin opening by p53.","Nat Struct Mol Biol","The genomic binding sites of the transcription factor (TF) and tumor suppressor p53 are unusually diverse with regard to their chromatin features, including histone modifications, raising the possibility that the local chromatin environment can contextualize p53 regulation. Here, we show that epigenetic characteristics of closed chromatin, such as DNA methylation, do not influence the binding of p53 across the genome. Instead, the ability of p53 to open chromatin and activate its target genes is locally restricted by its cofactor Trim24. Trim24 binds to both p53 and unmethylated histone 3 lysine 4 (H3K4), thereby preferentially localizing to those p53 sites that reside in closed chromatin, whereas it is deterred from accessible chromatin by H3K4 methylation. The presence of Trim24 increases cell viability upon stress and enables p53 to affect gene expression as a function of the local chromatin state. These findings link H3K4 methylation to p53 function and illustrate how specificity in chromatin can be achieved, not by TF-intrinsic sensitivity to histone modifications, but by employing chromatin-sensitive cofactors that locally modulate TF function.© 2023. The Author(s)."
"37162286","Multi-omic analysis in normal colon organoids highlights MSH4 as a novel marker of defective mismatch repair in Lynch syndrome and microsatellite instability.","Cancer Med","Lynch syndrome (LS) is a hereditary condition that increases the risk of colorectal (CRC) and extracolonic cancers that exhibit microsatellite instability (MSI-H). MSI-H is driven by defective mismatch repair (dMMR), and approximately 15% of nonhereditary CRCs also exhibit MSI-H. Here, we aimed to better define mechanisms underlying tumor initiation in LS and MSI-H cancers through multi-omic analyses of LS normal colon organoids and MSI-H tumors.Right (n = 35) and left (n = 23) colon organoids generated from normal colon biopsies at routine colonoscopy of LS and healthy individuals were subjected to Illumina EPIC array. Differentially methylated region (DMR) analysis was performed by DMRcate. RNA-sequencing (n = 16) and bisulfite-sequencing (n = 15) were performed on a subset of right colon organoids. CRISPR-cas9-mediated editing of MMR genes in colon organoids of healthy individuals was followed by quantitative PCR of MSH4. The relationship between MSH4 expression and tumor mutational burden was further explored in three independent tumor data sets.We identified a hypermethylated region of MSH4 in both the right and left colon organoids of LS versus healthy controls, which we validated using bisulfite-sequencing. DMR analysis in three gastrointestinal and one endometrial data set revealed that this region was also hypermethylated in MSI-H versus microsatellite stable (MSS) tumors. MSH4 expression was increased in colon organoids of LS versus healthy subjects and in publicly available MSI-H versus MSS tumors across four RNA-seq and four microarray data sets. CRISPR-cas9 editing of MLH1 and MSH2, but not MSH6, in normal colon organoids significantly increased MSH4 expression. MSH4 expression was significantly associated with tumor mutational burden in three publicly available data sets.Our findings implicate DNA methylation and gene expression differences of MSH4 as a marker of dMMR and as a potential novel biomarker of LS. Our study of LS colon organoids supports the hypothesis that dMMR exists in the colons of LS subjects prior to CRC.© 2023 The Authors. Cancer Medicine published by John Wiley & Sons Ltd."
"37293824","De Novo Structural Variations of Escherichia coli Detected by Nanopore Long-Read Sequencing.","Genome Biol Evol","Spontaneous mutations power evolution, whereas large-scale structural variations (SVs) remain poorly studied, primarily because of the lack of long-read sequencing techniques and powerful analytical tools. Here, we explore the SVs of Escherichia coli by running 67 wild-type (WT) and 37 mismatch repair (MMR)-deficient (ΔmutS) mutation accumulation lines, each experiencing more than 4,000 cell divisions, by applying Nanopore long-read sequencing and Illumina PE150 sequencing and verifying the results by Sanger sequencing. In addition to precisely repeating previous mutation rates of base-pair substitutions and insertion and deletion (indel) mutation rates, we do find significant improvement in insertion and deletion detection using long-read sequencing. The long-read sequencing and corresponding software can particularly detect bacterial SVs in both simulated and real data sets with high accuracy. These lead to SV rates of 2.77 × 10-4 (WT) and 5.26 × 10-4 (MMR-deficient) per cell division per genome, which is comparable with previous reports. This study provides the SV rates of E. coli by applying long-read sequencing and SV detection programs, revealing a broader and more accurate picture of spontaneous mutations in bacteria.© The Author(s) 2023. Published by Oxford University Press on behalf of Society for Molecular Biology and Evolution."
"37400795","Genetically mimicked effects of ASGR1 inhibitors on all-cause mortality and health outcomes: a drug-target Mendelian randomization study and a phenome-wide association study.","BMC Med","Asialoglycoprotein receptor 1 (ASGR1) is emerging as a potential drug target to reduce low-density lipoprotein (LDL)-cholesterol and coronary artery disease (CAD) risk. Here, we investigated genetically mimicked ASGR1 inhibitors on all-cause mortality and any possible adverse effects.We conducted a drug-target Mendelian randomization study to assess genetically mimicked effects of ASGR1 inhibitors on all-cause mortality and 25 a priori outcomes relevant to lipid traits, CAD, and possible adverse effects, i.e. liver function, cholelithiasis, adiposity and type 2 diabetes. We also performed a phenome-wide association study of 1951 health-related phenotypes to identify any novel effects. Associations found were compared with those for currently used lipid modifiers, assessed using colocalization, and replicated where possible.Genetically mimicked ASGR1 inhibitors were associated with a longer lifespan (3.31 years per standard deviation reduction in LDL-cholesterol, 95% confidence interval 1.01 to 5.62). Genetically mimicked ASGR1 inhibitors were inversely associated with apolipoprotein B (apoB), triglycerides (TG) and CAD risk. Genetically mimicked ASGR1 inhibitors were positively associated with alkaline phosphatase, gamma glutamyltransferase, erythrocyte traits, insulin-like growth factor 1 (IGF-1) and C-reactive protein (CRP), but were inversely associated with albumin and calcium. Genetically mimicked ASGR1 inhibitors were not associated with cholelithiasis, adiposity or type 2 diabetes. Associations with apoB and TG were stronger for ASGR1 inhibitors compared with currently used lipid modifiers, and most non-lipid effects were specific to ASGR1 inhibitors. The probabilities for colocalization were > 0.80 for most of these associations, but were 0.42 for lifespan and 0.30 for CAD. These associations were replicated using alternative genetic instruments and other publicly available genetic summary statistics.Genetically mimicked ASGR1 inhibitors reduced all-cause mortality. Beyond lipid-lowering, genetically mimicked ASGR1 inhibitors increased liver enzymes, erythrocyte traits, IGF-1 and CRP, but decreased albumin and calcium.© 2023. The Author(s)."
