"pmid","title","source","abstract"
"33666134","DNA-methylation for the detection and distinction of 19 human malignancies.","Epigenetics","The contribution of DNA-methylation based gene silencing to carcinogenesis is well established. Increasingly, DNA-methylation is examined using genome-wide techniques, with recent public efforts yielding immense data sets of diverse malignancies representing the vast majority of human cancer related disease burden. Whereas mutation events may group preferentially or in high frequency with a given histology, mutations are poor classifiers of tumour type. Here we examine the hypothesis that cancer-specific DNA-methylation reflects the tissue of origin or carcinogenic risk factor, and these methylation abnormalities may be used to faithfully classify tumours according to histology. We present an analysis of 7427 tumours representing 19 human malignancies and 708 normal samples demonstrating that specific tumour changes in methylation can correctly determine site of origin and tumour histology with 86% overall accuracy. Examination of misclassified tumours reveals underlying shared biology as the source of misclassifications, including common cell of origin or risk factors."
"33664766","Identification of Potential Driver Genes Based on Multi-Genomic Data in Cervical Cancer.","Front Genet","Background:Cervical cancer became the third most common cancer among women, and genome characterization of cervical cancer patients has revealed the extensive complexity of molecular alterations. However, identifying driver mutation and depicting molecular classification in cervical cancer remain a challenge.Methods:We performed an integrative multi-platform analysis of a cervical cancer cohort from The Cancer Genome Atlas (TCGA) based on 284 clinical cases and identified the driver genes and possible molecular classification of cervical cancer.Results:Multi-platform integration showed that cervical cancer exhibited a wide range of mutation. The top 10 mutated genes were TTN, PIK3CA, MUC4, KMT2C, MUC16, KMT2D, SYNE1, FLG, DST, and EP300, with a mutation rate from 12 to 33%. Applying GISTIC to detect copy number variation (CNV), the most frequent chromosome arm-level CNVs included losses in 4p, 11p, and 11q and gains in 20q, 3q, and 1q. Then, we performed unsupervised consensus clustering of tumor CNV profiles and methylation profiles and detected four statistically significant expression subtypes. Finally, by combining the multidimensional datasets, we identified 10 potential driver genes, including GPR107, CHRNA5, ZBTB20, Rb1, NCAPH2, SCA1, SLC25A5, RBPMS, DDX3X, and H2BFM.Conclusions:This comprehensive analysis described the genetic characteristic of cervical cancer and identified novel driver genes in cervical cancer. These results provide insight into developing precision treatment in cervical cancer.Copyright © 2021 Xu, Luo, Hu and Zhu."
"33663669","[Research Status and Hot Trends in Atherosclerosis Genomics between 2010 and 2019].","Zhongguo Yi Xue Ke Xue Yuan Xue Bao","Objective To analyze the research status,hotspots,and frontiers of atherosclerosis genomics from 2010 to 2019.Methods CiteSpace software was used to conduct data statistics and visual analysis on countries,institutions,authors,journals,co-cited papers,and keywords of the related papers published in the Web of Science from 2010 to 2019.Results A total of 1021 papers in English were included,and the annual number of publications generally showed an upward trend.The knowledge base in the research of atherosclerosis mostly focused on the genetic risk sites and biomarkers for coronary artery diseases such as coronary heart disease,myocardial infarction,and dyslipidemia.The related journals mainly involved the fields of molecular biology,biology,genetics,immunology,medicine,pharmacy,and clinical medicine.The latest research in atherosclerosis concentrated on genome-wide association study,DNA methylation,microRNA,messenger RNA and so on.The research frontiers involved long noncoding RNA,DNA methylation,and immune metabolism.Conclusion The studies in atherosclerotic genomics have gradually increased."
"33663600","DNA methylation mediates the effect of maternal smoking on offspring birthweight: a birth cohort study of multi-ethnic US mother-newborn pairs.","Clin Epigenetics","Maternal smoking affects more than half a million pregnancies each year in the US and is known to result in fetal growth restriction as measured by lower birthweight and its associated long-term consequences. Maternal smoking also has been linked to altered fetal DNA methylation (DNAm). However, what remains largely unexplored is whether these DNAm alterations are merely markers of smoking exposure or if they also have implications for health outcomes. This study tested the hypothesis that fetal DNAm mediates the effect of maternal smoking on newborn birthweight.This study included mother-newborn pairs from a US predominantly urban, low-income multi-ethnic birth cohort. DNAm in cord blood were determined using the Illumina Infinium MethylationEPIC BeadChip. After standard quality control and normalization procedures, an epigenome-wide association study (EWAS) of maternal smoking was performed using linear regression models, controlling for maternal age, education, race, parity, pre-pregnancy body mass index, alcohol consumption, gestational age, maternal pregestational/gestational diabetes, child sex, cord blood cell compositions and batch effects. To quantify the degree to which cord DNAm mediates the smoking-birthweight association, the VanderWeele-Vansteelandt approach for single mediator and structural equational model for multiple mediators were used, adjusting for pertinent covariates.The study included 954 mother-newborn pairs. Among mothers, 165 (17.3%) ever smoked before or during pregnancy. Newborns with smoking exposure had on average 258 g lower birthweight than newborns without exposure (P < 0.001). Using a false discovery rate (FDR) < 0.05 as the significance cutoff, the EWAS identified 38 differentially methylated CpG sites associated with maternal smoking. Of those, 17 CpG sites were mapped to previously reported genes: GFI1, AHRR, CYP1A1, and CNTNAP2; 8 of those, located in the first three genes, were Bonferroni significantly associated with newborn birthweight and mediated the smoking-birthweight association. The combined mediation effect of the three genes explained 67.8% of the smoking-birthweight association.Our study not only lends further support that maternal smoking alters fetal DNAm in a multiethnic population, but also suggests that fetal DNAm substantially mediates the maternal smoking-birthweight association. Our findings, if further validated, indicate that DNAm modification is likely an important pathway by which maternal smoking impairs fetal growth and, perhaps, even long-term health outcomes."
"33665346","Differential blood DNA methylation across Lewy body dementias.","Alzheimers Dement (Amst)","Dementia with Lewy bodies (DLB) and Parkinson's disease dementia (PDD) are characterized by cognitive alterations, visual hallucinations, and motor impairment. Diagnosis is based on type and timing of clinical manifestations; however, determination of clinical subtypes is challenging. The utility of blood DNA methylation as a biomarker for Lewy body disorders (LBD) is mostly unexplored.We performed a cross-sectional analysis of blood methylation in 42 DLB and 50 PDD cases applying linear models to compare groups and logistic least absolute shrinkage and selection operator regression to explore the discriminant power of methylation signals.DLB blood shows differential methylation compared to PDD. Some methylation changes associate with core features of LBD. Sets of probes show high predictive value to discriminate between variants.Our study is the first to explore LBD blood methylation. Despite overlapping clinical presentation, we detected differential epigenetic signatures that, if confirmed in independent cohorts, could be developed into useful biomarkers.© 2021 The Authors. Alzheimer's & Dementia: Diagnosis, Assessment & Disease Monitoring published by Wiley Periodicals, LLC on behalf of Alzheimer's Association."
"33750355","Effects of maternal folic acid supplementation during the second and third trimesters of pregnancy on neurocognitive development in the child: an 11-year follow-up from a randomised controlled trial.","BMC Med","Maternal folic acid (FA) supplementation before and in early pregnancy prevents neural tube defects (NTD), but it is uncertain whether continuing FA after the first trimester has benefits on offspring health. We aimed to evaluate the effect of FA supplementation throughout pregnancy on cognitive performance and brain function in the child.Follow-up investigation of 11-year-old children, residing in Northern Ireland, whose mothers had participated in a randomised trial of Folic Acid Supplementation in the Second and Third Trimesters (FASSTT) in pregnancy and received 400 μg/day FA or placebo from the 14th gestational week. Cognitive performance (Full Scale Intelligence Quotient, Verbal Comprehension, Working Memory, Perceptual Reasoning, and Processing Speed) was assessed using the Wechsler Intelligence Scale for Children. Neuronal function was assessed using magnetoencephalographic (MEG) brain imaging.Of 119 mother-child pairs in the FASSTT trial, 68 children were assessed for neurocognitive performance at 11-year follow-up (Dec 2017 to Nov 2018). Children of mothers randomised to FA compared with placebo scored significantly higher in two Processing Speed tests, i.e. symbol search (mean difference 2.9 points, 95% CI 0.3 to 5.5, p = 0.03) and cancellation (11.3 points, 2.5 to 20.1, p = 0.04), whereas the positive effect on Verbal Comprehension was significant in girls only (6.5 points, 1.2 to 11.8, p = 0.03). MEG assessment of neuronal responses to a language task showed increased power at the Beta (13-30 Hz, p = 0.01) and High Gamma (49-70 Hz, p = 0.04) bands in children from FA-supplemented mothers, suggesting more efficient semantic processing of language.Continued FA supplementation in pregnancy beyond the early period currently recommended to prevent NTD can benefit neurocognitive development of the child. MEG provides a non-invasive tool in paediatric research to objectively assess functional brain activity in response to nutrition and other interventions.ISRCTN ISRCTN19917787 . Registered on 15 May 2013."
"33653394","Weight management intervention identifies association of decreased DNA methylation age with improved functional age measures in older adults with obesity.","Clin Epigenetics","Assessing functional ability is an important component of understanding healthy aging. Objective measures of functional ability include grip strength, gait speed, sit-to-stand time, and 6-min walk distance. Using samples from a weight loss clinical trial in older adults with obesity, we examined the association between changes in physical function and DNA-methylation-based biological age at baseline and 12 weeks in 16 individuals. Peripheral blood DNA methylation was measured (pre/post) with the Illumina HumanMethylationEPIC array and the Hannum, Horvath, and PhenoAge DNA methylation age clocks were used. Linear regression models adjusted for chronological age and sex tested the relationship between DNA methylation age and grip strength, gait speed, sit-to-stand, and 6-min walk.Participant mean weight loss was 4.6 kg, and DNA methylation age decreased 0.8, 1.1, and 0.5 years using the Hannum, Horvath, and PhenoAge DNA methylation clocks respectively. Mean grip strength increased 3.2 kg. Decreased Hannum methylation age was significantly associated with increased grip strength (β = -0.30, p = 0.04), and increased gait speed (β = 0.02, p = 0.05), in adjusted models. Similarly, decreased methylation age using the PhenoAge clock was associated with significantly increased gait speed (β = 0.02, p = 0.04). A decrease in Horvath DNA methylation age and increase in physical functional ability did not demonstrate a significant association.The observed relationship between increased physical functional ability and decreased biological age using DNA methylation clocks demonstrate the potential utility of DNA methylation clocks to assess interventional approaches to improve health in older obese adults.National Institute on Aging (NIA), NCT03104192. Posted April 7, 2017, https://clinicaltrials.gov/ct2/show/NCT03104192."
"33650826","Ovulation Induction Changes Epigenetic Marks of Imprinting Genes in Mice Fetus Organs.","Cell J","Genomic imprinting is an epigenetic phenomenon that plays a critical role in normal development of embryo. Using exogenous hormones during assisted reproductive technology (ART) can change an organism hormonal profile and subsequently affect epigenetic events. Ovarian stimulation changes gene expression and epigenetic pattern of imprinted genes in the organs of mouse fetus.For this experimental study, expression of three imprinted genesH19, Igf2(Insulin-like growth factor 2) andCdkn1c(Cyclin-dependent kinase inhibitor 1C), which have important roles in development of placenta and embryo, and the epigenetic profile of their regulatory region in some tissues of 19-days-old female fetuses, from female mice subjected to ovarian stimulation, were evaluated by quantitative reverse-transcription PCR (qRT-PCR) and Chromatin immunoprecipitation (ChIP) methods.H19gene was significantly lower in heart (P<0.05), liver (P<0.05), lung (P<0.01), placenta (P<0.01) and ovary (P<0.01). It was significantly higher in kidney of ovarian stimulation group compared to control fetuses (P<0.05).Igf2expression was significantly higher in brain (P<0.05) and kidney (P<0.05), while it was significantly lower in lung of experimental group fetuses in comparison with control fetuses (P<0.05).Cdkn1cexpression was significantly higher in lung (P<0.05). It was significantly decreased in placenta of experimental group fetuses rather than the control fetuses (P<0.05). Histone modification data and DNA methylation data were in accordance to the gene expression profiles.Results showed altered gene expressions in line with changes in epigenetic pattern of their promoters in the ovarian stimulation group, compared to normal cycle.Copyright© by Royan Institute. All rights reserved."
"33658387","Predicting transcriptional responses to cold stress across plant species.","Proc Natl Acad Sci U S A","Although genome-sequence assemblies are available for a growing number of plant species, gene-expression responses to stimuli have been cataloged for only a subset of these species. Many genes show altered transcription patterns in response to abiotic stresses. However, orthologous genes in related species often exhibit different responses to a given stress. Accordingly, data on the regulation of gene expression in one species are not reliable predictors of orthologous gene responses in a related species. Here, we trained a supervised classification model to identify genes that transcriptionally respond to cold stress. A model trained with only features calculated directly from genome assemblies exhibited only modest decreases in performance relative to models trained by using genomic, chromatin, and evolution/diversity features. Models trained with data from one species successfully predicted which genes would respond to cold stress in other related species. Cross-species predictions remained accurate when training was performed in cold-sensitive species and predictions were performed in cold-tolerant species and vice versa. Models trained with data on gene expression in multiple species provided at least equivalent performance to models trained and tested in a single species and outperformed single-species models in cross-species prediction. These results suggest that classifiers trained on stress data from well-studied species may suffice for predicting gene-expression patterns in related, less-studied species with sequenced genomes.Copyright © 2021 the Author(s). Published by PNAS."
"33672064","Implementing Precision Medicine in Human Frailty through Epigenetic Biomarkers.","Int J Environ Res Public Health","The main epigenetic features in aging are: reduced bulk levels of core histones, altered pattern of histone post-translational modifications, changes in the pattern of DNA methylation, replacement of canonical histones with histone variants, and altered expression of non-coding RNA. The identification of epigenetic mechanisms may contribute to the early detection of age-associated subclinical changes or deficits at the molecular and/or cellular level, to predict the development of frailty, or even more interestingly, to improve health trajectories in older adults. Frailty reflects a state of increased vulnerability to stressors as a result of decreased physiologic reserves, and even dysregulation of multiple physiologic systems leading to adverse health outcomes for individuals of the same chronological age. A key approach to overcome the challenges of frailty is the development of biomarkers to improve early diagnostic accuracy and to predict trajectories in older individuals. The identification of epigenetic biomarkers of frailty could provide important support for the clinical diagnosis of frailty, or more specifically, to the evaluation of its associated risks. Interventional studies aimed at delaying the onset of frailty and the functional alterations associated with it, would also undoubtedly benefit from the identification of frailty biomarkers. Specific to the article yet reasonably common within the subject discipline."
"33674594","Identifying transposable element expression dynamics and heterogeneity during development at the single-cell level with a processing pipeline scTE.","Nat Commun","Transposable elements (TEs) make up a majority of a typical eukaryote's genome, and contribute to cell heterogeneity in unclear ways. Single-cell sequencing technologies are powerful tools to explore cells, however analysis is typically gene-centric and TE expression has not been addressed. Here, we develop a single-cell TE processing pipeline, scTE, and report the expression of TEs in single cells in a range of biological contexts. Specific TE types are expressed in subpopulations of embryonic stem cells and are dynamically regulated during pluripotency reprogramming, differentiation, and embryogenesis. Unexpectedly, TEs are expressed in somatic cells, including human disease-specific TEs that are undetectable in bulk analyses. Finally, we apply scTE to single-cell ATAC-seq data, and demonstrate that scTE can discriminate cell type using chromatin accessibly of TEs alone. Overall, our results classify the dynamic patterns of TEs in single cells and their contributions to cell heterogeneity."
"33669384","DNA Methylation, Mechanisms of <i>FMR1</i> Inactivation and Therapeutic Perspectives for Fragile X Syndrome.","Biomolecules","Among the inherited causes of intellectual disability and autism, Fragile X syndrome (FXS) is the most frequent form, for which there is currently no cure. In most FXS patients, theFMR1gene is epigenetically inactivated following the expansion over 200 triplets of a CGG repeat (FM: full mutation).FMR1encodes the Fragile X Mental Retardation Protein (FMRP), which binds several mRNAs, mainly in the brain. When the FM becomes methylated at 10-12 weeks of gestation, theFMR1gene is transcriptionally silent. The molecular mechanisms involved in the epigenetic silencing are not fully elucidated. Among FXS families, there is a rare occurrence of males carrying a FM, which remains active because it is not methylated, thus ensuring enough FMRPs to allow for an intellectual development within normal range. Which mechanisms are responsible for sparing these individuals from being affected by FXS? In order to answer this critical question, which may have possible implications for FXS therapy, several potential epigenetic mechanisms have been described. Here, we focus on current knowledge about the role of DNA methylation and other epigenetic modifications inFMR1gene silencing."
"33681234","Self-Balance of Intestinal Flora in Spouses of Patients With Rheumatoid Arthritis.","Front Med (Lausanne)","We sought to characterize and assess differences in compositions of intestinal flora between patients with rheumatoid arthritis (RA) and their respective spouses. Eighty volunteers were recruited, including 30 pairs of RA patients and their spouses, and 20 healthy individuals. Fresh stool samples were collected, processed, and 16S rRNA-sequencing was performed. Data were analyzed using an operational taxonomic units-based method, and community structure assessments were performed. Community composition analysis indicated that there were similar intestinal microbiota structures in RA and in their respective spouses. Gut microbiota in spouses of RA were different from those of the healthy controls group, but these differences were not significant. We found thatBlautiaspp. andStreptococcusspp. were two most associated species in RA and these taxa were significantly higher in comparison to healthy controls. In contrast, our findings suggested thatRoseburiaspp. andLachnoclostridiumspp. were significantly lower in the RA in comparison to healthy controls. In conclusion, RA patients shared similar gut microbiota pattern with their spouses which were different from healthy individuals. The findings suggest that disturbance of the balance of gut microbiota may play an important role in the dynamics of pathogenesis of RA.Copyright © 2020 Liu, Wu, Luo, Wei, Lu, Zhou, Wang, Miao, Lin, Zhao, Liu and Liu."
"33758402","The cellular and functional complexity of thermogenic fat.","Nat Rev Mol Cell Biol","Brown and beige adipocytes are mitochondria-enriched cells capable of dissipating energy in the form of heat. These thermogenic fat cells were originally considered to function solely in heat generation through the action of the mitochondrial protein uncoupling protein 1 (UCP1). In recent years, significant advances have been made in our understanding of the ontogeny, bioenergetics and physiological functions of thermogenic fat. Distinct subtypes of thermogenic adipocytes have been identified with unique developmental origins, which have been increasingly dissected in cellular and molecular detail. Moreover, several UCP1-independent thermogenic mechanisms have been described, expanding the role of these cells in energy homeostasis. Recent studies have also delineated roles for these cells beyond the regulation of thermogenesis, including as dynamic secretory cells and as a metabolic sink. This Review presents our current understanding of thermogenic adipocytes with an emphasis on their development, biological functions and roles in systemic physiology."
"33686288","Identifying loci with different allele frequencies among cases of eight psychiatric disorders using CC-GWAS.","Nat Genet","Psychiatric disorders are highly genetically correlated, but little research has been conducted on the genetic differences between disorders. We developed a new method (case-case genome-wide association study; CC-GWAS) to test for differences in allele frequency between cases of two disorders using summary statistics from the respective case-control GWAS, transcending current methods that require individual-level data. Simulations and analytical computations confirm that CC-GWAS is well powered with effective control of type I error. We applied CC-GWAS to publicly available summary statistics for schizophrenia, bipolar disorder, major depressive disorder and five other psychiatric disorders. CC-GWAS identified 196 independent case-case loci, including 72 CC-GWAS-specific loci that were not significant at the genome-wide level in the input case-control summary statistics; two of the CC-GWAS-specific loci implicate the genes KLF6 and KLF16 (from the Krüppel-like family of transcription factors), which have been linked to neurite outgrowth and axon regeneration. CC-GWAS loci replicated convincingly in applications to datasets with independent replication data."
"33664403","Quantifying genetic heterogeneity between continental populations for human height and body mass index.","Sci Rep","Genome-wide association studies (GWAS) in samples of European ancestry have identified thousands of genetic variants associated with complex traits in humans. However, it remains largely unclear whether these associations can be used in non-European populations. Here, we seek to quantify the proportion of genetic variation for a complex trait shared between continental populations. We estimated the between-population correlation of genetic effects at all SNPs ([Formula: see text]) or genome-wide significant SNPs ([Formula: see text]) for height and body mass index (BMI) in samples of European (EUR; [Formula: see text]) and African (AFR; [Formula: see text]) ancestry. The [Formula: see text] between EUR and AFR was 0.75 ([Formula: see text]) for height and 0.68 ([Formula: see text]) for BMI, and the corresponding [Formula: see text] was 0.82 ([Formula: see text]) for height and 0.87 ([Formula: see text]) for BMI, suggesting that a large proportion of GWAS findings discovered in Europeans are likely applicable to non-Europeans for height and BMI. There was no evidence that [Formula: see text] differs in SNP groups with different levels of between-population difference in allele frequency or linkage disequilibrium, which, however, can be due to the lack of power."
