"pmid","title","source","abstract"
"33664295","A two-tiered targeted proteomics approach to identify pre-diagnostic biomarkers of colorectal cancer risk.","Sci Rep","Colorectal cancer prognosis is dependent on stage, and measures to improve early detection are urgently needed. Using prospectively collected plasma samples from the population-based Northern Sweden Health and Disease Study, we evaluated protein biomarkers in relation to colorectal cancer risk. Applying a two-tiered approach, we analyzed 160 proteins in matched sequential samples from 58 incident colorectal cancer case-control pairs. Twenty-one proteins selected from both this discovery phase and the literature were then analyzed in a validation set of 450 case-control pairs. Odds ratios were estimated by conditional logistic regression. LASSO regression and ROC analysis were used for multi-marker analyses. In the main validation analysis, no proteins retained statistical significance. However, exploratory subgroup analyses showed associations between FGF-21 and colon cancer risk (multivariable OR per 1 SD: 1.23 95% CI 1.03-1.47) as well as between PPY and rectal cancer risk (multivariable OR per 1 SD: 1.47 95% CI 1.12-1.92). Adding protein markers to basic risk predictive models increased performance modestly. Our results highlight the challenge of developing biomarkers that are effective in the asymptomatic, prediagnostic window of opportunity for early detection of colorectal cancer. Distinguishing between cancer subtypes may improve prediction accuracy. However, single biomarkers or small panels may not be sufficient for effective precision screening."
"33758620","Identification of tumor mutation burden-related hub genes and the underlying mechanism in melanoma.","J Cancer","Background:Tumor mutation burden (TMB) has emerged as an important predictive factor for drug resistance in cancers; however, the specific mechanism underlying TMB function in melanoma remains elusive.Methods:Data on somatic mutations, RNA sequencing (RNA-seq), miRNA sequencing (miRNA-seq), and clinical characteristics for 472 melanoma patients were extracted from the TCGA cohort. RNA-seq data of melanoma cell lines were obtained from the Cancer Cell Line Encyclopedia, and sensitivity of cell lines to therapeutic agents is available in the Cancer Therapeutics Response Portal. TMB was calculated based on somatic mutation data. Differentially expressed gene analysis, weighted gene co-expression network analysis, protein-protein interaction networks, Minimal Common Oncology Data Elements, and survival analysis were leveraged to determine TMB-related hub genes. Competing endogenous RNA (ceRNA) networks were constructed to explore the molecular mechanisms underlying hub gene function. The influence of key genes on drug sensitivity was analyzed to investigate their clinical significance.Results:Elevated TMB levels were significantly correlated with improved survival outcomes. In addition, six tumor-infiltrating immune cells, including naive B cells, regulatory T cells, memory resting CD4 T cells, memory B cells, activated mast cells, and resting NK cells, were significantly overexpressed in the low-TMB group relative to the high-TMB group. Furthermore, we identifiedFLNC, NEXN,andTNNT3as TMB-related hub genes, and constructed their ceRNA networks, including five miRNAs (has-miR-590-3p, has-miR-374b-5p, has-miR-3127-5p, has-miR-1913, and has-miR-1291) and 31 lncRNAs (FAM66C, MIAT, NR2F2AS1, etc.). Finally, we observed that TMB-related genes were associated with distinct therapeutic responses to AKT/mTOR pathway inhibitors.Conclusions:We identified three TMB-associated key genes, established their ceRNA networks, and investigated their influence on therapeutic responses, which could provide insights into future precision medicine.© The author(s)."
"33750001","Multi-modal meta-analysis of cancer cell line omics profiles identifies ECHDC1 as a novel breast tumor suppressor.","Mol Syst Biol","Molecular and functional profiling of cancer cell lines is subject to laboratory-specific experimental practices and data analysis protocols. The current challenge therefore is how to make an integrated use of the omics profiles of cancer cell lines for reliable biological discoveries. Here, we carried out a systematic analysis of nine types of data modalities using meta-analysis of 53 omics studies across 12 research laboratories for 2,018 cell lines. To account for a relatively low consistency observed for certain data modalities, we developed a robust data integration approach that identifies reproducible signals shared among multiple data modalities and studies. We demonstrated the power of the integrative analyses by identifying a novel driver gene, ECHDC1, with tumor suppressive role validated both in breast cancer cells and patient tumors. The multi-modal meta-analysis approach also identified synthetic lethal partners of cancer drivers, including a co-dependency of PTEN deficient endometrial cancer cells on RNA helicases.© 2021 The Authors. Published under the terms of the CC BY 4.0 license."
"33743584","SVExpress: identifying gene features altered recurrently in expression with nearby structural variant breakpoints.","BMC Bioinformatics","Combined whole-genome sequencing (WGS) and RNA sequencing of cancers offer the opportunity to identify genes with altered expression due to genomic rearrangements. Somatic structural variants (SVs), as identified by WGS, can involve altered gene cis-regulation, gene fusions, copy number alterations, or gene disruption. The absence of computational tools to streamline integrative analysis steps may represent a barrier in identifying genes recurrently altered by genomic rearrangement.Here, we introduce SVExpress, a set of tools for carrying out integrative analysis of SV and gene expression data. SVExpress enables systematic cataloging of genes that consistently show increased or decreased expression in conjunction with the presence of nearby SV breakpoints. SVExpress can evaluate breakpoints in proximity to genes for potential enhancer translocation events or disruption of topologically associated domains, two mechanisms by which SVs may deregulate genes. The output from any commonly used SV calling algorithm may be easily adapted for use with SVExpress. SVExpress can readily analyze genomic datasets involving hundreds of cancer sample profiles. Here, we used SVExpress to analyze SV and expression data across 327 cancer cell lines with combined SV and expression data in the Cancer Cell Line Encyclopedia (CCLE). In the CCLE dataset, hundreds of genes showed altered gene expression in relation to nearby SV breakpoints. Altered genes involved TAD disruption, enhancer hijacking, and gene fusions. When comparing the top set of SV-altered genes from cancer cell lines with the top SV-altered genes previously reported for human tumors from The Cancer Genome Atlas and the Pan-Cancer Analysis of Whole Genomes datasets, a significant number of genes overlapped in the same direction for both cell lines and tumors, while some genes were significant for cell lines but not for human tumors and vice versa.Our SVExpress tools allow computational biologists with a working knowledge of R to integrate gene expression with SV breakpoint data to identify recurrently altered genes. SVExpress is freely available for academic or commercial use at https://github.com/chadcreighton/SVExpress . SVExpress is implemented as a set of Excel macros and R code. All source code (R and Visual Basic for Applications) is available."
"33641663","TMEM52B suppression promotes cancer cell survival and invasion through modulating E-cadherin stability and EGFR activity.","J Exp Clin Cancer Res","TMEM52B is a novel gene broadly expressed in a variety of normal human tissues. However, the biological function of TMEM52B expression in cancer is largely unknown.The effects of TMEM52B on tumor growth and metastasis were investigated in vitro and in vivo, and the underlying biological and molecular mechanisms involved in this process were evaluated. Clinical datasets from KmPlotter and The Cancer Genome Atlas (TCGA) were analyzed in relation to TMEM52B expression and function.Suppression of TMEM52B in colon cancer cells promoted cancer cell epithelial-mesenchymal transition (EMT), invasion, and survival in vitro. Similarly, in vivo studies showed increased tumor growth and circulating tumor cell survival (early metastasis). ERK1/2, JNK, and AKT signaling pathways were involved in TMEM52B suppression-induced invasiveness and cell survival. TMEM52B suppression promoted activation and internalization of epidermal growth factor receptor (EGFR) with enhanced downstream signaling activity, leading to enhanced cell survival and invasion. In addition, TMEM52B suppression reduced E-cadherin stability, likely due to a reduced association between it and E-cadherin, which led to enhanced β-catenin transcriptional activity. Concomitantly, TMEM52B suppression promoted generation of soluble E-cadherin fragments, contributing to the activation of EGFR. Clinical data showed that high TMEM52B expression correlated with increased patient survival in multiple types of cancer, including breast, lung, kidney, and rectal cancers, and suggested a correlation between TMEM52B and E-cadherin.These findings suggest that TMEM52B is a novel modulator of the interplay between E-cadherin and EGFR. It is possible that TMEM52B functions as a tumor-suppressor that could potentially be used as a novel prognostic marker for cancer."
"33630864","Impact of between-tissue differences on pan-cancer predictions of drug sensitivity.","PLoS Comput Biol","Increased availability of drug response and genomics data for many tumor cell lines has accelerated the development of pan-cancer prediction models of drug response. However, it is unclear how much between-tissue differences in drug response and molecular characteristics may contribute to pan-cancer predictions. Also unknown is whether the performance of pan-cancer models could vary by cancer type. Here, we built a series of pan-cancer models using two datasets containing 346 and 504 cell lines, each with MEK inhibitor (MEKi) response and mRNA expression, point mutation, and copy number variation data, and found that, while the tissue-level drug responses are accurately predicted (between-tissue ρ = 0.88-0.98), only 5 of 10 cancer types showed successful within-tissue prediction performance (within-tissue ρ = 0.11-0.64). Between-tissue differences make substantial contributions to the performance of pan-cancer MEKi response predictions, as exclusion of between-tissue signals leads to a decrease in Spearman's ρ from a range of 0.43-0.62 to 0.30-0.51. In practice, joint analysis of multiple cancer types usually has a larger sample size, hence greater power, than for one cancer type; and we observe that higher accuracy of pan-cancer prediction of MEKi response is almost entirely due to the sample size advantage. Success of pan-cancer prediction reveals how drug response in different cancers may invoke shared regulatory mechanisms despite tissue-specific routes of oncogenesis, yet predictions in different cancer types require flexible incorporation of between-cancer and within-cancer signals. As most datasets in genome sciences contain multiple levels of heterogeneity, careful parsing of group characteristics and within-group, individual variation is essential when making robust inference."
"33712590","Global discovery of lupus genetic risk variant allelic enhancer activity.","Nat Commun","Genome-wide association studies of Systemic Lupus Erythematosus (SLE) nominate 3073 genetic variants at 91 risk loci. To systematically screen these variants for allelic transcriptional enhancer activity, we construct a massively parallel reporter assay (MPRA) library comprising 12,396 DNA oligonucleotides containing the genomic context around every allele of each SLE variant. Transfection into the Epstein-Barr virus-transformed B cell line GM12878 reveals 482 variants with enhancer activity, with 51 variants showing genotype-dependent (allelic) enhancer activity at 27 risk loci. Comparison of MPRA results in GM12878 and Jurkat T cell lines highlights shared and unique allelic transcriptional regulatory mechanisms at SLE risk loci. In-depth analysis of allelic transcription factor (TF) binding at and around allelic variants identifies one class of TFs whose DNA-binding motif tends to be directly altered by the risk variant and a second class of TFs that bind allelically without direct alteration of their motif by the variant. Collectively, our approach provides a blueprint for the discovery of allelic gene regulation at risk loci for any disease and offers insight into the transcriptional regulatory mechanisms underlying SLE."
"33725356","Targeting Age-Related Neurodegenerative Diseases by AAV-Mediated Gene Therapy.","Adv Exp Med Biol","Age-related neurodegenerative diseases have detrimental consequences on health of many patients and result in mortality. The current treatment options are limited and usually fail to correct the underlying pathology. AAV-based gene therapies have proved to be safe based on the data available on clinical trials for several monogenic diseases. Therefore, such therapies can pave the way to treat neurodegenerative diseases likes Alzheimer's disease (AD), Parkinson's disease (PD), and amyotrophic lateral sclerosis (ALS). Here, the advantages of AAV-based gene therapies are discussed with emphasis on efforts of developing novel capsids with superior therapeutic efficacy. Furthermore, the results of clinical trials on AD, PD, and ALS are summarized."
"33671963","Household Air Pollution from Biomass Fuel for Cooking and Adverse Fetal Growth Outcomes in Rural Sri Lanka.","Int J Environ Res Public Health","The aim of this study was to investigate the impact of biomass fuel for cooking on adverse fetal growth outcomes in Sri Lanka. A cross-sectional study of mothers recruited at maternity clinics in rural communities in Sri Lanka's Central Province was undertaken. Data pertaining to household air pollution and fetal growth parameters were collected using an interviewer-administered questionnaire. Logistic regression models, adjusted for potential confounders, were used to evaluate the impact of biomass fuel for cooking on low birth weight (LBW) and small for gestational age (SGA) parameters. Findings showed that exposure to biomass cooking fuels during pregnancy was associated with an increased risk of LBW adjusted odds ratio (aOR) 2.74 (95% CI 1.08-6.96) and SGA (aOR: 1.87, 95% CI 1.03-3.41) compared with the use of clean energy. The risk of LBW was highest for traditional biomass stoves compared to improved biomass stoves (aOR: 3.23, 95% 1.17-8.89) and biomass use in kitchens without a chimney compared to kitchens with a chimney (aOR: 4.63, 95% 1.54-13.93). Similar trends were observed for SGA."
"33746960","Multi-Modal Characterization of Monocytes in Idiopathic Pulmonary Fibrosis Reveals a Primed Type I Interferon Immune Phenotype.","Front Immunol","Idiopathic pulmonary fibrosis (IPF) is the most severe form of chronic lung fibrosis. Circulating monocytes have been implicated in immune pathology in IPF but their phenotype is unknown. In this work, we determined the immune phenotype of monocytes in IPF using multi-colour flow cytometry, RNA sequencing and corresponding serum factors, and mapped the main findings to amount of lung fibrosis and single cell transcriptomic landscape of myeloid cells in IPF lungs. We show that monocytes from IPF patients displayed increased expression of CD64 (FcγR1) which correlated with amount of lung fibrosis, and an amplified type I IFN responseex vivo. These were accompanied by markedly raised CSF-1 levels, IL-6, and CCL-2 in serum of IPF patients. Interrogation of single cell transcriptomic data from human IPF lungs revealed increased proportion of CD64himonocytes and ""transitional macrophages"" with higher expression of CCL-2 and type I IFN genes. Our study shows that monocytes in IPF patients are phenotypically distinct from age-matched controls, with a primed type I IFN pathway that may contribute to driving chronic inflammation and fibrosis. These findings strengthen the potential role of monocytes in the pathogenesis of IPF.Copyright © 2021 Fraser, Denney, Antanaviciute, Blirando, Vuppusetty, Zheng, Repapi, Iotchkova, Taylor, Ashley, St Noble, Benamore, Hoyles, Clelland, Rastrick, Hardman, Alham, Rigby, Simmons, Rehwinkel and Ho."
"33674303","Single-cell transcriptomic analysis of mIHC images via antigen mapping.","Sci Adv","Highly multiplexed immunohistochemistry (mIHC) enables the staining and quantification of dozens of antigens in a tissue section with single-cell resolution. However, annotating cell populations that differ little in the profiled antigens or for which the antibody panel does not include specific markers is challenging. To overcome this obstacle, we have developed an approach for enriching mIHC images with single-cell RNA sequencing data, building upon recent experimental procedures for augmenting single-cell transcriptomes with concurrent antigen measurements. Spatially-resolved Transcriptomics via Epitope Anchoring (STvEA) performs transcriptome-guided annotation of highly multiplexed cytometry datasets. It increases the level of detail in histological analyses by enabling the systematic annotation of nuanced cell populations, spatial patterns of transcription, and interactions between cell types. We demonstrate the utility of STvEA by uncovering the architecture of poorly characterized cell types in the murine spleen using published cytometry and mIHC data of this organ.Copyright © 2021 The Authors, some rights reserved; exclusive licensee American Association for the Advancement of Science. No claim to original U.S. Government Works. Distributed under a Creative Commons Attribution NonCommercial License 4.0 (CC BY-NC)."
"33664506","Population-scale single-cell RNA-seq profiling across dopaminergic neuron differentiation.","Nat Genet","Studying the function of common genetic variants in primary human tissues and during development is challenging. To address this, we use an efficient multiplexing strategy to differentiate 215 human induced pluripotent stem cell (iPSC) lines toward a midbrain neural fate, including dopaminergic neurons, and use single-cell RNA sequencing (scRNA-seq) to profile over 1 million cells across three differentiation time points. The proportion of neurons produced by each cell line is highly reproducible and is predictable by robust molecular markers expressed in pluripotent cells. Expression quantitative trait loci (eQTL) were characterized at different stages of neuronal development and in response to rotenone-induced oxidative stress. Of these, 1,284 eQTL colocalize with known neurological trait risk loci, and 46% are not found in the Genotype-Tissue Expression (GTEx) catalog. Our study illustrates how coupling scRNA-seq with long-term iPSC differentiation enables mechanistic studies of human trait-associated genetic variants in otherwise inaccessible cell states."
"33658382","Integration and transfer learning of single-cell transcriptomes via cFIT.","Proc Natl Acad Sci U S A","Large, comprehensive collections of single-cell RNA sequencing (scRNA-seq) datasets have been generated that allow for the full transcriptional characterization of cell types across a wide variety of biological and clinical conditions. As new methods arise to measure distinct cellular modalities, a key analytical challenge is to integrate these datasets or transfer knowledge from one to the other to better understand cellular identity and functions. Here, we present a simple yet surprisingly effective method named common factor integration and transfer learning (cFIT) for capturing various batch effects across experiments, technologies, subjects, and even species. The proposed method models the shared information between various datasets by a common factor space while allowing for unique distortions and shifts in genewise expression in each batch. The model parameters are learned under an iterative nonnegative matrix factorization (NMF) framework and then used for synchronized integration from across-domain assays. In addition, the model enables transferring via low-rank matrix from more informative data to allow for precise identification in data of lower quality. Compared with existing approaches, our method imposes weaker assumptions on the cell composition of each individual dataset; however, it is shown to be more reliable in preserving biological variations. We apply cFIT to multiple scRNA-seq datasets of developing brain from human and mouse, varying by technologies and developmental stages. The successful integration and transfer uncover the transcriptional resemblance across systems. The study helps establish a comprehensive landscape of brain cell-type diversity and provides insights into brain development.Copyright © 2021 the Author(s). Published by PNAS."
"33712030","Reprogrammed mesenchymal stem cells derived from iPSCs promote bone repair in steroid-associated osteonecrosis of the femoral head.","Stem Cell Res Ther","Cellular therapy based on mesenchymal stem cells (MSCs) is a promising novel therapeutic strategy for the osteonecrosis of the femoral head (ONFH), which is gradually becoming popular, particularly for early-stage ONFH. Nonetheless, the MSC-based therapy is challenging due to certain limitations, such as limited self-renewal capability of cells, availability of donor MSCs, and the costs involved in donor screening. As an alternative approach, MSCs derived from induced pluripotent stem cells (iPSCs), which may lead to further standardized-cell preparations.In the present study, the bone marrow samples of patients with ONFH (n = 16) and patients with the fracture of the femoral neck (n = 12) were obtained during operation. The bone marrow-derived MSCs (BMSCs) were isolated by density gradient centrifugation. BMSCs of ONFH patients (ONFH-BMSCs) were reprogrammed to iPSCs, following which the iPSCs were differentiated into MSCs (iPSC-MSCs). Forty adult male rats were randomly divided into following groups (n = 10 per group): (a) normal control group, (b) methylprednisolone (MPS) group, (c) MPS + BMSCs treated group, and (d) MPS + iPSC-MSC-treated group. Eight weeks after the establishment of the ONFH model, rats in BMSC-treated group and iPSC-MSC-treated group were implanted with BMSCs and iPSC-MSCs through intrabone marrow injection. Bone repair of the femoral head necrosis area was analyzed after MSC transplantation.The morphology, immunophenotype, in vitro differentiation potential, and DNA methylation patterns of iPSC-MSCs were similar to those of normal BMSCs, while the proliferation of iPSC-MSCs was higher and no tumorigenic ability was exhibited. Furthermore, comparing the effectiveness of iPSC-MSCs and the normal BMSCs in an ONFH rat model revealed that the iPSC-MSCs was equivalent to normal BMSCs in preventing bone loss and promoting bone repair in the necrosis region of the femoral head.Reprogramming can reverse the abnormal proliferation, differentiation, and DNA methylation patterns of ONFH-BMSCs. Transplantation of iPSC-MSCs could effectively promote bone repair and angiogenesis in the necrosis area of the femoral head."
"33762648","Alcohol consumption, depression, overweight and cortisol levels as determining factors for NR3C1 gene methylation.","Sci Rep","The NR3C1 glucocorticoid receptor (GR) gene is a component of the stress response system, which can be regulated by epigenetic mechanisms. NR3C1 methylation has been associated with trauma and mental issues, including depression, post-traumatic stress, anxiety, and personality disorders. Previous studies have reported that stressful events are involved in NR3C1 gene methylation, suggesting that its regulation under environmental effects is complex. The present study aimed to analyze associations involving stressors such as socioeconomic status, health conditions, and lifestyle in relation to NR3C1 methylation in adults. This study included 386 individual users of the Brazilian Public Unified Health System (SUS), and evaluated socioeconomic and health conditions, body mass index, cortisol levels, and lifestyle. Data were correlated with NR3C1 methylation, determined using DNA pyrosequencing. The results showed that alcohol consumption, overweight, and high cortisol levels were related to NR3C1 demethylation, while depression was related to its methylation. Habits, lifestyle, and health status may influence NR3C1 gene regulation via methylation, revealing the complexity of environmental impacts on NR3C1 methylation."
