ec,date,type,pmid,title,source,abstract
No,20210416,Cell-free DNA,33752803,"Applications of genetic-epigenetic tissue mapping for plasma DNA in prenatal testing, transplantation and oncology.",Elife,"We developed genetic-epigenetic tissue mapping (GETMap) to determine the tissue composition of plasma DNA carrying genetic variants not present in the constitutional genome through comparing their methylation profiles with relevant tissues. We validated this approach by showing that, in pregnant women, circulating DNA carrying fetal-specific alleles was entirely placenta-derived. In lung transplant recipients, we showed that, at 72 hr after transplantation, the lung contributed only a median of 17% to the plasma DNA carrying donor-specific alleles, and hematopoietic cells contributed a median of 78%. In hepatocellular cancer patients, the liver was identified as the predominant source of plasma DNA carrying tumor-specific mutations. In a pregnant woman with lymphoma, plasma DNA molecules carrying cancer mutations and fetal-specific alleles were accurately shown to be derived from the lymphocytes and placenta, respectively. Analysis of tissue origin for plasma DNA carrying genetic variants is potentially useful for noninvasive prenatal testing, transplantation monitoring, and cancer screening."
No,20210416,Epigenetics,33844406,The interplay between DNA and histone methylation: molecular mechanisms and disease implications.,EMBO Rep,"Methylation of cytosine in CpG dinucleotides and histone lysine and arginine residues is a chromatin modification that critically contributes to the regulation of genome integrity, replication, and accessibility. A strong correlation exists between the genome-wide distribution of DNA and histone methylation, suggesting an intimate relationship between these epigenetic marks. Indeed, accumulating literature reveals complex mechanisms underlying the molecular crosstalk between DNA and histone methylation. These in vitro and in vivo discoveries are further supported by the finding that genes encoding DNA- and histone-modifying enzymes are often mutated in overlapping human diseases. Here, we summarize recent advances in understanding how DNA and histone methylation cooperate to maintain the cellular epigenomic landscape. We will also discuss the potential implication of these insights for understanding the etiology of, and developing biomarkers and therapies for, human congenital disorders and cancers that are driven by chromatin abnormalities.© 2021 The Authors."
No,20210416,Epigenetics,33808774,Identification of a Minimal 3-Transcript Signature to Differentiate Viral from Bacterial Infection from Best Genome-Wide Host RNA Biomarkers: A Multi-Cohort Analysis.,Int J Mol Sci,"The fight against the spread of antibiotic resistance is one of the most important challenges facing health systems worldwide. Given the limitations of current diagnostic methods, the development of fast and accurate tests for the diagnosis of viral and bacterial infections would improve patient management and treatment, as well as contribute to reducing antibiotic misuse in clinical settings. In this scenario, analysis of host transcriptomics constitutes a promising target to develop new diagnostic tests based on the host-specific response to infections. We carried out a multi-cohort meta-analysis of blood transcriptomic data available in public databases, including 11 different studies and 1209 samples from virus- (n= 695) and bacteria- (n= 514) infected patients. We applied a Parallel Regularized Regression Model Search (PReMS) on a set of previously reported genes that distinguished viral from bacterial infection to find a minimum gene expression bio-signature. This strategy allowed us to detect three genes, namelyBAFT,ISG15andDNMT1, that clearly differentiate groups of infection with high accuracy (training set: area under the curve (AUC) 0.86 (sensitivity: 0.81; specificity: 0.87); testing set: AUC 0.87 (sensitivity: 0.82; specificity: 0.86)).BAFTandISG15are involved in processes related to immune response, whileDNMT1is related to the preservation of methylation patterns, and its expression is modulated by pathogen infections. We successfully tested this three-transcript signature in the 11 independent studies, demonstrating its high performance under different scenarios. The main advantage of this three-gene signature is the low number of genes needed to differentiate both groups of patient categories."
No,20210416,Epigenetics,33795684,Evolution of DNA methylation in the human brain.,Nat Commun,"DNA methylation is a critical regulatory mechanism implicated in development, learning, memory, and disease in the human brain. Here we have elucidated DNA methylation changes during recent human brain evolution. We demonstrate dynamic evolutionary trajectories of DNA methylation in cell-type and cytosine-context specific manner. Specifically, DNA methylation in non-CG context, namely CH methylation, has increased (hypermethylation) in neuronal gene bodies during human brain evolution, contributing to human-specific down-regulation of genes and co-expression modules. The effects of CH hypermethylation is particularly pronounced in early development and neuronal subtypes. In contrast, DNA methylation in CG context shows pronounced reduction (hypomethylation) in human brains, notably in cis-regulatory regions, leading to upregulation of downstream genes. We show that the majority of differential CG methylation between neurons and oligodendrocytes originated before the divergence of hominoids and catarrhine monkeys, and harbors strong signal for genetic risk for schizophrenia. Remarkably, a substantial portion of differential CG methylation between neurons and oligodendrocytes emerged in the human lineage since the divergence from the chimpanzee lineage and carries significant genetic risk for schizophrenia. Therefore, recent epigenetic evolution of human cortex has shaped the cellular regulatory landscape and contributed to the increased vulnerability to neuropsychiatric diseases."
No,20210416,Epigenetics,33828297,Genome-wide enhancer maps link risk variants to disease genes.,Nature,"Genome-wide association studies (GWAS) have identified thousands of noncoding loci that are associated with human diseases and complex traits, each of which could reveal insights into the mechanisms of disease1. Many of the underlying causal variants may affect enhancers2,3, but we lack accurate maps of enhancers and their target genes to interpret such variants. We recently developed the activity-by-contact (ABC) model to predict which enhancers regulate which genes and validated the model using CRISPR perturbations in several cell types4. Here we apply this ABC model to create enhancer-gene maps in 131 human cell types and tissues, and use these maps to interpret the functions of GWAS variants. Across 72 diseases and complex traits, ABC links 5,036 GWAS signals to 2,249 unique genes, including a class of 577 genes that appear to influence multiple phenotypes through variants in enhancers that act in different cell types. In inflammatory bowel disease (IBD), causal variants are enriched in predicted enhancers by more than 20-fold in particular cell types such as dendritic cells, and ABC achieves higher precision than other regulatory methods at connecting noncoding variants to target genes. These variant-to-function maps reveal an enhancer that contains an IBD risk variant and that regulates the expression of PPIF to alter the membrane potential of mitochondria in macrophages. Our study reveals principles of genome regulation, identifies genes that affect IBD and provides a resource and generalizable strategy to connect risk variants of common diseases to their molecular and cellular functions."
No,20210416,Epigenetics,33758175,Epigenetically regulated digital signaling defines epithelial innate immunity at the tissue level.,Nat Commun,"To prevent damage to the host or its commensal microbiota, epithelial tissues must match the intensity of the immune response to the severity of a biological threat. Toll-like receptors allow epithelial cells to identify microbe associated molecular patterns. However, the mechanisms that mitigate biological noise in single cells to ensure quantitatively appropriate responses remain unclear. Here we address this question using single cell and single molecule approaches in mammary epithelial cells and primary organoids. We find that epithelial tissues respond to bacterial microbe associated molecular patterns by activating a subset of cells in an all-or-nothing (i.e. digital) manner. The maximum fraction of responsive cells is regulated by a bimodal epigenetic switch that licenses the TLR2 promoter for transcription across multiple generations. This mechanism confers a flexible memory of inflammatory events as well as unique spatio-temporal control of epithelial tissue-level immune responses. We propose that epigenetic licensing in individual cells allows for long-term, quantitative fine-tuning of population-level responses."
No,20210416,Epigenetics,33828295,"The structure, function and evolution of a complete human chromosome 8.",Nature,"The complete assembly of each human chromosome is essential for understanding human biology and evolution1,2. Here we use complementary long-read sequencing technologies to complete the linear assembly of human chromosome 8. Our assembly resolves the sequence of five previously long-standing gaps, including a 2.08-Mb centromeric α-satellite array, a 644-kb copy number polymorphism in the β-defensin gene cluster that is important for disease risk, and an 863-kb variable number tandem repeat at chromosome 8q21.2 that can function as a neocentromere. We show that the centromeric α-satellite array is generally methylated except for a 73-kb hypomethylated region of diverse higher-order α-satellites enriched with CENP-A nucleosomes, consistent with the location of the kinetochore. In addition, we confirm the overall organization and methylation pattern of the centromere in a diploid human genome. Using a dual long-read sequencing approach, we complete high-quality draft assemblies of the orthologous centromere from chromosome 8 in chimpanzee, orangutan and macaque to reconstruct its evolutionary history. Comparative and phylogenetic analyses show that the higher-order α-satellite structure evolved in the great ape ancestor with a layered symmetry, in which more ancient higher-order repeats locate peripherally to monomeric α-satellites. We estimate that the mutation rate of centromeric satellite DNA is accelerated by more than 2.2-fold compared to the unique portions of the genome, and this acceleration extends into the flanking sequence."
Yes,20210416,EWAS,33845866,DNA methylation in cord blood in association with prenatal depressive symptoms.,Clin Epigenetics,"Prenatal symptoms of depression (PND) and anxiety affect up to every third pregnancy. Children of mothers with mental health problems are at higher risk of developmental problems, possibly through epigenetic mechanisms together with other factors such as genetic and environmental. We investigated DNA methylation in cord blood in relation to PND, taking into consideration a history of depression, co-morbidity with anxiety and selective serotonin reuptake inhibitors (SSRI) use, and stratified by sex of the child. Mothers (N = 373) prospectively filled out web-based questionnaires regarding mood symptoms and SSRI use throughout pregnancy. Cord blood was collected at birth and DNA methylation was measured using Illumina MethylationEPIC array at 850 000 CpG sites throughout the genome. Differentially methylated regions were identified using Kruskal-Wallis test, and Benjamini-Hochberg adjusted p-values < 0.05 were considered significant.No differential DNA methylation was associated with PND alone; however, differential DNA methylation was observed in children exposed to comorbid PND with anxiety symptoms compared with healthy controls in ABCF1 (log twofold change - 0.2), but not after stratification by sex of the child. DNA methylation in children exposed to PND without SSRI treatment and healthy controls both differed in comparison with SSRI exposed children at several sites and regions, among which hypomethylation was observed in CpGs in the promoter region of CRBN (log2 fold change - 0.57), involved in brain development, and hypermethylation in MDFIC (log2 fold change 0.45), associated with the glucocorticoid stress response.Although it is not possible to assess if these methylation differences are due to SSRI treatment itself or to more severe depression, our findings add on to existing knowledge that there might be different biological consequences for the child depending on whether maternal PND was treated with SSRIs or not."
Yes,20210416,EWAS,33838873,Brain DNA Methylation Patterns in CLDN5 Associated With Cognitive Decline.,Biol Psychiatry,"Cognitive trajectory varies widely and can distinguish people who develop dementia from people who remain cognitively normal. Variation in cognitive trajectory is only partially explained by traditional neuropathologies. We sought to identify novel genes associated with cognitive trajectory using DNA methylation profiles from human postmortem brain.We performed a brain epigenome-wide association study of cognitive trajectory in 636 participants from the ROS (Religious Orders Study) and MAP (Rush Memory and Aging Project) using DNA methylation profiles of the dorsolateral prefrontal cortex. To maximize our power to detect epigenetic associations, we used the recently developed Gene Association with Multiple Traits test to analyze the 5 measured cognitive domains simultaneously.We found an epigenome-wide association for differential methylation of sites in the CLDN5 locus and cognitive trajectory (p = 9.96 × 10-7) that was robust to adjustment for cell type proportions (p = 8.52 × 10-7). This association was primarily driven by association with declines in episodic (p = 4.65 × 10-6) and working (p = 2.54 × 10-7) memory. This association between methylation in CLDN5 and cognitive decline was significant even in participants with no or little signs of amyloid-β and neurofibrillary tangle pathology.Differential methylation of CLDN5, a gene that encodes an important protein of the blood-brain barrier, is associated with cognitive trajectory beyond traditional Alzheimer's disease pathologies. The association between CLDN5 methylation and cognitive trajectory in people with low pathology suggests an early role for CLDN5 and blood-brain barrier dysfunction in cognitive decline and Alzheimer's disease.Copyright © 2021 Society of Biological Psychiatry. All rights reserved."
Yes,20210416,EWAS,33823916,Persistent variations of blood DNA methylation associated with treatment exposures and risk for cardiometabolic outcomes in long-term survivors of childhood cancer in the St. Jude Lifetime Cohort.,Genome Med,"It is well-established that cancer treatment substantially increases the risk of long-term adverse health outcomes among childhood cancer survivors. However, there is limited research on the underlying mechanisms. To elucidate the pathophysiology and a possible causal pathway from treatment exposures to cardiometabolic conditions, we conducted epigenome-wide association studies (EWAS) to identify the DNA methylation (DNAm) sites associated with cancer treatment exposures and examined whether treatment-associated DNAm sites mediate associations between specific treatments and cardiometabolic conditions.We included 2052 survivors (median age 33.7 years) of European ancestry from the St. Jude Lifetime Cohort Study, a retrospective hospital-based study with prospective clinical follow-up. Cumulative doses of chemotherapy and region-specific radiation were abstracted from medical records. Seven cardiometabolic conditions were clinically assessed. DNAm profile was measured using MethylationEPIC BeadChip with blood-derived DNA.By performing multiple treatment-specific EWAS, we identified 935 5'-cytosine-phosphate-guanine-3' (CpG) sites mapped to 538 genes/regions associated with one or more cancer treatments at the epigenome-wide significance level (p < 9 × 10-8). Among the treatment-associated CpGs, 8 were associated with obesity, 63 with hypercholesterolemia, and 17 with hypertriglyceridemia (false discovery rate-adjusted p < 0.05). We observed substantial mediation by methylation at four independent CpGs (cg06963130, cg21922478, cg22976567, cg07403981) for the association between abdominal field radiotherapy (abdominal-RT) and risk of hypercholesterolemia (70.3%) and by methylation at three CpGs (cg19634849, cg13552692, cg09853238) for the association between abdominal-RT and hypertriglyceridemia (54.6%). In addition, three CpGs (cg26572901, cg12715065, cg21163477) partially mediated the association between brain-RT and obesity with a 32.9% mediation effect, and two CpGs mediated the association between corticosteroids and obesity (cg22351187, 14.2%) and between brain-RT and hypertriglyceridemia (cg13360224, 10.5%). Notably, several mediator CpGs reside in the proximity of well-established dyslipidemia genes: cg21922478 (ITGA1) and cg22976567 (LMNA).In childhood cancer survivors, cancer treatment exposures are associated with DNAm patterns present decades following the exposure. Treatment-associated DNAm sites may mediate the causal pathway from specific treatment exposures to certain cardiometabolic conditions, suggesting the utility of DNAm sites as risk predictors and potential mechanistic targets for future intervention studies."
Yes,20210416,EWAS,33818294,Epigenome-wide analysis of long-term air pollution exposure and DNA methylation in monocytes: results from the Multi-Ethnic Study of Atherosclerosis.,Epigenetics,"Air pollution might affect atherosclerosis through DNA methylation changes in cells crucial to atherosclerosis, such as monocytes. We conducted an epigenome-wide study of DNA methylation in CD14+ monocytes and long-term ambient air pollution exposure in adults participating in the Multi-Ethnic Study of Atherosclerosis (MESA). We also assessed the association between differentially methylated signals andcis-gene expression. Using spatiotemporal models, one-year average concentrations of outdoor fine particulate matter (PM2.5) and oxides of nitrogen (NOX) were estimated at participants' homes. We assessed DNA methylation and gene expression using Illumina 450k and HumanHT-12 v4 Expression BeadChips, respectively (n = 1,207). We used bump hunting and site-specific approaches to identify differentially methylated signals (false discovery rate of 0.05) and used linear models to assess associations between differentially methylated signals andcis-gene expression. Four differentially methylated regions (DMRs) located on chromosomes 5, 6, 7, and 16 (within or nearSDHAP3, ZFP57, HOXA5, andPRM1, respectively) were associated with PM2.5. The DMRs on chromosomes 5 and 6 also associated with NOX. The DMR on chromosome 5 had the smallest p-value for both PM2.5(p = 1.4×10-6) and NOX(p = 7.7×10-6). Three differentially methylated CpGs were identified for PM2.5, and cg05926640 (nearTOMM20) had the smallest p-value (p = 5.6×10-8). NOXsignificantly associated with cg11756214 withinZNF347(p = 5.6×10-8). Several differentially methylated signals were also associated withcis-gene expression. The DMR located on chromosome 7 was associated with the expression ofHOXA5, HOXA9, andHOXA10. The DMRs located on chromosomes 5 and 16 were associated with expression ofMRPL36andDEXI, respectively. The CpG cg05926640 was associated with expression ofARID4B, IRF2BP2, andTOMM20. We identified differential DNA methylation in monocytes associated with long-term air pollution exposure. Methylation signals associated with gene expression might help explain how air pollution contributes to cardiovascular disease."
Yes,20210416,EWAS,33784941,"DNA methylation signatures in cord blood associated with birthweight are enriched for dmCpGs previously associated with maternal hypertension or pre-eclampsia, smoking and folic acid intake.",Epigenetics,"Many epidemiological studies have linked low birthweight to an increased risk of non-communicable diseases (NCDs) in later life, with epigenetic proceseses suggested as an underlying mechanism. Here, we sought to identify neonatal methylation changes associated with birthweight, at both the individual CpG and genomic regional level, and whether the birthweight-associated methylation signatures were associated with specific maternal factors. Using the Illumina Human MethylationEPIC array we assessed DNA methylation in the cord blood of 557 and 483 infants from the UK Pregnancies Better Eating and Activity Trial and Southampton Women's Survey, respectively. Adjusting for gestational age and other covariates, an epigenome-wide association study identified 2911 (FDR≤0.05) and 236 (Bonferroni corrected p≤6.45x10-8) differentially methylated CpGs (dmCpGs), and 1230 differentially methylated regions (DMRs) (Stouffer ≤0.05) associated with birthweight. The top birthweight-associated dmCpG was located within the Homeobox Telomere-Binding Protein 1 (HMBOX1) gene with a 195g (95%CI: -241, -149g) decrease in birthweight per 10% increase in methylation, while the top DMR was located within the promoter of corticotropin releasing hormone binding protein (CRHBP).. Furthermore, the birthweight-related dmCpGs were enriched for dmCpGs previously associated with gestational hypertension/pre-eclampsia (14.51%, p=1.37x10-255), maternal smoking (7.71%, p=1.50x10-57) and maternal plasma folate levels during pregnancy (0.33%, p=0.029). The identification of birthweight-associated methylation markers, particularly those connected to specific pregnancy complications and exposures, may provide insights into the developmental pathways that affect birthweight and/or suggest surrogate markers to identify adverse prenatal exposures for stratifying for individuals at risk of later NCDs."
Yes,20210416,EWAS,33771206,Meta-analysis of genome-wide DNA methylation identifies shared associations across neurodegenerative disorders.,Genome Biol,"People with neurodegenerative disorders show diverse clinical syndromes, genetic heterogeneity, and distinct brain pathological changes, but studies report overlap between these features. DNA methylation (DNAm) provides a way to explore this overlap and heterogeneity as it is determined by the combined effects of genetic variation and the environment. In this study, we aim to identify shared blood DNAm differences between controls and people with Alzheimer's disease, amyotrophic lateral sclerosis, and Parkinson's disease.We use a mixed-linear model method (MOMENT) that accounts for the effect of (un)known confounders, to test for the association of each DNAm site with each disorder. While only three probes are found to be genome-wide significant in each MOMENT association analysis of amyotrophic lateral sclerosis and Parkinson's disease (and none with Alzheimer's disease), a fixed-effects meta-analysis of the three disorders results in 12 genome-wide significant differentially methylated positions. Predicted immune cell-type proportions are disrupted across all neurodegenerative disorders. Protein inflammatory markers are correlated with profile sum-scores derived from disease-associated immune cell-type proportions in a healthy aging cohort. In contrast, they are not correlated with MOMENT DNAm-derived profile sum-scores, calculated using effect sizes of the 12 differentially methylated positions as weights.We identify shared differentially methylated positions in whole blood between neurodegenerative disorders that point to shared pathogenic mechanisms. These shared differentially methylated positions may reflect causes or consequences of disease, but they are unlikely to reflect cell-type proportion differences."
Yes,20210416,EWAS,33766110,Pre-adolescence DNA methylation is associated with BMI status change from pre- to post-adolescence.,Clin Epigenetics,"Previous studies have shown that DNA methylation (DNAm) is associated with body mass index (BMI). However, it is unknown whether DNAm at pre-adolescence is associated with BMI status transition from pre- to post-adolescence. In the Isle of Wight (IoW) birth cohort, genome-wide DNA methylation in whole blood was measured using Illumina Infinium Human450 and EPIC BeadChip arrays in n = 325 subjects, and pre- to post-adolescence BMI transition was classified into four groups: (1) normal to normal, (2) normal to overweight or obese, (3) overweight or obese to normal, and (4) persistent overweight or obese. We used recursive random forest to screen genome-wide Cytosine-phosphate-Guanine (CpG) sites with DNAm potentially associated with BMI transition for each gender, and the association of BMI status transition with DNAm at an earlier age was assessed via logistic regressions. To evaluate gender specificity, interactions between DNAm and gender were included in the model. Findings in the IoW cohort were further tested in an independent cohort, the Avon Longitudinal Study of Parents and Children (ALSPAC).In total, 174 candidate CpGs were selected including CpGs from screening and CpGs previously associated correctionally with BMI in children and adults. Of these 174 CpGs, pre-adolescent DNAm of 38 CpGs in the IoW cohort was associated with BMI status transition, including 30 CpGs showing gender-specific associations. Thirteen CpGs showed consistent associations between the IoW cohort and the ALSPAC cohort (11 of which were gender-specific).Pre-adolescence DNAm is associated with the change in BMI status from pre- to post-adolescence and such associations are likely to be gender-specific."
