"pmid","title","source","abstract"
"35654974","A phenotypic spectrum of autism is attributable to the combined effects of rare variants, polygenic risk and sex.","Nat Genet","The genetic etiology of autism spectrum disorder (ASD) is multifactorial, but how combinations of genetic factors determine risk is unclear. In a large family sample, we show that genetic loads of rare and polygenic risk are inversely correlated in cases and greater in females than in males, consistent with a liability threshold that differs by sex. De novo mutations (DNMs), rare inherited variants and polygenic scores were associated with various dimensions of symptom severity in children and parents. Parental age effects on risk for ASD in offspring were attributable to a combination of genetic mechanisms, including DNMs that accumulate in the paternal germline and inherited risk that influences behavior in parents. Genes implicated by rare variants were enriched in excitatory and inhibitory neurons compared with genes implicated by common variants. Our results suggest that a phenotypic spectrum of ASD is attributable to a spectrum of genetic factors that impact different neurodevelopmental processes.© 2022. The Author(s), under exclusive licence to Springer Nature America, Inc."
"35586748","Serum Atrial Natriuretic Peptide, <i>NPPA</i> Promoter Methylation, and Cardiovascular Disease: A 10-year Follow-Up Study in Chinese Adults.","Glob Heart","Atrial natriuretic peptide (ANP) has been associated with cardiovascular disease (CVD) and related risk factors, but the clinical application is limited and the underlying mechanisms are not very clear. Here, we aimed to examine whether proANP and its coding gene methylation were associated with CVD in the Chinese population.Serum proANP and peripheral blood DNA methylation of natriuretic peptide A gene (NPPA) promoter was quantified at baseline for 2,498 community members (mean aged 53 years, 38% men) in the Gusu cohort. CVD events were obtained during 10 years of follow-up. A competing-risks survival regression model was applied to examine the prospective associations of proANP andNPPApromoter methylation with incident CVD.During follow-up, 210 participants developed CVD events, 50 participants died from non-cardiovascular causes, and 214 participants were lost. Per 1-nmol/L increment of serum proANP was associated with a 22% (HR = 1.22, 95%CI: 1.03-1.44,P= 0.025) higher risk of CVD during follow-up. Of the 9 CpG sites assayed, per 2-fold increment of DNA methylation at CpG3 (located at Chr1:11908299) was significantly associated with a half lower risk of CVD (HR = 0.50, 95%CI: 0.30-0.82,P= 0.006). The gene-based analysis found that DNA methylation of the 9 CpGs atNPPApromoter as a whole was significantly associated with incident CVD (P< 0.05).Increased proANP and hypomethylation atNPPApromoter at baseline predicted an increased future risk of CVD in Chinese adults. Aberrant DNA methylation of theNPPAgene may participate in the mechanisms of CVD.Copyright: © 2022 The Author(s)."
"35606422","Prediction of protein-ligand binding affinity from sequencing data with interpretable machine learning.","Nat Biotechnol","Protein-ligand interactions are increasingly profiled at high throughput using affinity selection and massively parallel sequencing. However, these assays do not provide the biophysical parameters that most rigorously quantify molecular interactions. Here we describe a flexible machine learning method, called ProBound, that accurately defines sequence recognition in terms of equilibrium binding constants or kinetic rates. This is achieved using a multi-layered maximum-likelihood framework that models both the molecular interactions and the data generation process. We show that ProBound quantifies transcription factor (TF) behavior with models that predict binding affinity over a range exceeding that of previous resources; captures the impact of DNA modifications and conformational flexibility of multi-TF complexes; and infers specificity directly from in vivo data such as ChIP-seq without peak calling. When coupled with an assay called KD-seq, it determines the absolute affinity of protein-ligand interactions. We also apply ProBound to profile the kinetics of kinase-substrate interactions. ProBound opens new avenues for decoding biological networks and rationally engineering protein-ligand interactions.© 2022. The Author(s)."
"35635572","Self-regulating novel iron oxide nanoparticle-based magnetic hyperthermia in swine: biocompatibility, biodistribution, and safety assessments.","Arch Toxicol","Studies demonstrating the successful and safe application of magnetic hyperthermia in large animals are scarce. A therapeutic approach for advanced cancer comprising multicore encapsulated iron oxide (IO) Sarah Nanoparticles (SaNPs), that uniquely self-regulate their temperature, was developed thus overcoming the safety challenges of hyperthermia. SaNPs are intravenously injected and accumulate in tumor tissue, leading to selective heating upon exposure to an external alternating magnetic field (AMF). A series of studies were conducted in healthy swine to assess SaNPs' safety, alone or combined with AMF application. Administration of single high (up to 22 mg IO/kg) or low (3.6 mg IO/kg) SaNP doses had no adverse effects, including no infusion reactions. Vital signs remained stable with no significant clinical pathology changes, and no treatment-associated toxicities. Biodistribution analysis indicated that SaNPs predominantly accumulate in the lungs and clear in a dose- and time-dependent manner. In minipigs that received a single SaNP no-observed-adverse-effect-level (NOAEL)-based dose (3.6 mg IO/kg) with AMF, the average percentage remaining in vital organs after 90 days was 13.7%. No noticeable clinical signs were noted during the 87 to 92-day observation period following irradiation, and no inflammation, necrosis, nor thermal damage were found in the histopathology evaluation. In another minipig, ~ 90 days after three recurrent high doses (14 mg IO/kg), without AMF, almost half of the injected SaNPs were cleared with no residual detrimental effects. We demonstrate that the approach is safe and well tolerated in swine, opening potential avenues as a novel therapeutic modality for cancer patients.© 2022. The Author(s), under exclusive licence to Springer-Verlag GmbH Germany, part of Springer Nature."
"35586366","Association Between the Neutrophil-to-Lymphocyte Ratio and Adverse Clinical Prognosis in Patients with Spontaneous Intracerebral Hemorrhage.","Neuropsychiatr Dis Treat","The neutrophil-to-lymphocyte ratio (NLR) is an index reflecting the overall inflammatory and stress status of patients with major diseases. Many studies associated the NLR with neurological deterioration and a poor prognosis in the spontaneous intracerebral hemorrhage (ICH). However, most previous studies did not further analyze NLR by stratification, and with a relatively small sample size. Besides, the outcome evaluation mostly focused on short-term prognosis or a single timepoint.Patients' basic characteristics and laboratory examination results, including the NLR were taken at baseline, and data from the 1-year follow-up, including the modified Rankin Scale (mRS) and survival status, was obtained for all patients. Patients included in the study were classified into four groups according to NLR quartiles (Q1-Q4). Logistic regression was used to analyze the relationship between different NLR levels and poor outcomes (mRS 3-5 and mRS 3-6).A total of 594 ICH patients were enrolled. Glasgow Coma Scale (GCS), NIH Stroke Scale (NIHSS) and hematoma volume at first admission were significantly different between different NLR level groups (all P values <0.05). In the multivariate logistic regression model, at the 30-day follow-up, the Q4 (significantly increased NLR) group showed an elevated risk of poor outcomes (OR, 2.37; 95% CI, 1.17-4.83, P=0.02) and functional disability (OR, 2.21; 95% CI, 1.05-4.65, P=0.04). At the 3-month follow-up, the Q4 group still showed an elevated risk of poor outcomes (OR, 2.83; 95% CI, 1.38-5.77, P<0.01) and functional disability (OR, 2.77; 95% CI, 1.28-5.98, P<0.01). At the 1-year follow-up, the Q2 (slightly elevated NLR) group showed significant functional disability (OR, 0.34; 95% CI, 0.16-0.72, P<0.01).A significantly increased NLR may have an impact on the poor outcomes and functional disability of patients with ICH, while a slightly elevated NLR may play a protective role.© 2022 Du et al."
"35585989","Mechanisms of Kwashiorkor-Associated Immune Suppression: Insights From Human, Mouse, and Pig Studies.","Front Immunol","Malnutrition refers to inadequate energy and/or nutrient intake. Malnutrition exhibits a bidirectional relationship with infections whereby malnutrition increases risk of infections that further aggravates malnutrition. Severe malnutrition (SM) is the main cause of secondary immune deficiency and mortality among children in developing countries. SM can manifest as marasmus (non-edematous), observed most often (68.6% of all malnutrition cases), kwashiorkor (edematous), detected in 23.8% of cases, and marasmic kwashiorkor, identified in ~7.6% of SM cases. Marasmus and kwashiorkor occur due to calorie-energy and protein-calorie deficiency (PCD), respectively. Kwashiorkor and marasmic kwashiorkor present with reduced protein levels, protein catabolism rates, and altered levels of micronutrients leading to uncontrolled oxidative stress, exhaustion of anaerobic commensals, and proliferation of pathobionts. Due to these alterations, kwashiorkor children present with profoundly impaired immune function, compromised intestinal barrier, and secondary micronutrient deficiencies. Kwashiorkor-induced alterations contribute to growth stunting and reduced efficacy of oral vaccines. SM is treated with antibiotics and ready-to-use therapeutic foods with variable efficacy. Kwashiorkor has been extensively investigated in gnotobiotic (Gn) mice and piglet models to understand its multiple immediate and long-term effects on children health. Due to numerous physiological and immunological similarities between pigs and humans, pig represents a highly relevant model to study kwashiorkor pathophysiology and immunology. Here we summarize the impact of kwashiorkor on children's health, immunity, and gut functions and review the relevant findings from human and animal studies. We also discuss the reciprocal interactions between PCD and rotavirus-a highly prevalent enteric childhood pathogen due to which pathogenesis and immunity are affected by childhood SM.Copyright © 2022 Michael, Amimo, Rajashekara, Saif and Vlasova."
"35680859","Large-scale multi-omics analysis suggests specific roles for intragenic cohesin in transcriptional regulation.","Nat Commun","Cohesin, an essential protein complex for chromosome segregation, regulates transcription through a variety of mechanisms. It is not a trivial task to assign diverse cohesin functions. Moreover, the context-specific roles of cohesin-mediated interactions, especially on intragenic regions, have not been thoroughly investigated. Here we perform a comprehensive characterization of cohesin binding sites in several human cell types. We integrate epigenomic, transcriptomic and chromatin interaction data to explore the context-specific functions of intragenic cohesin related to gene activation. We identify a specific subset of cohesin binding sites, decreased intragenic cohesin sites (DICs), which are negatively correlated with transcriptional regulation. A subgroup of DICs is enriched with enhancer markers and RNA polymerase II, while the others are more correlated to chromatin architecture. DICs are observed in various cell types, including cells from patients with cohesinopathy. We also implement machine learning to our data and identified genomic features for isolating DICs from all cohesin sites. These results suggest a previously unidentified function of cohesin on intragenic regions for transcriptional regulation.© 2022. The Author(s)."
"35650521","Leveraging transcriptome and epigenome landscapes to infer regulatory networks during the onset of sexual maturation.","BMC Genomics","Despite sexual development being ubiquitous to vertebrates, the molecular mechanisms underpinning this fundamental transition remain largely undocumented in many organisms. We designed a time course experiment that successfully sampled the period when Atlantic salmon commence their trajectory towards sexual maturation.Through deep RNA sequencing, we discovered key genes and pathways associated with maturation in the pituitary-ovarian axis. Analyzing DNA methylomes revealed a bias towards hypermethylation in ovary that implicated maturation-related genes. Co-analysis of DNA methylome and gene expression changes revealed chromatin remodeling genes and key transcription factors were both significantly hypermethylated and upregulated in the ovary during the onset of maturation. We also observed changes in chromatin state landscapes that were strongly correlated with fundamental remodeling of gene expression in liver. Finally, a multiomic integrated analysis revealed regulatory networks and identified hub genes including TRIM25 gene (encoding the estrogen-responsive finger protein) as a putative key regulator in the pituitary that underwent a 60-fold change in connectivity during the transition to maturation.The study successfully documented transcriptome and epigenome changes that involved key genes and pathways acting in the pituitary - ovarian axis. Using a Systems Biology approach, we identified hub genes and their associated networks deemed crucial for onset of maturation. The results provide a comprehensive view of the spatiotemporal changes involved in a complex trait and opens the door to future efforts aiming to manipulate puberty in an economically important aquaculture species.© 2022. The Author(s)."
"35580710","The association of airborne particulate matter and benzo[a]pyrene with the clinical course of COVID-19 in patients hospitalized in Poland.","Environ Pollut","Air pollution can adversely affect the immune response and increase the severity of the viral disease. The present study aimed to explore the relationship between symptomatology, clinical course, and inflammation markers of adult patients with coronavirus disease 2019 (COVID-19) hospitalized in Poland (n = 4432) and air pollution levels, i.e., mean 24 h and max 24 h level of benzo(a)pyrene (B(a)P) and particulate matter <10 μm (PM10) and <2.5 μm (PM2.5) during a week before their hospitalization. Exposures to PM2.5and B(a)P exceeding the limits were associated with higher odds of early respiratory symptoms of COVID-19 and hyperinflammatory state: interleukin-6 > 100 pg/mL, procalcitonin >0.25 ng/mL, and white blood cells count >11 × 103/mL. Except for the mean 24 h PM10level, the exceedance of other air pollution parameters was associated with increased odds for oxygen saturation <90%. Exposure to elevated PM2.5and B(a)P levels increased the odds of oxygen therapy and death. This study evidences that worse air quality is related to increased severity of COVID-19 and worse outcome in hospitalized patients. Mitigating air pollution shall be an integral part of measures undertaken to decrease the disease burden during a pandemic of viral respiratory illness.Copyright © 2022 The Authors. Published by Elsevier Ltd.. All rights reserved."
"35600817","Comparison of DNA Methylation Changes Between the Gestation Period and the After-Delivery State: A Pilot Study of 10 Women.","Front Nutr","Gestational adaptation occurs soon after fertilization and continues throughout pregnancy, whereas women return to a pre-pregnancy state after delivery and lactation. However, little is known about the role of DNA methylation in fine-tuning maternal physiology. Understanding the changes in DNA methylation during pregnancy is the first step in clarifying the association of diet, nutrition, and thromboembolism with the changes in DNA methylation. In this study, we investigated whether and how the DNA methylation pattern changes in the three trimesters and after delivery in ten uncomplicated pregnancies.DNA methylation was measured using a Human MethylationEPIC BeadChip. There were 14,018 cytosine-guanine dinucleotide (CpG) sites with statistically significant changes in DNA methylation over the four time periods (p< 0.001). Overall, DNA methylation after delivery was higher than that of the three trimesters (p< 0.001), with the protein ubiquitination pathway being the top canonical pathway involved. We classified the CpG sites into nine groups according to the changes in the three trimesters and found that 38.37% of CpG sites had DNA methylation changes during pregnancy, especially between the first and second trimesters.DNA methylation pattern changes between trimesters, indicating possible involvement in maternal adaptation to pregnancy. Meanwhile, DNA methylation patterns during pregnancy and in the postpartum period were different, implying that puerperium repair may also function through DNA methylation mechanisms.Copyright © 2022 Lin, Tsai, Shih, Tai, Lee and Lin."
"35637347","Sex differences in the intergenerational inheritance of metabolic traits.","Nat Metab","Strong evidence suggests that early-life exposures to suboptimal environmental factors, including those in utero, influence our long-term metabolic health. This has been termed developmental programming. Mounting evidence suggests that the growth and metabolism of male and female fetuses differ. Therefore, sexual dimorphism in response to pre-conception or early-life exposures could contribute to known sex differences in susceptibility to poor metabolic health in adulthood. However, until recently, many studies, especially those in animal models, focused on a single sex, or, often in the case of studies performed during intrauterine development, did not report the sex of the animal at all. In this review, we (a) summarize the evidence that male and females respond differently to a suboptimal pre-conceptional or in utero environment, (b) explore the potential biological mechanisms that underlie these differences and (c) review the consequences of these differences for long-term metabolic health, including that of subsequent generations.© 2022. Springer Nature Limited."
"35590090","Klotho expression in peripheral blood circulating cells is associated with vascular and systemic inflammation in atherosclerotic vascular disease.","Sci Rep","Cardiovascular disease is the leading cause of death worldwide. New therapeutic strategies are aimed to modulate the athero-inflammatory process that partially orchestrates underlying vascular damage. Peripheral blood circulating cells include different immune cells with a central role in the development of the atherogenic inflammatory response. The anti-aging protein α-Klotho has been related to protective effects against CVD. KL is expressed in monocytes, macrophages, and lymphocytes where it exerts anti-inflammatory effects. In this work, we analyse the relationships of the levels of inflammatory markers with the expression of the KL gene in PBCCs and with the serum levels of soluble KL in atherosclerotic vascular disease. For this, we conducted a cross-sectional single-center case-control study including a study group of 76 CVD patients and a control group of 16 cadaveric organ donors without medical antecedent or study indicating CVD. Vascular artery fragments and whole blood and serum samples were obtained during elective or organ retrieval surgery. Serum levels of sKL, TNFα and IL10, and gene expression levels of KL, TNF, IL10, NFKB1, DNMT1, and DNMT3A in PBCCs were measured. In these cells, we also determined KL promoter methylation percentage. Histological and immunohistochemical analyses were employed to visualize atherosclerotic lesions and to measure IL10 and TNFα levels in vascular fragments. Patients with CVD presented higher values of proinflammatory markers both at systemic and in the vasculature and in the PBCCs, compared to the control group. In PBCCs, CVD patients also presented lower gene expression levels of KL gene (56.4% difference, P < 0.001), higher gene expression levels of DNMT1 and DNMT3A (P < 0.0001, for both) and a higher methylation status of in the promoter region of KL (34.1 ± 4.1% vs. 14.6 ± 3.4%, P < 0.01). In PBCCs and vasculature, KL gene expression correlated inversely with pro-inflammatory markers and directly with anti-inflammatory markers. sKL serum levels presented similar associations with the expression levels of pro- and anti-inflammatory markers in PBCCs. The differences in KL expression levels in PBCCs and in serum sKL levels with respect to control group was even greater in those CVD patients with macroscopically observable atheromatous plaques. We conclude that promoter methylation-mediated downregulation of KL gene expression in PBCCs is associated with the pro-inflammatory status in atherosclerotic vascular disease.© 2022. The Author(s)."
"35659240","Antagonistic regulatory effects of a single cis-acting expression quantitative trait locus between transcription and translation of the MRPL43 gene.","BMC Genom Data","Heterogeneity of expression quantitative trait locus (eQTL) effects have been shown across gene expression processes. Knowledge on how to produce the heterogeneity is quite limited. This study aims to examine fluctuations in differential gene expression by alleles of sequence variants across expression processes.Genome-wide eQTL analyses with transcriptome-wide gene expression data revealed 20 cis-acting eQTLs associated simultaneously with mRNA expression, ribosome occupancy, and protein abundance. A 97 kb-long eQTL signal for mitochondrial ribosomal protein L43 (MRPL43) covered the gene, showing a heterogeneous effect size on gene products across expression stages. One allele of the eQTL was associated with increased mRNA expression and ribosome occupancy but decreased protein abundance. We examined the heterogeneity and found that the eQTL can be attributed to the independent functions of three nucleotide variants, with a strong linkage. NC_000010.11:g.100987606G > T, upstream of MRPL43, may regulate the binding affinity of transcription factors. NC_000010.11:g.100986746C > G, 3 bp from an MRPL43 splice donor site, may alter the splice site. NC_000010.11:g.100978794A > G, in the isoform with a long 3'-UTR, may strengthen the binding affinity of the microRNA. Individuals with the TGG haplotype at these three variants had higher levels of mRNA expression and ribosome occupancy than individuals with the GCA haplotype but lower protein levels, producing the flipped effect throughout the expression process.These findings suggest that multiple functional variants in a linkage exert their regulatory functions at different points in the gene expression process, producing a complexity of single eQTLs.© 2022. The Author(s)."
"35595976","What next for eating disorder genetics? Replacing myths with facts to sharpen our understanding.","Mol Psychiatry","Substantial progress has been made in the understanding of anorexia nervosa (AN) and eating disorder (ED) genetics through the efforts of large-scale collaborative consortia, yielding the first genome-wide significant loci, AN-associated genes, and insights into metabo-psychiatric underpinnings of the disorders. However, the translatability, generalizability, and reach of these insights are hampered by an overly narrow focus in our research. In particular, stereotypes, myths, assumptions and misconceptions have resulted in incomplete or incorrect understandings of ED presentations and trajectories, and exclusion of certain patient groups from our studies. In this review, we aim to counteract these historical imbalances. Taking as our starting point the Academy for Eating Disorders (AED) Truth #5 ""Eating disorders affect people of all genders, ages, races, ethnicities, body shapes and weights, sexual orientations, and socioeconomic statuses"", we discuss what we do and do not know about the genetic underpinnings of EDs among people in each of these groups, and suggest strategies to design more inclusive studies. In the second half of our review, we outline broad strategic goals whereby ED researchers can expand the diversity, insights, and clinical translatability of their studies.© 2022. The Author(s)."
