"pmid","title","source","abstract"
"35604552","Single-Cell Analysis of the Transcriptome and Epigenome.","Methods Mol Biol","Epigenome regulation has emerged as an important mechanism for the maintenance of organ function in health and disease. Dissecting epigenomic alterations and resultant gene expression changes in single cells provides unprecedented resolution and insight into cellular diversity, modes of gene regulation, transcription factor dynamics and 3D genome organization. In this chapter, we summarize the transformative single-cell epigenomic technologies that have deepened our understanding of the fundamental principles of gene regulation. We provide a historical perspective of these methods, brief procedural outline with emphasis on the computational tools used to meaningfully dissect information. Our overall goal is to aid scientists using these technologies in their favorite system of interest.© 2022. This is a U.S. government work and not under copyright protection in the U.S.; foreign copyright protection may apply."
"35595749","A 3D gene expression atlas of the floral meristem based on spatial reconstruction of single nucleus RNA sequencing data.","Nat Commun","Cellular heterogeneity in growth and differentiation results in organ patterning. Single-cell transcriptomics allows characterization of gene expression heterogeneity in developing organs at unprecedented resolution. However, the original physical location of the cell is lost during this methodology. To recover the original location of cells in the developing organ is essential to link gene activity with cellular identity and function in plants. Here, we propose a method to reconstruct genome-wide gene expression patterns of individual cells in a 3D flower meristem by combining single-nuclei RNA-seq with microcopy-based 3D spatial reconstruction. By this, gene expression differences among meristematic domains giving rise to different tissue and organ types can be determined. As a proof of principle, the method is used to trace the initiation of vascular identity within the floral meristem. Our work demonstrates the power of spatially reconstructed single cell transcriptome atlases to understand plant morphogenesis. The floral meristem 3D gene expression atlas can be accessed at http://threed-flower-meristem.herokuapp.com .© 2022. The Author(s)."
"35660939","DNA-methylome-assisted classification of patients with poor prognostic subventricular zone associated IDH-wildtype glioblastoma.","Acta Neuropathol","Glioblastoma (GBM) derived from the ""stem cell"" rich subventricular zone (SVZ) may constitute a therapy-refractory subgroup of tumors associated with poor prognosis. Risk stratification for these cases is necessary but is curtailed by error prone imaging-based evaluation. Therefore, we aimed to establish a robust DNA methylome-based classification of SVZ GBM and subsequently decipher underlying molecular characteristics. MRI assessment of SVZ association was performed in a retrospective training set of IDH-wildtype GBM patients (n = 54) uniformly treated with postoperative chemoradiotherapy. DNA isolated from FFPE samples was subject to methylome and copy number variation (CNV) analysis using Illumina Platform and cnAnalysis450k package. Deep next-generation sequencing (NGS) of a panel of 130 GBM-related genes was conducted (Agilent SureSelect/Illumina). Methylome, transcriptome, CNV, MRI, and mutational profiles of SVZ GBM were further evaluated in a confirmatory cohort of 132 patients (TCGA/TCIA). A 15 CpG SVZ methylation signature (SVZM) was discovered based on clustering and random forest analysis. One third of CpG in the SVZM were associated with MAB21L2/LRBA. There was a 14.8% (n = 8) discordance between SVZM vs. MRI classification. Re-analysis of these patients favored SVZM classification with a hazard ratio (HR) for OS of 2.48 [95% CI 1.35-4.58], p = 0.004 vs. 1.83 [1.0-3.35], p = 0.049 for MRI classification. In the validation cohort, consensus MRI based assignment was achieved in 62% of patients with an intraclass correlation (ICC) of 0.51 and non-significant HR for OS (2.03 [0.81-5.09], p = 0.133). In contrast, SVZM identified two prognostically distinct subgroups (HR 3.08 [1.24-7.66], p = 0.016). CNV alterations revealed loss of chromosome 10 in SVZM- and gains on chromosome 19 in SVZM- tumors. SVZM- tumors were also enriched for differentially mutated genes (p < 0.001). In summary, SVZM classification provides a novel means for stratifying GBM patients with poor prognosis and deciphering molecular mechanisms governing aggressive tumor phenotypes.© 2022. The Author(s)."
"35650627","Comprehensive analysis of the expression, prognostic significance, and function of FAM83 family members in breast cancer.","World J Surg Oncol","The FAM83 family plays a key role in tumorigenesis and cancer progression. However, the role of the FAM83 family in the development of breast tumors is unclear to date. This report explores the expression, prognostic significance, and function of the FAM83 family members in breast cancer using public databases.UALCAN database was used to explore the expression of FAM83 family members in breast cancer. Furthermore, we validated the expression of FAM83 family members in twenty pairs of breast cancer and normal tissues by RT-PCR. Kaplan-Meier plotter database was used to explore the prognostic significance of FAM83 family members in breast cancer. GeneMANIA and DAVID databases were used for functional and pathway enrichment analysis of genes co-expressed with FAM83A, FAM83D, FAM83F, and FAM83G. MEXPRESS and UALCAN databases were used to analyze the level of DNA promoter methylation of FAM83A, FAM83D, FAM83F, and FAM83G in breast cancer. TIMER database was utilized to explore the relationships between immune cell infiltration and FAM83A, FAM83D, FAM83F, and FAM83G expression.Among FAM83 family members, FAM83A, FAM83D, FAM83F, and FAM83G were higher expressed in breast cancer than in normal tissues. We also validated the significant high expression of FAM83A, FAM83D, FAM83F, and FAM83G mRNA in breast cancer than in normal samples. Their increased expression has an adverse prognostic effect on breast cancer patients. These genes co-expressed with FAM83A, FAM83D, FAM83F, and FAM83G might take part in cell proliferation, G2/M transition of the mitotic cell cycle, regulation of apoptosis process and other cancer-related biological processes. In addition, they were mainly enriched in the Hippo signaling pathway, Hedgehog signaling pathway, PI3K/AKT signaling pathway, and other cancer-related pathways. We also found that promoter DNA methylation might regulate the expression of FAM83A, FAM83D, FAM83F, and FAM83G mRNA in most CpG islands. At last, we found the expression of FAM83A, FAM83D, FAM83F, and FAM83G mRNA was significantly related to immune cell infiltration.FAM83A, FAM83D, FAM83F, and FAM83G were highly expressed in breast cancer tissues and had an adverse effect on the survival outcomes of breast cancer patients. Also, they were involved in breast cancer-related signal pathways. Therefore, they might serve as potential therapeutic targets for breast cancer clinical treatment.© 2022. The Author(s)."
"35589688","Estradiol-mediated inhibition of DNMT1 decreases p53 expression to induce M2-macrophage polarization in lung cancer progression.","Oncogenesis","Previous studies indicate that estrogen positively regulates lung cancer progression. Understanding the reasons will be beneficial for treating women with lung cancer in the future. In this study, we found that tumor formation was more significant in female EGFRL858Rmice than in male mice. P53 expression levels were downregulated in the estradiol (E2)-treated lung cancer cells, female mice with EGFRL858R-induced lung cancer mice, and premenopausal women with lung cancer. E2 increased DNA methyltransferase 1 (DNMT1) expression to enhance methylation in the TP53 promoter, which led to the downregulation of p53. Overexpression of GFP-p53 decreased DNMT1 expression in lung cancer cells. TP53 knockout in mice with EGFRL858R-induced lung cancer not only changed gene expression in cancer cells but also increased the polarization of M2 macrophages by increasing C-C motif chemokine ligand 5 (CCL5) expression and decreasing growth differentiation factor 15 (GDF15) expression. The TP53 mutation rate was increased in females with late-stage but not early-stage lung cancer compared to males with lung cancer. In conclusion, E2-induced DNMT1 and p53 expression were negatively regulated each other in females with lung cancer, which not only affected cancer cells but also modulated the tumor-associated microenvironment, ultimately leading to a poor prognosis.© 2022. The Author(s)."
"35581740","Differences in the expression of DNA methyltransferases and demethylases in leukocytes and the severity of pulmonary arterial hypertension between ethnic groups.","Physiol Rep","The loss of ten-eleven translocation (TET2) methylcytosine dioxygenase expression contributes to the pathobiology of pulmonary arterial hypertension (PAH). However, whether the expression and activity of other TETs and DNA methyltransferases (DNMTs) are altered in PAH remains enigmatic. Therefore, our objective was to determine the expression of DNMT (1, 3a, and 3b) and TET (1, 2, and 3) and their total activity. We assessed the expression of DNMT and TET enzymes in the leukocytes and their activity in extracellular vesicles (EVs). Expression of DNMT (1, 3a, and 3b), TET (2 and 3) in leukocytes, and total activity in EVs, from PAH patients was higher than in healthy controls. Additionally, we noticed there were difference in expression of these epigenetic enzyme based on ethnicity and found higher DNMT1 and lower TET2/TET3 expression in Caucasian than Hispanic/African American (combine) patients. Since loss-of-function mutation(s) and down-regulation of TET enzymes are associated with hematological malignancies and cytokine production, we determined the expression of genes that encode cytokines in samples of Caucasian and Hispanic/African American patients. Expression of IL6, CSF2, and CCL5 genes were higher in the leukocytes of Caucasian than Hispanic/African American patients, and CSF2 and CCL5 negatively correlated with the decreased expression of TET3. Interestingly, the expression of gene encoding CD34, a marker of myeloid and lymphoid precursor cells, and CD163, a monocyte/macrophage protein, was higher in the leukocytes of Caucasian than Hispanic/African American patients. Furthermore, Hispanic/African American patients having higher TET2/TET3 expression had higher pulmonary capillary wedge pressure. In conclusion, our results revealed higher DNMT1 and lower TET2/TET3 in Caucasian than Hispanic/African American patients together potentially augmented genes encoding inflammation causing cytokines, and CD34+-derived immunogenic cells, and the severity of PAH.© 2022 The Authors. Physiological Reports published by Wiley Periodicals LLC on behalf of The Physiological Society and the American Physiological Society."
"35650446","How genetic risk contributes to autoimmune liver disease.","Semin Immunopathol","Genome-wide association studies (GWAS) for autoimmune hepatitis (AIH) and GWAS/genome-wide meta-analyses (GWMA) for primary biliary cholangitis (PBC) and primary sclerosing cholangitis (PSC) have been successful over the past decade, identifying about 100 susceptibility loci in the human genome, with strong associations with the HLA locus and many susceptibility variants outside the HLA locus with relatively low risk. However, identifying causative variants and genes and determining their effects on liver cells and their immunological microenvironment is far from trivial. Polygenic risk scores (PRSs) based on current genome-wide data have limited potential to predict individual disease risk. Interestingly, results of mediated expression score regression analysis provide evidence that a substantial portion of gene expression at susceptibility loci is mediated by genetic risk variants, in contrast to many other complex diseases. Genome- and transcriptome-wide comparisons between AIH, PBC, and PSC could help to better delineate the shared inherited component of autoimmune liver diseases (AILDs), and statistical fine-mapping, chromosome X-wide association testing, and genome-wide in silico drug screening approaches recently applied to GWMA data from PBC could potentially be successfully applied to AIH and PSC. Initial successes through single-cell RNA sequencing (scRNA-seq) experiments in PBC and PSC now raise high hopes for understanding the impact of genetic risk variants in the context of liver-resident immune cells and liver cell subpopulations, and for bridging the gap between genetics and disease.© 2022. The Author(s)."
"35618845","Immune disease risk variants regulate gene expression dynamics during CD4<sup>+</sup> T cell activation.","Nat Genet","During activation, T cells undergo extensive gene expression changes that shape the properties of cells to exert their effector function. Understanding the regulation of this process could help explain how genetic variants predispose to immune diseases. Here, we mapped genetic effects on gene expression (expression quantitative trait loci (eQTLs)) using single-cell transcriptomics. We profiled 655,349 CD4+T cells, capturing transcriptional states of unstimulated cells and three time points of cell activation in 119 healthy individuals. This identified 38 cell clusters, including transient clusters that were only present at individual time points of activation. We found 6,407 genes whose expression was correlated with genetic variation, of which 2,265 (35%) were dynamically regulated during activation. Furthermore, 127 genes were regulated by variants associated with immune-mediated diseases, with significant enrichment for dynamic effects. Our results emphasize the importance of studying context-specific gene expression regulation and provide insights into the mechanisms underlying genetic susceptibility to immune-mediated diseases.© 2022. The Author(s)."
"35606385","Development and validation of an RNA-seq-based transcriptomic risk score for asthma.","Sci Rep","Recent progress in RNA sequencing (RNA-seq) allows us to explore whole-genome gene expression profiles and to develop predictive model for disease risk. The objective of this study was to develop and validate an RNA-seq-based transcriptomic risk score (RSRS) for disease risk prediction that can simultaneously accommodate demographic information. We analyzed RNA-seq gene expression data from 441 asthmatic and 254 non-asthmatic samples. Logistic least absolute shrinkage and selection operator (Lasso) regression analysis in the training set identified 73 differentially expressed genes (DEG) to form a weighted RSRS that discriminated asthmatics from healthy subjects with area under the curve (AUC) of 0.80 in the testing set after adjustment for age and gender. The 73-gene RSRS was validated in three independent RNA-seq datasets and achieved AUCs of 0.70, 0.77 and 0.60, respectively. To explore their biological and molecular functions in asthma phenotype, we examined the 73 genes by enrichment pathway analysis and found that these genes were significantly (p < 0.0001) enriched for DNA replication, recombination, and repair, cell-to-cell signaling and interaction, and eumelanin biosynthesis and developmental disorder. Further in-silico analyses of the 73 genes using Connectivity map shows that drugs (mepacrine, dactolisib) and genetic perturbagens (PAK1, GSR, RBM15 and TNFRSF12A) were identified and could potentially be repurposed for treating asthma. These findings show the promise for RNA-seq risk scores to stratify and predict disease risk.© 2022. The Author(s)."
"35581642","Explaining the complex impact of the Covid-19 pandemic on children with overweight and obesity: a comparative ecological analysis of parents' perceptions in three countries.","BMC Public Health","The Covid-19 pandemic has changed children's eating and physical activity behaviours. These changes have been positive for some households and negative for others, revealing health inequalities that have ramifications for childhood obesity. This study investigates the pandemic's impact on families of children aged 2-6 years with overweight or obesity.Drawing on interviews conducted as part of a randomised controlled trial (RCT) for childhood obesity, thematic analysis was used to examine how parents of pre-schoolers perceived changes in their eating, screentime and physical activity behaviours between the first and second waves of Covid-19. Parents (n = 70, representing 68 families) were interviewed twice during a period of 6 months in three countries with markedly different pandemic policies - Sweden, Romania, and Spain. The analysis is informed by Bronfenbrenner's ecological systems theory, which embeds home- and school-based influences within societal and policy contexts.The findings show that, although all participants were recruited from an RCT for families of children with excess weight, they reported different responses to the pandemic's second wave, with some children engaging in healthier eating and physical activity, and others engaging in comfort eating and a more sedentary lifestyle. Differences in children's obesity-related behaviours were closely related to differences in parents' practices, which were, in turn, linked to their emotional and social wellbeing. Notably, across all sites, parents' feeding and physical activity facilitation practices, as well as their emotional and social wellbeing, were embedded in household resilience. In resilient households, where parents had secure housing and employment, they were better able to adapt to the challenges posed by the pandemic, whereas parents who experienced household insecurity found it more difficult to cope.As the Covid-19 pandemic is turning into a long-term public health challenge, studies that address household resilience are crucial for developing effective prevention and treatment responses to childhood obesity.© 2022. The Author(s)."
"35637384","High heritability of ascending aortic diameter and trans-ancestry prediction of thoracic aortic disease.","Nat Genet","Enlargement of the aorta is an important risk factor for aortic aneurysm and dissection, a leading cause of morbidity in the developed world. Here we performed automated extraction of ascending aortic diameter from cardiac magnetic resonance images of 36,021 individuals from the UK Biobank, followed by genome-wide association. We identified lead variants across 41 loci, including genes related to cardiovascular development (HAND2, TBX20) and Mendelian forms of thoracic aortic disease (ELN, FBN1). A polygenic score significantly predicted prevalent risk of thoracic aortic aneurysm and the need for surgical intervention for patients with thoracic aneurysm across multiple ancestries within the UK Biobank, FinnGen, the Penn Medicine Biobank and the Million Veterans Program (MVP). Additionally, we highlight the primary causal role of blood pressure in reducing aortic dilation using Mendelian randomization. Overall, our findings provide a roadmap for using genetic determinants of human anatomy to understand cardiovascular development while improving prediction of diseases of the thoracic aorta.© 2022. The Author(s), under exclusive licence to Springer Nature America, Inc."
"35601155","Characterization of Tumor Mutation Burden-Based Gene Signature and Molecular Subtypes to Assist Precision Treatment in Gastric Cancer.","Biomed Res Int","Tumor mutation burden (TMB) represents a useful biomarker for predicting survival outcomes and immunotherapy response. Here, we aimed to conduct TMB-based gene signature and molecular subtypes in gastric cancer.Based on differentially expressed genes (DEGs) between high- and low-TMB groups in TCGA, a LASSO model was developed for predicting overall survival (OS) and disease-free survival (DFS). The predictive performance was externally verified in the GSE84437 dataset. Molecular subtypes were conducted via consensus clustering approach based on TMB-related DEGs. The immune microenvironment was estimated by ESTIMATE and ssGSEA algorithms.High-TMB patients had prolonged survival duration. TMB-related DEGs were distinctly enriched in cancer- (MAPK, P53, PI3K-Akt, and Wnt pathways) and immune-related pathways (T cell selection and differentiation). The TMB-based gene model was developed (including MATN3, UPK1B, GPX3, and RGS2), and high-risk score was predictive of poor prognosis and recurrence. ROC and multivariate analyses revealed the well predictive performance, which was confirmed in the external cohort. Furthermore, we established the nomogram containing the risk score, age, and stage for personalized prediction of OS and DFS. High-risk score was characterized by high stromal score, increased immune checkpoints, immune cell infiltrations, and enhanced sensitivity to gefitinib, vinorelbine, and gemcitabine. Three TMB-based molecular subtypes were conducted, characterized by distinct prognosis, immune microenvironment, and drug sensitivity.Collectively, we established a prognostic signature and three distinct molecular subtypes based on TMB features for gastric cancer, which might be beneficial for prognostic prediction and clinical decision-making.Copyright © 2022 Cheng Wei et al."
"35578596","Immune Subtype Profiling and Establishment of Prognostic Immune-Related lncRNA Pairs in Human Ovarian Cancer.","Comput Math Methods Med","This study collected immune-related genes (IRGs) and used gene expression data from TCGA database to construct a molecular subtype of ovarian cancer (OV) based on immune-related lncRNA gene pairs (IRLnc_GPs). The relationships between molecular subtypes and prognosis and clinical characteristics were further explored. IRGs were acquired from the ImmPort database, and round-robin pairing of immune-related lncRNAs was performed. The NMF algorithm was used to identify molecular subtypes, and the immune score of a single sample was calculated through ESTIMATE, TIMER, ssGSEA, MCPcounter, and CIBERSORT. The relationship between molecular subtypes and immune microenvironments was identified. A hypergeometric test was used to test the lncRNA pairs among the OV molecular subtypes (C1 and C2 subtypes). The BH method was used to screen the different lncRNA pairs, and a predictive risk model was constructed and verified. Finally, correlation analysis between the risk model, immune checkpoint genes, and chemotherapy drugs was carried out. Based on IRLnc_GP to classify 373 OV samples of TCGA, the samples were divided into two subtypes, and the prognosis between the subtypes showed significant differences. The C1 subtype with a poor prognosis was more related to the pathways of tumor occurrence and development. We identified 180 differential lncRNA pairs between subtypes and constructed a prognostic risk model based on 8 IRLnc_GPs. In the independent dataset, the distribution of subtypes in functional modules was different and highly repeatable. There were significant differences in the molecular and clinical characteristics of the subtypes and the drug sensitivity of immunotherapy/chemotherapy. In conclusion, the risk model established based on IRLnc_GP can better evaluate the prognosis of OV samples and can also assess the effects of different drug treatments in the high- and low-risk groups, providing new insights and ideas for the treatment of OV.Copyright © 2022 Xingling Wang et al."
"35692046","Plasma neurofilament light and its association with all-cause mortality risk among urban middle-aged men and women.","BMC Med","Neurofilament light chain (NfL) is released into the blood during neuronal damage. NfL is linked to mortality in neurological disorders, remaining unexplored in population studies. We investigated whether initial (v1) and annualized change (δ) in plasma NfL can predict all-cause mortality in middle-aged dementia-free urban adults.Longitudinal data were from 694 participants in the Healthy Aging in Neighborhoods of Diversity Across the Life Span study (HANDLS, mean agev1: 47.8 years, 42% male, 55.8% African American). Plasma NfL was measured prospectively at three visits. Analyses included Cox proportional hazards models for all-cause mortality risk and 4-way decomposition testing for interaction and mediation.Unlike men, women exhibited a direct association between δNfL (above vs. below median) and all-cause mortality risk in both the minimally (HR = 3.91, 95% CI 1.10-13.9, p = 0.036) and fully adjusted models (HR = 4.92, 95% CI 1.26-19.2, p = 0.022), and for δNfL (per unit increase) in the full model (HR = 1.65, 95% CI 1.04-2.61, p = 0.034). In both models, and among women, 1 standard deviation of NfLv1was associated with an increased all-cause mortality risk (reduced model: HR = 2.01, 95% CI 1.24-3.25, p = 0.005; full model: HR = 1.75, 95% CI 1.02-2.98, p = 0.041). Only few interactions were detected for cardio-metabolic risk factors. Notably, NfLv1was shown to be a better prognostic indicator at normal hsCRP values among women, while HbA1c and δNfL interacted synergistically to determine mortality risk, overall.These findings indicate that plasma NfL levels at baseline and over time can predict all-cause mortality in women and interacts with hsCRP and HbA1c to predict that risk.© 2022. The Author(s)."
