"pmid","title","source","abstract"
"36927187","Nutritional Modulation of Associations between Prenatal Exposure to Persistent Organic Pollutants and Childhood Obesity: A Prospective Cohort Study.","Environ Health Perspect","Prenatal exposure to persistent organic pollutants (POPs) may contribute to the development of childhood obesity and metabolic disorders. However, little is known about whether the maternal nutritional status during pregnancy can modulate these associations.The main objective was to characterize the joint associations and interactions between prenatal levels of POPs and nutrients on childhood obesity.We used data from to the Spanish INfancia y Medio Ambiente-Environment and Childhood (INMA) birth cohort, on POPs and nutritional biomarkers measured in maternal blood collected at the first trimester of pregnancy and child anthropometric measurements at 7 years of age. Six organochlorine compounds (OCs) [dichlorodiphenyldichloroethylene, hexachlorobenzene (HCB),β-hexachlorocyclohexane(β-HCH) and polychlorinated biphenyls 138, 153, 180] and four per- and polyfluoroalkyl substances (PFAS) were measured. Nutrients included vitamins (D, B12, and folate), polyunsaturated fatty acids (PUFAs), and dietary carotenoids. Two POPs-nutrients mixtures data sets were established:a) OCs, PFAS, vitamins, and carotenoids (n=660), andb) OCs, PUFAs, and vitamins (n=558). Joint associations of mixtures on obesity were characterized using Bayesian kernel machine regression (BKMR). Relative importance of biomarkers and two-way interactions were identified using gradient boosting machine, hierarchical group lasso regularization, and BKMR. Interactions were further characterized using multivariate regression models in the multiplicative and additive scale.Forty percent of children had overweight or obesity. We observed a positive overall joint association of both POPs-nutrients mixtures on overweight/obesity risk, with HCB and vitamin B12 the biomarkers contributing the most. Recurrent interactions were found between HCB and vitamin B12 across screening models. Relative risk for a natural log increase of HCB was 1.31 (95% CI: 1.11, 1.54,pInteraction=0.02) in the tertile 2 of vitamin B12 and in the additive scale a relative excess risk due to interaction of 0.11 (95% CI: 0.02, 0.20) was found. Interaction between perfluorooctane sulfonate andβ-cryptoxanthinsuggested a protective effect of the antioxidant on overweight/obesity risk.These results support that maternal nutritional status may modulate the effect of prenatal exposure to POPs on childhood overweight/obesity. These findings may help to develop a biological hypothesis for future toxicological studies and to better interpret inconsistent findings in epidemiological studies. https://doi.org/10.1289/EHP11258."
"36867662","The anatomy of transcriptionally active chromatin loops in Drosophila primary spermatocytes using super-resolution microscopy.","PLoS Genet","While the biochemistry of gene transcription has been well studied, our understanding of how this process is organised in 3D within the intact nucleus is less well understood. Here we investigate the structure of actively transcribed chromatin and the architecture of its interaction with active RNA polymerase. For this analysis, we have used super-resolution microscopy to image the Drosophila melanogaster Y loops which represent huge, several megabases long, single transcription units. The Y loops provide a particularly amenable model system for transcriptionally active chromatin. We find that, although these transcribed loops are decondensed they are not organised as extended 10nm fibres, but rather they largely consist of chains of nucleosome clusters. The average width of each cluster is around 50nm. We find that foci of active RNA polymerase are generally located off the main fibre axis on the periphery of the nucleosome clusters. Foci of RNA polymerase and nascent transcripts are distributed around the Y loops rather than being clustered in individual transcription factories. However, as the RNA polymerase foci are considerably less prevalent than the nucleosome clusters, the organisation of this active chromatin into chains of nucleosome clusters is unlikely to be determined by the activity of the polymerases transcribing the Y loops. These results provide a foundation for understanding the topological relationship between chromatin and the process of gene transcription.Copyright: © 2023 Ball et al. This is an open access article distributed under the terms of the Creative Commons Attribution License, which permits unrestricted use, distribution, and reproduction in any medium, provided the original author and source are credited."
"36918909","Mechanism of action deconvolution of the small-molecule pathological tau aggregation inhibitor Anle138b.","Alzheimers Res Ther","A key histopathological hallmark of Alzheimer's disease (AD) is the presence of neurofibrillary tangles of aggregated microtubule-associated protein tau in neurons. Anle138b is a small molecule which has previously shown efficacy in mice in reducing tau aggregates and rescuing AD disease phenotypes.In this work, we employed bioinformatics analysis-including pathway enrichment and causal reasoning-of an in vitro tauopathy model. The model consisted of cultured rat cortical neurons either unseeded or seeded with tau aggregates derived from human AD patients, both of which were treated with Anle138b to generate hypotheses for its mode of action. In parallel, we used a collection of human target prediction models to predict direct targets of Anle138b based on its chemical structure.Combining the different approaches, we found evidence supporting the hypothesis that the action of Anle138b involves several processes which are key to AD progression, including cholesterol homeostasis and neuroinflammation. On the pathway level, we found significantly enriched pathways related to these two processes including those entitled ""Superpathway of cholesterol biosynthesis"" and ""Granulocyte adhesion and diapedesis"". With causal reasoning, we inferred differential activity of SREBF1/2 (involved in cholesterol regulation) and mediators of the inflammatory response such as NFKB1 and RELA. Notably, our findings were also observed in Anle138b-treated unseeded neurons, meaning that the inferred processes are independent of tau pathology and thus represent the direct action of the compound in the cellular system. Through structure-based ligand-target prediction, we predicted the intracellular cholesterol carrier NPC1 as well as NF-κB subunits as potential targets of Anle138b, with structurally similar compounds in the model training set known to target the same proteins.This study has generated feasible hypotheses for the potential mechanism of action of Anle138b, which will enable the development of future molecular interventions aiming to reduce tau pathology in AD patients.© 2023. The Author(s)."
"36935420","A genome-wide association analysis of loss of ambulation in dystrophinopathy patients suggests multiple candidate modifiers of disease severity.","Eur J Hum Genet","The major determinant of disease severity in Duchenne muscular dystrophy (DMD) or milder Becker muscular dystrophy (BMD) is whether the dystrophin gene (DMD) mutation truncates the mRNA reading frame or allows expression of a partially functional protein. However, even in the complete absence of dystrophin, variability in disease severity is observed, and candidate gene studies have implicated several genes as modifiers. Here we present the largest genome-wide search to date for loci influencing severity in N = 419 DMD patients. Availability of subjects for such studies is quite limited, leading to modest sample sizes, which present a challenge for GWAS design. We have therefore taken special steps to minimize heterogeneity within our dataset at the DMD locus itself, taking a novel approach to mutation classification to effectively exclude the possibility of residual dystrophin expression, and utilized statistical methods that are well adapted to smaller sample sizes, including the use of a novel linear regression-like residual for time to ambulatory loss and the application of evidential statistics for the GWAS approach. Finally, we applied an unbiased in silico pipeline, utilizing functional genomic datasets to explore the potential impact of the best supported SNPs. In all, we obtained eight SNPs (out of 1,385,356 total) with posterior probability of trait-marker association (PPLD) ≥ 0.4, representing six distinct loci. Our analysis prioritized likely non-coding SNP regulatory effects on six genes (ETAA1, PARD6G, GALNTL6, MAN1A1, ADAMTS19, and NCALD), each with plausibility as a DMD modifier. These results support both recurrent and potentially new pathways for intervention in the dystrophinopathies.© 2023. The Author(s), under exclusive licence to European Society of Human Genetics."
"36705030","In Vivo Dissection of Chamber-Selective Enhancers Reveals Estrogen-Related Receptor as a Regulator of Ventricular Cardiomyocyte Identity.","Circulation","Cardiac chamber-selective transcriptional programs underpin the structural and functional differences between atrial and ventricular cardiomyocytes (aCMs and vCMs). The mechanisms responsible for these chamber-selective transcriptional programs remain largely undefined.We nominated candidate chamber-selective enhancers (CSEs) by determining the genome-wide occupancy of 7 key cardiac transcription factors (GATA4, MEF2A, MEF2C, NKX2-5, SRF, TBX5, TEAD1) and transcriptional coactivator P300 in atria and ventricles. Candidate enhancers were tested using an adeno-associated virus-mediated massively parallel reporter assay. Chromatin features of CSEs were evaluated by performing assay of transposase accessible chromatin sequencing and acetylation of histone H3 at lysine 27-HiChIP on aCMs and vCMs. CSE sequence requirements were determined by systematic tiling mutagenesis of 29 CSEs at 5 bp resolution. Estrogen-related receptor (ERR) function in cardiomyocytes was evaluated by Cre-loxP-mediated inactivation of ERRα and ERRγ in cardiomyocytes.We identified 134 066 and 97 506 regions reproducibly occupied by at least 1 transcription factor or P300, in atria or ventricles, respectively. Enhancer activities of 2639 regions bound by transcription factors or P300 were tested in aCMs and vCMs by adeno-associated virus-mediated massively parallel reporter assay. This identified 1092 active enhancers in aCMs or vCMs. Several overlapped loci associated with cardiovascular disease through genome-wide association studies, and 229 exhibited chamber-selective activity in aCMs or vCMs. Many CSEs exhibited differential chromatin accessibility between aCMs and vCMs, and CSEs were enriched for aCM- or vCM-selective acetylation of histone H3 at lysine 27-anchored loops. Tiling mutagenesis of 29 CSEs identified the binding motif of ERRα/γ as important for ventricular enhancer activity. The requirement of ERRα/γ to activate ventricular CSEs and promote vCM identity was confirmed by loss of the vCM gene profile in ERRα/γ knockout vCMs.We identified 229 CSEs that could be useful research tools or direct therapeutic gene expression. We showed that chamber-selective multi-transcription factor, P300 occupancy, open chromatin, and chromatin looping are predictive features of CSEs. We found that ERRα/γ are essential for maintenance of ventricular identity. Finally, our gene expression, epigenetic, 3-dimensional genome, and enhancer activity atlas provide key resources for future studies of chamber-selective gene regulation."
"36945027","Transmembrane potential, an indicator in situ reporting cellular senescence and stress response in plant tissues.","Plant Methods","Plant cells usually sustain a stable membrane potential due to influx and/or efflux of charged ions across plasma membrane. With the growth and development of plants, different tissues and cells undergo systemic or local programmed decline. Whether the membrane potential of plasma membrane could report senescence signal of plant tissues and cells is unclear.We applied a maneuverable transmembrane potential (TMP) detection method with patch-clamp setup to examine the senescence signal of leaf tissue cells in situ over the whole life cycle in Arabidopsis thaliana. The data showed that the TMPs of plant tissues and cells were varied at different growth stages, and the change of TMP was higher at the vegetative growth stage than at the reproductive stage of plant growth. The distinct change of TMP was detectable between the normal and the senescent tissues and cells in several plant species. Moreover, diverse abiotic stimuli, such as heat stress, hyperpolarized the TMP in a short time, followed by depolarized membrane potential with the senescence occurring. We further examined the TMP of plant chloroplasts, which also indicates the senescence signal in organelles.This convenient TMP detection method can report the senescence signal of plant tissues and cells, and can also indicate the potential of plant tolerance to environmental stress.© 2023. The Author(s)."
"36935511","Exercise suppresses neuroinflammation for alleviating Alzheimer's disease.","J Neuroinflammation","Alzheimer's disease (AD) is a chronic neurodegenerative disease, with the characteristics of neurofibrillary tangle (NFT) and senile plaque (SP) formation. Although great progresses have been made in clinical trials based on relevant hypotheses, these studies are also accompanied by the emergence of toxic and side effects, and it is an urgent task to explore the underlying mechanisms for the benefits to prevent and treat AD. Herein, based on animal experiments and a few clinical trials, neuroinflammation in AD is characterized by long-term activation of pro-inflammatory microglia and the NOD-, LRR- and pyrin domain-containing protein 3 (NLRP3) inflammasomes. Damaged signals from the periphery and within the brain continuously activate microglia, thus resulting in a constant source of inflammatory responses. The long-term chronic inflammatory response also exacerbates endoplasmic reticulum oxidative stress in microglia, which triggers microglia-dependent immune responses, ultimately leading to the occurrence and deterioration of AD. In this review, we systematically summarized and sorted out that exercise ameliorates AD by directly and indirectly regulating immune response of the central nervous system and promoting hippocampal neurogenesis to provide a new direction for exploring the neuroinflammation activity in AD.© 2023. The Author(s)."
"36926662","Meta-analysis of the effects of smoking and smoking cessation on triglyceride levels.","Toxicol Rep","Smoking increases lipid levels, including triglycerides, leading to increased cardiovascular disease risk. We performed a meta-analysis to quantify the effects of smoking and smoking cessation on triglyceride levels. The PubMed and Scopus databases were searched to identify studies reporting either triglyceride levels in smokers and non-smokers or the effects of smoking cessation on triglyceride levels. Fixed- and random-effects models were used to perform the analyses when three or more studies/comparisons were available. We identified 169 and 21 studies evaluating the effects of smoking and smoking cessation, respectively, on triglyceride levels. Triglyceride levels were 0.50 mmol/L (95% confidence interval: 0.49-0.50 mmol/L) higher in smokers than non-smokers, but the effect differed widely across studies. No statistically significant effect was observed on triglyceride levels between baseline and 6 weeks (mean difference [MD] = 0.02 [-0.09, 0.12] mmol/L), 2 months (MD = 0.03 [-0.21, 0.27] mmol/L), 3 months (MD = 0.08 [-0.03, 0.21] mmol/L), or 1 year (MD = 0.04 [-0.06, 0.14] mmol/L) after quitting. However, a slightly significant decrease in triglyceride levels was observed at 1 month after cessation (MD = -0.15 [-0.15, -0.01] mmol/L). The results of this meta-analysis provide a basis for understanding the effects of smoking and smoking cessation on triglyceride levels, which could have important implications for public health.© 2023 The Authors."
"36922587","Spatial epigenome-transcriptome co-profiling of mammalian tissues.","Nature","Emerging spatial technologies, including spatial transcriptomics and spatial epigenomics, are becoming powerful tools for profiling of cellular states in the tissue context1-5. However, current methods capture only one layer of omics information at a time, precluding the possibility of examining the mechanistic relationship across the central dogma of molecular biology. Here, we present two technologies for spatially resolved, genome-wide, joint profiling of the epigenome and transcriptome by cosequencing chromatin accessibility and gene expression, or histone modifications (H3K27me3, H3K27ac or H3K4me3) and gene expression on the same tissue section at near-single-cell resolution. These were applied to embryonic and juvenile mouse brain, as well as adult human brain, to map how epigenetic mechanisms control transcriptional phenotype and cell dynamics in tissue. Although highly concordant tissue features were identified by either spatial epigenome or spatial transcriptome we also observed distinct patterns, suggesting their differential roles in defining cell states. Linking epigenome to transcriptome pixel by pixel allows the uncovering of new insights in spatial epigenetic priming, differentiation and gene regulation within the tissue architecture. These technologies are of great interest in life science and biomedical research.© 2023. The Author(s)."
"36925717","Current progress of cerebral organoids for modeling Alzheimer's disease origins and mechanisms.","Bioeng Transl Med","Alzheimer's disease (AD) is a progressive, neurodegenerative disease that has emerged as a leading risk factor for dementia associated with increasing age. Two-dimensional (2D) cell culture and animal models, which have been used to analyze AD pathology and search for effective treatments for decades, have significantly contributed to our understanding of the mechanism of AD. Despite their successes, 2D and animal models can only capture a fraction of AD mechanisms due to their inability to recapitulate human brain-specific tissue structure, function, and cellular diversity. Recently, the emergence of three-dimensional (3D) cerebral organoids using tissue engineering and induced pluripotent stem cell technology has paved the way to develop models that resemble features of human brain tissue more accurately in comparison to prior models. In this review, we focus on summarizing key research strategies for engineering in vitro 3D human brain-specific models, major discoveries from using AD cerebral organoids, and its future perspectives.© 2022 The Authors. Bioengineering & Translational Medicine published by Wiley Periodicals LLC on behalf of American Institute of Chemical Engineers."
"36925702","Optimization of CRISPR-Cas system for clinical cancer therapy.","Bioeng Transl Med","Cancer is a genetic disease caused by alterations in genome and epigenome and is one of the leading causes for death worldwide. The exploration of disease development and therapeutic strategies at the genetic level have become the key to the treatment of cancer and other genetic diseases. The functional analysis of genes and mutations has been slow and laborious. Therefore, there is an urgent need for alternative approaches to improve the current status of cancer research. Gene editing technologies provide technical support for efficient gene disruption and modification in vivo and in vitro, in particular the use of clustered regularly interspaced short palindromic repeats (CRISPR)-Cas systems. Currently, the applications of CRISPR-Cas systems in cancer rely on different Cas effector proteins and the design of guide RNAs. Furthermore, effective vector delivery must be met for the CRISPR-Cas systems to enter human clinical trials. In this review article, we describe the mechanism of the CRISPR-Cas systems and highlight the applications of class II Cas effector proteins. We also propose a synthetic biology approach to modify the CRISPR-Cas systems, and summarize various delivery approaches facilitating the clinical application of the CRISPR-Cas systems. By modifying the CRISPR-Cas system and optimizing its in vivo delivery, promising and effective treatments for cancers using the CRISPR-Cas system are emerging.© 2022 The Authors. Bioengineering & Translational Medicine published by Wiley Periodicals LLC on behalf of American Institute of Chemical Engineers."
"36923460","The applicability of the European GMO legislation to epigenetically modified organisms.","Front Bioeng Biotechnol","In addition to classic genetic engineering for the targeted modification of the base sequence of the DNA, epigenetic methods for the targeted modification of the genetic material without base changes are increasingly being used. Such epigenetic techniques can be used, for example, to influence stress tolerance to heat or aridity in plants. The regulatory handling of organisms generated by means of epigenetic techniques on the grounds of genetic engineering law has not yet been clarified. This paper critically reviews the legal classification of epigenetically modified organisms as GMOs as expressed in the study on New Genomic Techniques published in April 2021 by the European Commission. The paper shows that there are reasons to assume that epigenetically modified organisms are not covered by the European GMO legislation. In addition, the paper provides an introductory overview of the significance of epigenetics and the methods used to intentionally influence epigenetic traits and illustrates the possibility for a consistent, risk-based regulation of epigenetic modifications.Copyright © 2023 Faltus."
"36909504","SIRT6 activation rescues the age-related decline in DNA damage repair in primary human chondrocytes.","bioRxiv","While advanced age has long been recognized as the greatest risk factor for osteoarthritis (OA), the biological mechanisms behind this connection remain unclear. Previous work has demonstrated that chondrocytes from older cadaveric donors have elevated levels of DNA damage as compared to chondrocytes from younger donors. The purpose of this study was to determine whether a decline in DNA repair efficiency is one explanation for the accumulation of DNA damage with age, and to quantify the improvement in repair with activation of Sirtuin 6 (SIRT6). Using an acute irradiation model to bring the baseline level of all donors to the same starting point, this study demonstrates a decline in repair efficiency during aging when comparing chondrocytes from young (≤45 years old), middle-aged (50-65 years old), or older (>70 years old) cadaveric donors with no known history of OA or macroscopic cartilage degradation at isolation. Activation of SIRT6 in middle-aged chondrocytes with MDL-800 (20 μM) improved the repair efficiency, while inhibition with EX-527 (10 μM) inhibited the rate of repair and the increased the percentage of cells that retained high levels of damage. Treating chondrocytes from older donors with MDL-800 for 48 hours significantly reduced the amount of DNA damage, despite this damage having accumulated over decades. Lastly, chondrocytes isolated from the proximal femurs of mice between 4 months and 22 months of age revealed both an increase in DNA damage with aging, and a decrease in DNA damage following MDL-800 treatment."
"36756698","DNA repair in cardiomyocytes is critical for maintaining cardiac function in mice.","Aging Cell","Heart failure has reached epidemic proportions in a progressively ageing population. The molecular mechanisms underlying heart failure remain elusive, but evidence indicates that DNA damage is enhanced in failing hearts. Here, we tested the hypothesis that endogenous DNA repair in cardiomyocytes is critical for maintaining normal cardiac function, so that perturbed repair of spontaneous DNA damage drives early onset of heart failure. To increase the burden of spontaneous DNA damage, we knocked out the DNA repair endonucleases xeroderma pigmentosum complementation group G (XPG) and excision repair cross-complementation group 1 (ERCC1), either systemically or cardiomyocyte-restricted, and studied the effects on cardiac function and structure. Loss of DNA repair permitted normal heart development but subsequently caused progressive deterioration of cardiac function, resulting in overt congestive heart failure and premature death within 6 months. Cardiac biopsies revealed increased oxidative stress associated with increased fibrosis and apoptosis. Moreover, gene set enrichment analysis showed enrichment of pathways associated with impaired DNA repair and apoptosis, and identified TP53 as one of the top active upstream transcription regulators. In support of the observed cardiac phenotype in mutant mice, several genetic variants in the ERCC1 and XPG gene in human GWAS data were found to be associated with cardiac remodelling and dysfunction. In conclusion, unrepaired spontaneous DNA damage in differentiated cardiomyocytes drives early onset of cardiac failure. These observations implicate DNA damage as a potential novel therapeutic target and highlight systemic and cardiomyocyte-restricted DNA repair-deficient mouse mutants as bona fide models of heart failure.© 2023 The Authors. Aging Cell published by Anatomical Society and John Wiley & Sons Ltd."
