"pmid","title","source","abstract"
"36907123","Low-coverage sequencing in a deep intercross of the Virginia body weight lines provides insight to the polygenic genetic architecture of growth: novel loci revealed by increased power and improved genome-coverage.","Poult Sci","Genetic dissection of highly polygenic traits is a challenge, in part due to the power necessary to confidently identify loci with minor effects. Experimental crosses are valuable resources for mapping such traits. Traditionally, genome-wide analyses of experimental crosses have targeted major loci using data from a single generation (often the F2) with individuals from later generations being generated for replication and fine-mapping. Here, we aim to confidently identify minor-effect loci contributing to the highly polygenic basis of the long-term, bi-directional selection responses for 56-d body weight in the Virginia body weight chicken lines. To achieve this, a strategy was developed to make use of data from all generations (F2-F18) of the advanced intercross line, developed by crossing the low and high selected lines after 40 generations of selection. A cost-efficient low-coverage sequencing based approach was used to obtain high-confidence genotypes in 1Mb bins across 99.3% of the chicken genome for >3,300 intercross individuals. In total, 12 genome-wide significant, and 30 additional suggestive QTL reaching a 10% FDR threshold, were mapped for 56-d body weight. Only 2 of these QTL reached genome-wide significance in earlier analyses of the F2generation. The minor-effect QTL mapped here were generally due to an overall increase in power by integrating data across generations, with contributions from increased genome-coverage and improved marker information content. The 12 significant QTL explain >37% of the difference between the parental lines, three times more than 2 previously reported significant QTL. The 42 significant and suggestive QTL together explain >80%. Making integrated use of all available samples from multiple generations in experimental crosses are economically feasible using the low-cost, sequencing-based genotyping strategies outlined here. Our empirical results illustrate the value of this strategy for mapping novel minor-effect loci contributing to complex traits to provide a more confident, comprehensive view of the individual loci that form the genetic basis of the highly polygenic, long-term selection responses for 56-d body weight in the Virginia body weight chicken lines.Copyright © 2022 The Authors. Published by Elsevier Inc. All rights reserved."
"36865197","Pleiotropic contribution of rbfox1 to psychiatric and neurodevelopmental phenotypes in a zebrafish model.","bioRxiv","RBFOX1is a highly pleiotropic gene that contributes to several psychiatric and neurodevelopmental disorders. Both rare and common variants inRBFOX1have been associated with several psychiatric conditions, but the mechanisms underlying the pleiotropic effects ofRBFOX1are not yet understood. Here we found that, in zebrafish,rbfox1is expressed in spinal cord, mid- and hindbrain during developmental stages. In adults, expression is restricted to specific areas of the brain, including telencephalic and diencephalic regions with an important role in receiving and processing sensory information and in directing behaviour. To investigate the effect ofrbfox1deficiency on behaviour, we usedrbfox1sa15940, arbfox1loss-of-function line. We found thatrbfox1sa15940mutants present hyperactivity, thigmotaxis, decreased freezing behaviour and altered social behaviour. We repeated these behavioural tests in a secondrbfox1loss-of-function line with a different genetic background,rbfox1del19, and found thatrbfox1deficiency affects behaviour similarly in this line, although there were some differences.rbfox1del19mutants present similar thigmotaxis, but stronger alterations in social behaviour and lower levels of hyperactivity thanrbfox1sa15940fish. Taken together, these results suggest thatrbfox1deficiency leads to multiple behavioural changes in zebrafish that might be modulated by environmental, epigenetic and genetic background effects, and that resemble phenotypic alterations present inRbfox1-deficient mice and in patients with different psychiatric conditions. Our study thus highlights the evolutionary conservation ofrbfox1function in behaviour and paves the way to further investigate the mechanisms underlyingrbfox1pleiotropy on the onset of neurodevelopmental and psychiatric disorders."
"36848234","Epiblast-like stem cells established by Wnt/Î²-catenin signaling manifest distinct features of formative pluripotency and germline competence.","Cell Rep","Different formative pluripotent stem cells harboring similar functional properties have been recently established to be lineage neutral and germline competent yet have distinct molecular identities. Here, we show that WNT/β-catenin signaling activation sustains transient mouse epiblast-like cells as epiblast-like stem cells (EpiLSCs). EpiLSCs display metastable formative pluripotency with bivalent cellular energy metabolism and unique transcriptomic features and chromatin accessibility. We develop single-cell stage label transfer (scSTALT) to study the formative pluripotency continuum and reveal that EpiLSCs recapitulate a unique developmental period in vivo, filling the gap of the formative pluripotency continuum between other published formative stem cells. WNT/β-catenin signaling activation counteracts differentiation effects of activin A and bFGF by preventing complete dissolution of naive pluripotency regulatory network. Moreover, EpiLSCs have direct competence toward germline specification, which is further matured by an FGF receptor inhibitor. Our EpiLSCs can serve as an in vitro model for mimicking and studying early post-implantation development and pluripotency transition.Copyright © 2023 The Authors. Published by Elsevier Inc. All rights reserved."
"36865230","Distinct CSF biomarker-associated DNA methylation in Alzheimer's disease and cognitively normal subjects.","Res Sq","Background Growing evidence has demonstrated that DNA methylation (DNAm) plays an important role in Alzheimer's disease (AD) and that DNAm differences can be detected in the blood of AD subjects. Most studies have correlated blood DNAm with the clinical diagnosis of AD in living individuals. However, as the pathophysiological process of AD can begin many years before the onset of clinical symptoms, there is often disagreement between neuropathology in the brain and clinical phenotypes. Therefore, blood DNAm associated with AD neuropathology, rather than with clinical data, would provide more relevant information on AD pathogenesis. Methods We performed a comprehensive analysis to identify blood DNAm associated with cerebrospinal fluid (CSF) pathological biomarkers for AD. Our study included matched samples of whole blood DNA methylation, CSF Aβ42, phosphorylated tau181(pTau181), and total tau (tTau) biomarkers data, measured on the same subjects and at the same clinical visits from a total of 202 subjects (123 CN or cognitively normal, 79 AD) in the Alzheimer's Disease Neuroimaging Initiative (ADNI) cohort. To validate our findings, we also examined the association between premortem blood DNAm and postmortem brain neuropathology measured on a group of 69 subjects in the London dataset. Results We identified a number of novel associations between blood DNAm and CSF biomarkers, demonstrating that changes in pathological processes in the CSF are reflected in the blood epigenome. Overall, the CSF biomarker-associated DNAm is relatively distinct in CN and AD subjects, highlighting the importance of analyzing omics data measured on cognitively normal subjects (which includes preclinical AD subjects) to identify diagnostic biomarkers, and considering disease stages in the development and testing of AD treatment strategies. Moreover, our analysis revealed biological processes associated with early brain impairment relevant to AD are marked by DNAm in the blood, and blood DNAm at several CpGs in the DMR onHOXA5gene are associated with pTau181in the CSF, as well as tau-pathology and DNAm in the brain, nominating DNAm at this locus as a promising candidate AD biomarker. Conclusions Our study provides a valuable resource for future mechanistic and biomarker studies of DNAm in AD."
"36927494","The effect of high polycyclic aromatic hydrocarbon exposure on biological aging indicators.","Environ Health","Aging represents a serious health and socioeconomic concern for our society. However, not all people age in the same way and air pollution has been shown to largely impact this process. We explored whether polycyclic aromatic hydrocarbons (PAHs), excellent fossil and wood burning tracers, accelerate biological aging detected by lymphocytes DNA methylation age (DNAmAge) and telomere length (TL), early nuclear DNA (nDNA) hallmarks of non-mitotic and mitotic cellular aging, and mitochondrial DNA copy number (mtDNAcn).The study population consisted of 49 male noncurrent-smoking coke-oven workers and 44 matched controls. Occupational and environmental sources of PAH exposures were evaluated by structured questionnaire and internal dose (urinary 1-pyrenol). We estimated Occup_PAHs, the product of 1-pyrenol and years of employment as coke-oven workers, and Environ_PAHs, from multiple items (diet, indoor and outdoor). Biological aging was determined by DNAmAge, via pyrosequencing, and by TL and mtDNAcn, via quantitative polymerase chain reaction. Genomic instability markers in lymphocytes as target dose [anti-benzo[a]pyrene diolepoxide (anti-BPDE)-DNA adduct], genetic instability (micronuclei), gene-specific (p53, IL6 and HIC1) and global (Alu and LINE-1 repeats) DNA methylation, and genetic polymorphisms (GSTM1) were also evaluated in the latent variable nDNA_changes. Structural equation modelling (SEM) analysis evaluated these multifaceted relationships.In univariate analysis, biological aging was higher in coke-oven workers than controls as detected by higher percentage of subjects with biological age older than chronological age (AgeAcc ≥ 0, p = 0.007) and TL (p = 0.038), mtDNAcn was instead similar. Genomic instability, i.e., genotoxic and epigenetic alterations (LINE-1, p53 and Alu) and latent variable nDNA_changes were higher in workers (p < 0.001). In SEM analysis, DNAmAge and TL were positively correlated with Occup_PAHs (p < 0.0001). Instead, mtDNAcn is positively correlated with the latent variable nDNA_changes (p < 0.0001) which is in turn triggered by Occup_PAHs and Environ_PAHs.Occupational PAHs exposure influences DNAmAge and TL, suggesting that PAHs target both non-mitotic and mitotic mechanisms and made coke-oven workers biologically older. Also, differences in mtDNAcn, which is modified through nDNA alterations, triggered by environmental and occupational PAH exposure, suggested a nuclear-mitochondrial core-axis of aging. By decreasing this risky gerontogenic exposure, biological aging and the consequent age-related diseases could be prevented.© 2023. The Author(s)."
"36923723","Genetic alterations in CREBRF influence prostate cancer survival and impact prostate tissue homeostasis in mice.","Am J Clin Exp Urol","Risk factors for prostate cancer include age, environment, race and ethnicity. Genetic variants in cyclic-adenosine-monophosphate-response-element-binding protein 3 regulatory factor (CREBRF) gene are frequently observed in Pacific Islanders, a population with elevated prostate cancer incidence. CREBRF has been shown to play a role in other cancers, however its function in prostate homeostasis and tumorigenesis has not been previously explored. We determined the incidence of CREBRF alterations in publicly available databases and examined the impact of CREBRF deletion on the murine prostate in order to determine whether CREBRF impacts prostate physiology or pathophysiology.Alterations in CREBRF were identified in prostate cancer patients via in silico analysis of several publicly available datasets through cBioPortal. MaleCrebrfknockout and wild-type littermate mice were generated and examined for prostate defects at 4 months of age. Immunohistochemical staining of murine prostate sections was used to determine the impact ofCrebrfknockout on proliferation, apoptosis, inflammation and blood vessel density in the prostate. Serum adipokine levels were measured using a Luminex Multiplex Assay.CREBRF alterations were identified in up to 4.05% of prostate tumors and the mutations identified were categorized as likely damaging. Median survival of prostate cancer patients with genetic alterations in CREBRF was 41.23 months, compared to 131 months for patients without these changes. In the murine model, the prostates ofCrebrfknockout mice had reduced epithelial proliferation and increased TUNEL+apoptotic cells. Circulating adipokines PAI-1 and MCP-1 were also altered inCrebrfknockout mice compared to age-matched controls.Prostate cancer patients with genetic alterations in CREBRF had a significantly decreased overall survival suggesting that wild type CREBRF may play a role in limiting prostate tumorigenesis and progression. The murine knockout model demonstrated that CREBRF could modulate proliferation and apoptosis and macrophage density in the prostate. Serum levels of adipokines PAI-1 and MCP-1 were also altered and may contribute to the phenotypic changes observed in the prostates ofCrebrfknockout mice. Future studies focused on populations susceptible to CREBRF mutations and mechanistic studies will be required to fully elucidate the potential role of CREBRF in prostate tumorigenesis.AJCEU Copyright © 2023."
"36928782","Partner choice, confounding and trait convergence all contribute to phenotypic partner similarity.","Nat Hum Behav","Partners are often similar in terms of their physical and behavioural traits, such as their education, political affiliation and height. However, it is currently unclear what exactly causes this similarity-partner choice, partner influence increasing similarity over time or confounding factors such as shared environment or indirect assortment. Here, we applied Mendelian randomization to the data of 51,664 couples in the UK Biobank and investigated partner similarity in 118 traits. We found evidence of partner choice for 64 traits, 40 of which had larger phenotypic correlation than causal effect. This suggests that confounders contribute to trait similarity, among which household income, overall health rating and education accounted for 29.8, 14.1 and 11.6% of correlations between partners, respectively. Finally, mediation analysis revealed that most causal associations between different traits in the two partners are indirect. In summary, our results show the mechanisms through which indirect assortment increases the observed partner similarity.© 2023. The Author(s)."
"36923930","The Emerging Role of Super-enhancers as Therapeutic Targets in The Digestive System Tumors.","Int J Biol Sci","Digestive system tumors include malignancies of the stomach, pancreas, colon, rectum, and the esophagus, and are associated with high morbidity and mortality. Aberrant epigenetic modifications play a vital role in the progression of digestive system tumors. The aberrant transcription of key oncogenes is driven by super-enhancers (SEs), which are characterized by large clusters of enhancers with significantly high density of transcription factors, cofactors, and epigenetic modulatory proteins. The SEs consist of critical epigenetic regulatory elements, which modulate the biological characteristics of digestive system tumors including tumor cell identity and differentiation, tumorigenesis, environmental response, immune response, and chemotherapeutic resistance. The core transcription regulatory loop of the digestive system tumors is complex and a high density of transcription regulatory complexes in the SEs and the crosstalk between SEs and the noncoding RNAs. In this review, we summarized the known characteristics and functions of the SEs in the digestive system tumors. Furthermore, we discuss the oncogenic roles and regulatory mechanisms of SEs in the digestive system tumors. We highlight the role of SE-driven genes, enhancer RNAs (eRNAs), lncRNAs, and miRNAs in the digestive system tumor growth and progression. Finally, we discuss clinical significance of the CRISPR-Cas9 gene editing system and inhibitors of SE-related proteins such as BET and CDK7 as potential cancer therapeutics.© The author(s)."
"36930228","Enrichment of self-domestication and neural crest function loci in the heritability of neurodevelopmental disorders.","Hum Genet","Self-domestication could contribute to shaping the biology of human brain and consequently the predisposition to neurodevelopmental disorders. Leveraging genome-wide data from the Psychiatric Genomics Consortium, we tested the enrichment of self-domestication and neural crest function loci with respect to the heritability of autism spectrum disorder, schizophrenia (SCZ in East Asian and European ancestries, EAS and EUR, respectively), attention-deficit/hyperactivity disorder, obsessive-compulsive disorder, and Tourette's syndrome (TS). Considering only self-domestication and neural-crest-function annotations in the linkage disequilibrium score regression (LDSC) model, our partitioned heritability analysis revealed statistically significant enrichments across all disorders investigated. The estimates of the heritability enrichments for self-domestication loci were similar across neurodevelopmental disorders, ranging from 0.902 (EAS SCZ, p = 4.55 × 10-20) to 1.577 (TS, p = 5.85 × 10-5). Conversely, a wider spectrum of heritability enrichment estimates was present for neural crest function with the highest enrichment observed for TS (enrichment = 3.453, p = 2.88 × 10-3) and the lowest for EAS SCZ (enrichment = 1.971, p = 3.81 × 10-3). Although these estimates appear to be strong, the enrichments for self-domestication and neural crest function were null once we included additional annotations related to different genomic features. This indicates that the effect of self-domestication on the polygenic architecture of neurodevelopmental disorders is not independent of other functions of human genome.© 2023. The Author(s), under exclusive licence to Springer-Verlag GmbH Germany, part of Springer Nature."
"36928559","A genome-wide association study of frailty identifies significant genetic correlation with neuropsychiatric, cardiovascular, and inflammation pathways.","Geroscience","Frailty is an aging-related clinical phenotype defined as a state in which there is an increase in a person's vulnerability for dependency and/or mortality when exposed to a stressor. While underlying mechanisms leading to the occurrence of frailty are complex, the importance of genetic factors has not been fully investigated. We conducted a large-scale genome-wide association study (GWAS) of frailty, as defined by the five criteria (weight loss, exhaustion, physical activity, walking speed, and grip strength) captured in the Fried Frailty Score (FFS), in 386,565 European descent participants enrolled in the UK Biobank (mean age 57 [SD 8] years, 208,481 [54%] females). We identified 37 independent, novel loci associated with the FFS (p < 5 × 10-8), including seven loci without prior described associations with other traits. The variants associated with FFS were significantly enriched in brain tissues as well as aging-related pathways. Our post-GWAS bioinformatic analyses revealed significant genetic correlations between FFS and cardiovascular-, neurological-, and inflammation-related diseases/traits, and subsequent Mendelian Randomization analyses identified causal associations with chronic pain, obesity, diabetes, education-related traits, joint disorders, and depressive/neurological, metabolic, and respiratory diseases. The GWAS signals were replicated in the Health and Retirement Study (HRS, n = 9,720, mean age 73 [SD 7], 5,582 [57%] females), where the polygenic risk score built from UKB GWAS was significantly associated with the FFS in HRS individuals (OR per SD of the score 1.27, 95% CI 1.22-1.31, p = 1.3 × 10-11). These results provide new insight into the biology of frailty by comprehensively evaluating its genetic architecture.© 2023. The Author(s), under exclusive licence to American Aging Association."
"36862688","Neuron-specific transcriptomic signatures indicate neuroinflammation and altered neuronal activity in ASD temporal cortex.","Proc Natl Acad Sci U S A","Autism spectrum disorder (ASD) is a highly heterogeneous disorder, yet transcriptomic profiling of bulk brain tissue has identified substantial convergence among dysregulated genes and pathways in ASD. However, this approach lacks cell-specific resolution. We performed comprehensive transcriptomic analyses on bulk tissue and laser-capture microdissected (LCM) neurons from 59 postmortem human brains (27 ASD and 32 controls) in the superior temporal gyrus (STG) of individuals ranging from 2 to 73 years of age. In bulk tissue, synaptic signaling, heat shock protein-related pathways, and RNA splicing were significantly altered in ASD. There was age-dependent dysregulation of genes involved in gamma aminobutyric acid (GABA) (GAD1andGAD2) and glutamate (SLC38A1) signaling pathways. In LCM neurons, AP-1-mediated neuroinflammation and insulin/IGF-1 signaling pathways were upregulated in ASD, while mitochondrial function, ribosome, and spliceosome components were downregulated. GABA synthesizing enzymesGAD1andGAD2were both downregulated in ASD neurons. Mechanistic modeling suggested a direct link between inflammation and ASD in neurons, and prioritized inflammation-associated genes for future study. Alterations in small nucleolar RNAs (snoRNAs) associated with splicing events suggested interplay between snoRNA dysregulation and splicing disruption in neurons of individuals with ASD. Our findings supported the fundamental hypothesis of altered neuronal communication in ASD, demonstrated that inflammation was elevated at least in part in ASD neurons, and may reveal windows of opportunity for biotherapeutics to target the trajectory of gene expression and clinical manifestation of ASD throughout the human lifespan."
"36944631","Clinical and genetic associations of deep learning-derived cardiac magnetic resonance-based left ventricular mass.","Nat Commun","Left ventricular mass is a risk marker for cardiovascular events, and may indicate an underlying cardiomyopathy. Cardiac magnetic resonance is the gold-standard for left ventricular mass estimation, but is challenging to obtain at scale. Here, we use deep learning to enable genome-wide association study of cardiac magnetic resonance-derived left ventricular mass indexed to body surface area within 43,230 UK Biobank participants. We identify 12 genome-wide associations (1 known at TTN and 11 novel for left ventricular mass), implicating genes previously associated with cardiac contractility and cardiomyopathy. Cardiac magnetic resonance-derived indexed left ventricular mass is associated with incident dilated and hypertrophic cardiomyopathies, and implantable cardioverter-defibrillator implant. An indexed left ventricular mass polygenic risk score ≥90thpercentile is also associated with incident implantable cardioverter-defibrillator implant in separate UK Biobank (hazard ratio 1.22, 95% CI 1.05-1.44) and Mass General Brigham (hazard ratio 1.75, 95% CI 1.12-2.74) samples. Here, we perform a genome-wide association study of cardiac magnetic resonance-derived indexed left ventricular mass to identify 11 novel variants and demonstrate that cardiac magnetic resonance-derived and genetically predicted indexed left ventricular mass are associated with incident cardiomyopathy.© 2023. The Author(s)."
