ec,date,type,pmid,title,source,abstract
Yes,20220411,ewas,35274472,DNA methylation alterations in muscle of critically ill patients.,J Cachexia Sarcopenia Muscle,"Intensive care unit (ICU)-acquired weakness can persist beyond ICU stay and has been associated with long-term functional impairment of ICU survivors. Recently, DNA methylation alterations were found in the blood of ICU patients, partially explaining long-term developmental impairment of critically ill children. As illness-induced aberrant DNA methylation theoretically could also be involved in long-term weakness, we investigated whether the DNA methylation signature in muscle of adult critically ill patients differs from that in muscle of healthy controls.Genome-wide methylation was determined (InfiniumÂ® HumanMethylationEPIC BeadChips) in DNA extracted from skeletal muscle biopsies that had been collected on Day 8Â Â±Â 1 in ICU from 172 EPaNIC-trial patients [66% male sex, median age 62.7Â years, median body mass index (BMI) 25.9Â kg/m2] and 20 matched healthy controls (70% male sex, median age 58.0Â years, median BMI 24.4Â kg/m2). Methylation status of individual cytosine-phosphate-guanine (CpG) sites of patients and controls was compared with F-tests, using the Benjamini-Hochberg false discovery rate to correct for multiple comparisons. Differential methylation of DNA regions was assessed with bump hunting, with 1000 permutations assessing uncertainty, expressed as family-wise error rate. Gene expression was investigated for 10 representative affected genes.In DNA from ICU patients, 565 CpG sites, associated with 400 unique genes, were differentially methylated as compared with controls (average difference 3.2Â Â±Â 0.1% ranging up to 16.9%, PÂ <Â 0.00005). Many of the associated genes appeared highly relevant for muscle structure and function/weakness, including genes involved in myogenesis, muscle regeneration, nerve/muscle membrane excitability, muscle denervation/re-innervation, axon guidance/myelination/degeneration/regeneration, synapse function, ion channelling with especially calcium signalling, metabolism (glucose, protein, and fat), insulin signalling, neuroendocrine hormone regulation, mitochondrial function, autophagy, apoptosis, oxidative stress, Wnt signalling, transcription regulation, muscle fat infiltration during regeneration, and fibrosis. In patients as compared with controls, we also identified two hypomethylated regions, spanning 18 and 3 CpG sites in the promoters of the HIC1 and NADK2 genes, respectively (average differences 5.8Â Â±Â 0.01% and 12.1Â Â±Â 0.04%, family-wise error rate <0.05). HIC1 and NADK2 play important roles in muscle regeneration and postsynaptic acetylcholine receptors and in mitochondrial processes, respectively. Nine of 10 investigated genes containing DNA methylation alterations were differentially expressed in patients as compared with controls (PÂ â‰¤Â 0.03).Critically ill patients present with a different DNA methylation signature in skeletal muscle as compared with healthy controls, which in theory could provide a biological basis for long-term persistence of weakness in ICU survivors.ClinicalTrials.gov: NCT00512122, registered on 31 July 2007.Â© 2022 The Authors. Journal of Cachexia, Sarcopenia and Muscle published by John Wiley & Sons Ltd on behalf of Society on Sarcopenia, Cachexia and Wasting Disorders."
Yes,20220411,ewas,35379837,DNA methylation in peripheral tissues and left-handedness.,Sci Rep,"Handedness has low heritability and epigenetic mechanisms have been proposed as an etiological mechanism. To examine this hypothesis, we performed an epigenome-wide association study of left-handedness. In a meta-analysis of 3914 adults of whole-blood DNA methylation, we observed that CpG sites located in proximity of handedness-associated genetic variants were more strongly associated with left-handedness than other CpG sites (Pâ€‰=â€‰0.04), but did not identify any differentially methylated positions. In longitudinal analyses of DNA methylation in peripheral blood and buccal cells from children (Nâ€‰=â€‰1737), we observed moderately stable associations across age (correlation range [0.355-0.578]), but inconsistent across tissues (correlation range [-â€‰0.384 to 0.318]). We conclude that DNA methylation in peripheral tissues captures little of the variance in handedness. Future investigations should consider other more targeted sources of tissue, such as the brain.Â© 2022. The Author(s)."
Yes,20220411,ewas,35377194,Association of Glyphosate Exposure with Blood DNA Methylation in a Cross-Sectional Study of Postmenopausal Women.,Environ Health Perspect,"Glyphosate is the most commonly used herbicide in the world and is purported to have a variety of health effects, including endocrine disruption and an elevated risk of several types of cancer. Blood DNA methylation has been shown to be associated with many other environmental exposures, but to our knowledge, no studies to date have examined the association between blood DNA methylation and glyphosate exposure.We conducted an epigenome-wide association study to identify DNA methylation loci associated with urinary glyphosate and its metabolite aminomethylphosphonic acid (AMPA) levels. Secondary goals were to determine the association of epigenetic age acceleration with glyphosate and AMPA and develop blood DNA methylation indices to predict urinary glyphosate and AMPA levels.For 392 postmenopausal women, white blood cell DNA methylation was measured using the Illumina Infinium MethylationEPIC BeadChip array. Glyphosate and AMPA were measured in two urine samples per participant using liquid chromatography-tandem mass spectrometry. Methylation differences at the probe and regional level associated with glyphosate and AMPA levels were assessed using a resampling-based approach. Probes and regions that had an false discovery rateq<0.1inâ‰¥90%of 1,000 subsamples of the study population were considered differentially methylated. Differentially methylated sites from the probe-specific analysis were combined into a methylation index. Epigenetic age acceleration from three epigenetic clocks and an epigenetic measure of pace of aging were examined for associations with glyphosate and AMPA.We identified 24 CpG sites whose methylation level was associated with urinary glyphosate concentration and two associated with AMPA. Four regions, within the promoters of theMSH4,KCNA6,ABAT, andNDUFAF2/ERCC8genes, were associated with glyphosate levels, along with an association betweenESR1promoter hypomethylation and AMPA. The methylation index accurately predicted glyphosate levels in an internal validation cohort. AMPA, but not glyphosate, was associated with greater epigenetic age acceleration.Glyphosate and AMPA exposure were associated with DNA methylation differences that could promote the development of cancer and other diseases. Further studies are warranted to replicate our results, determine the functional impact of glyphosate- and AMPA-associated differential DNA methylation, and further explore whether DNA methylation could serve as a biomarker of glyphosate exposure. https://doi.org/10.1289/EHP10174."
Yes,20220411,ewas,35354486,DNA methylome-wide association study of genetic risk for depression implicates antigen processing and immune responses.,Genome Med,"Depression is a disabling and highly prevalent condition where genetic and epigenetic, such as DNA methylation (DNAm), differences contribute to disease risk. DNA methylation is influenced by genetic variation but the association between polygenic risk of depression and DNA methylation is unknown.We investigated the association between polygenic risk scores (PRS) for depression and DNAm by conducting a methylome-wide association study (MWAS) in Generation Scotland (N = 8898, mean age = 49.8 years) with replication in the Lothian Birth Cohorts of 1921 and 1936 and adults in the Avon Longitudinal Study of Parents and Children (ALSPAC) (Ncombined= 2049, mean age = 79.1, 69.6 and 47.2 years, respectively). We also conducted a replication MWAS in the ALSPAC children (N = 423, mean age = 17.1 years). Gene ontology analysis was conducted for the cytosine-guanine dinucleotide (CpG) probes significantly associated with depression PRS, followed by Mendelian randomisation (MR) analysis to infer the causal relationship between depression and DNAm.Widespread associations (NCpG= 71, pBonferroni< 0.05, p < 6.3 Ã— 10-8) were found between PRS constructed using genetic risk variants for depression and DNAm in CpG probes that localised to genes involved in immune responses and neural development. The effect sizes for the significant associations were highly correlated between the discovery and replication samples in adults (r = 0.79) and in adolescents (r = 0.82). Gene Ontology analysis showed that significant CpG probes are enriched in immunological processes in the human leukocyte antigen system. Additional MWAS was conducted for each lead genetic risk variant. Over 47.9% of the independent genetic risk variants included in the PRS showed associations with DNAm inÂ CpG probes located in both the same (cis) and distal (trans) locationsÂ to the genetic loci (pBonferroni< 0.045). Subsequent MR analysis showed that there are a greater number of causal effects found from DNAm to depression than vice versa (DNAm to depression: pFDRranged from 0.024 to 7.45 Ã— 10-30; depression to DNAm: pFDRranged from 0.028 to 0.003).PRS for depression, especially those constructed from genome-wide significant genetic risk variants, showed methylome-wide differences associated with immune responses. Findings from MR analysis provided evidence for causal effect of DNAm to depression.Â© 2022. The Author(s)."
Yes,20220411,ewas,35347270,Grandmaternal smoking during pregnancy is associated with differential DNA methylation in peripheral blood of their grandchildren.,Eur J Hum Genet,"The idea that information can be transmitted to subsequent generation(s) by epigenetic means has been studied for decades but remains controversial in humans. Epidemiological studies have established that grandparental exposures are associated with health outcomes in their grandchildren, often with sex-specific effects; however, the mechanism of transmission is still unclear. We conducted Epigenome Wide Association Studies (EWAS) to test whether grandmaternal smoking during pregnancy is associated with altered DNA methylation (DNAm) in peripheral blood from their adolescent grandchildren. We used data from a birth cohort, with discovery and replication datasets of up to 1225 and 708 individuals (respectively, for the maternal line), aged 15-17 years, and tested replication in the same individuals at birth and 7 years. We show for the first time that DNAm at a small number of loci in cord blood is associated with grandmaternal smoking in humans. In adolescents we see suggestive associations in regions of the genome which we hypothesised a priori could be involved in transgenerational transmission - we observe sex-specific associations at two sites on the X chromosome and one in an imprinting control region. All are within transcription factor binding sites (TFBSs), and we observe enrichment for TFBS among the CpG sites with the strongest associations; however, there is limited evidence that the associations we see replicate between timepoints. The implication of this work is that effects of smoking during pregnancy may induce DNAm changes in later generations and that these changes are often sex-specific, in line with epidemiological associations.Â© 2022. The Author(s)."
Yes,20220411,ewas,35346352,Epigenome-wide DNA methylation profiling of conditioned pain modulation in individuals with non-specific chronic low back pain.,Clin Epigenetics,"The pathoanatomic cause of chronic low back pain (cLBP) cannot be identified for up to 90% of individuals. However, dysfunctional processing of endogenous nociceptive input, measured as conditioned pain modulation (CPM), has been associated with cLBP and may involve changes in neuronal gene expression. Epigenetic-induced changes such as DNA methylation (DNAm) have been associated with cLBP.In the present study, the relationship between CPM and DNAm changes in a sample of community-dwelling adults with nonspecific cLBP (nâ€‰=â€‰48) and pain-free controls (PFC; nâ€‰=â€‰50) was examined using reduced representation bisulfite sequencing. Gene ontology (GO) term enrichment and Kyoto Encyclopedia of Genes and Genomes (KEGG) pathway analysis were applied to identify key pathways involved in efficient versus deficient CPM.Based on CPM efficiency, we identified 6006 and 18,305 differentially methylated CpG sites (DMCs) with q valuesâ€‰<â€‰0.01 among individuals with cLBP and PFCs, respectively. Most of the DMCs were hypomethylated and annotated to genes of relevance to pain, including OPRM1, ADRB2, CACNA2D3, GNA12, LPL, NAXD, and ASPHD1. In both cLBP and PFC groups, the DMCs annotated genes enriched many GO terms relevant to pain processing, including transcription regulation by RNA polymerase II, nervous system development, generation of neurons, neuron differentiation, and neurogenesis. Both groups also enriched the pathways involved in Rap1-signaling, cancer, and dopaminergic neurogenesis. However, MAPK-Ras signaling pathways were enriched in the cLBP, not the PFC group.This is the first study to investigate the genome-scale DNA methylation profiles of CPM phenotype in adults with cLBP and PFCs. Based on CPM efficiency, fewer DMC enrichment pathways were unique to the cLBP than the PFCs group. Our results suggest that epigenetically induced modification of neuronal development/differentiation pathways may affect CPM efficiency, suggesting novel potential therapeutic targets for central sensitization. However, CPM efficiency and the experience of nonspecific cLBP may be independent. Further mechanistic studies are required to confirm the relationship between CPM, central sensitization, and nonspecific cLBP.Â© 2022. The Author(s)."
Yes,20220411,ewas,35328979,Prenatal Exposure to Traffic-Related Air Pollution and the DNA Methylation in Cord Blood Cells: MOCEH Study.,Int J Environ Res Public Health,"Particulate matter with a diameter of â‰¤10 Âµm (PM10) and nitrogen dioxide (NO2) affect the DNA methylation in the fetus, but epigenetic studies regarding prenatal exposure to air pollution in Asia are lacking. Therefore, this study aimed to assess whether there is any association between the ambient concentrations of PM10and NO2and CpG methylation in the cord blood DNA by using a Korean birth cohort. The concentrations of the air pollutants were incorporated into the final LUR model by using the maternal address data. The methylation level was determined using HumanMethylationEPIC BeadChip and a linear regression analysis model. A multipollutant model including both PM10and NO2and models with single pollutants were used for each trimester exposure. The number of differentially methylated positions was the largest for midpregnancy exposure in both the single pollutant models and the multipollutant regression analysis. Additionally, gene-set analysis regarding midpregnancy exposure revealed four gene ontology terms (cellular response to staurosporine, positive regulation of cytoskeleton organization, neurotransmitter transport, and execution phase of apoptosis). In conclusion, these findings show an association between prenatal PM10and NO2exposure and DNA methylation in several CpG sites in cord blood cells, especially for midpregnancy exposure."
No,20220411,imprinting,35296332,Trans-acting genetic variants causing multilocus imprinting disturbance (MLID): common mechanisms and consequences.,Clin Epigenetics,"Imprinting disorders are a group of congenital diseases which are characterized by molecular alterations affecting differentially methylated regions (DMRs). To date, at least twelve imprinting disorders have been defined with overlapping but variable clinical features including growth and metabolic disturbances, cognitive dysfunction, abdominal wall defects and asymmetry. In general, a single specific DMR is affected in an individual with a given imprinting disorder, but there are a growing number of reports on individuals with so-called multilocus imprinting disturbances (MLID), where aberrant imprinting marks (most commonly loss of methylation) occur at multiple DMRs. However, as the literature is fragmented, we reviewed the molecular and clinical data of 55 previously reported or newly identified MLID families with putative pathogenic variants in maternal effect genes (NLRP2, NLRP5, NLRP7, KHDC3L, OOEP, PADI6) and in other candidate genes (ZFP57, ARID4A, ZAR1, UHRF1, ZNF445).In 55 families, a total of 68 different candidate pathogenic variants were identified (7 in NLRP2, 16 in NLRP5, 7 in NLRP7, 17 in PADI6, 15 in ZFP57, and a single variant in each of the genes ARID4A, ZAR1, OOEP, UHRF1, KHDC3L and ZNF445). Clinical diagnoses of affected offspring included Beckwith-Wiedemann syndrome spectrum, Silver-Russell syndrome spectrum, transient neonatal diabetes mellitus, or they were suspected for an imprinting disorder (undiagnosed). Some families had recurrent pregnancy loss.Genomic maternal effect and foetal variants causing MLID allow insights into the mechanisms behind the imprinting cycle of life, and the spatial and temporal function of the different factors involved in oocyte maturation and early development. Further basic research together with identification of new MLID families will enable a better understanding of the link between the different reproductive issues such as recurrent miscarriages and preeclampsia in maternal effect variant carriers/families and aneuploidy and the MLID observed in the offsprings. The current knowledge can already be employed in reproductive and genetic counselling in specific situations.Â© 2022. The Author(s)."
No,20220411,metastable epialleles,35355955,Maternal tobacco smoke exposure is associated with increased DNA methylation at human metastable epialleles in infant cord blood.,Environ Epigenet,"Metastable epialleles (MEs) are genomic regions that are stochastically methylated prior to germ layer specification and exhibit high interindividual but low intra-individual variability across tissues. ME methylation is vulnerable to environmental stressors, including diet. Tobacco smoke (TS) exposure during pregnancy is associated with adverse impacts on fetal health and maternal micronutrient levels as well as altered methylation. Our objective was to determine if maternal smoke exposure impacts methylation at MEs. Consistent with prior studies, we observed reductions in one-carbon pathway micronutrients with gestational TS exposure, including maternal folate (Pâ€‰=â€‰0.02) and vitamins B6 (Pâ€‰=â€‰0.05) and B12 (Pâ€‰=â€‰0.007). We examined putative MEsBOLA3, PAX8,andZFYVE28in cord blood specimens from 85 Newborn Epigenetics STudy participants. Gestational TS exposure was associated with elevated DNA methylation atPAX8(+5.22% average methylation; 95% CI: 0.33% to 10.10%;Pâ€‰=â€‰0.037). In human conceptal kidney tissues, higherPAX8transcription was associated with lower methylation (Rsâ€‰=â€‰0.55;Pâ€‰=â€‰0.07), suggesting that the methylation levels established at MEs, and their environmentally induced perturbation, may have meaningful, tissue-specific functional consequences. This may be particularly important becausePAX8is implicated in several cancers, including pediatric kidney cancer. Our data are the first to indicate vulnerability of human ME methylation establishment to TS exposure, with a general trend of increasing levels of methylation at these loci. Further investigation is needed to determine how TS exposure-mediated changes in DNA methylation at MEs, and consequent expression levels, might affect smoking-related disease risk.Â© The Author(s) 2022. Published by Oxford University Press."
No,20220411,methods,35235458,Epigenetic MRI: Noninvasive imaging of DNA methylation in the brain.,Proc Natl Acad Sci U S A,"Significance Dynamic epigenetic activity is a fundamental mechanism underpinning how the brain changes its function during development and aging and in response to environmental and disease stimuli. We developed a technology called epigenetic MRI (eMRI) that enables noninvasive imaging of DNA methylation in the brain, a major epigenetic mechanism. eMRI reveals strong regional differences in global DNA methylation in pig brains, a model with stronger resemblance to human brains than are rodents. Given the noninvasive nature of eMRI, our results pave the way for a DNA-methylation imaging paradigm for living human brains. We expect eMRI to enable many studies to unravel the molecular control of brain function and disease."
No,20220411,methods,35361122,ENNGene: an Easy Neural Network model building tool for Genomics.,BMC Genomics,"The recent big data revolution in Genomics, coupled with the emergence of Deep Learning as a set of powerful machine learning methods, has shifted the standard practices of machine learning for Genomics. Even though Deep Learning methods such as Convolutional Neural Networks (CNNs) and Recurrent Neural Networks (RNNs) are becoming widespread in Genomics, developing and training such models is outside the ability of most researchers in the field.Here we present ENNGene-Easy Neural Network model building tool for Genomics. This tool simplifies training of custom CNN or hybrid CNN-RNN models on genomic data via an easy-to-use Graphical User Interface. ENNGene allows multiple input branches, including sequence, evolutionary conservation, and secondary structure, and performs all the necessary preprocessing steps, allowing simple input such as genomic coordinates. The network architecture is selected and fully customized by the user, from the number and types of the layers to each layer's precise set-up. ENNGene then deals with all steps of training and evaluation of the model, exporting valuable metrics such as multi-class ROC and precision-recall curve plots or TensorBoard log files. To facilitate interpretation of the predicted results, we deploy Integrated Gradients, providing the user with a graphical representation of an attribution level of each input position. To showcase the usage of ENNGene, we train multiple models on the RBP24 dataset, quickly reaching the state of the art while improving the performance on more than half of the proteins by including the evolutionary conservation score and tuning the network per protein.As the role of DL in big data analysis in the near future is indisputable, it is important to make it available for a broader range of researchers. We believe that an easy-to-use tool such as ENNGene can allow Genomics researchers without a background in Computational Sciences to harness the power of DL to gain better insights into and extract important information from the large amounts of data available in the field.Â© 2022. The Author(s)."
No,20220411,omics,2021.12.17.473125,Integration of public DNA methylation and expression networks via eQTMs improves prediction of functional gene–gene,biorxiv,"Gene co-expression networks can be used to infer functional relationships between genes, but they do not work well for all genes. We investigated whether DNA methylation can provide complementary information for such genes. We first carried out an eQTM meta-analysis of 3,574 gene expression and methylation samples from blood, brain and nasal epithelial brushed cells to identify links between methylated CpG sites and genes. This revealed 6,067 significant eQTM genes, and we observed that histone modification information is predictive of both eQTM direction and presence, enabling us to link many CpG sites to genes. We then generated a co-methylation network – MethylationNetwork – using 27,720 publicly available methylation profiles and integrated it with a public RNA-seq co-expression dataset of 31,499 samples. Here, we observed that MethylationNetwork can identify experimentally validated interacting pairs of genes that could not be identified in the RNA-seq datasets. We then developed a novel integration pipeline based on CCA and used the integrated methylation and gene networks to predict gene pairs reported in the STRING database. The integrated network showed significantly improved prediction performance compared to using a DNA co-methylation or a gene co-expression network alone. This is the first study to integrate data from two -omics layers from unmatched public samples across different tissues and diseases, and our results highlight the issues and potential of integrating public datasets from multiple molecular phenotypes. The eQTMs we identified can be used as an annotation resource for epigenome-wide association, and we believe that our integration pipeline can be used as a framework for future -omics integration analyses of public datasets.

We provide supporting materials and results, including the harmonized DNA methylation data from multiple tissues and diseases in https://data.harmjanwestra.nl/comethylation/, the discovered and predicted eQTMs, the corresponding CCA components and the trained prediction models in a Zenodo repository (https://zenodo.org/record/4666994). We provide notebooks to facilitate use of the proposed pipeline in a GitHub repository (https://github.com/molgenis/methylationnetwork)."
