"pmid","title","source","abstract"
"37035784","Membranome Similarity between Glioblastoma Multiforme Cell Lines and Primary Tumors.","OBM Neurobiol","Genes encoding for proteins associated with the plasma membrane, referred to as the membranome, have long been recognized to play an important role in the development and maintenance of glioblastoma multiforme (GBM). GBM cell lines are commonly used to mimic tumors forin vitroexperiments, but the extent to which they resemble GBM tumors in relation to the membranome is unclear. The present study explores the resemblance of GBM cell lines to primary tumors regarding membranome expression. Gene expression data was retrieved from Cancer Cell Line Encyclopedia (CCLE) and The Cancer Genome Atlas (TCGA). Membranomic genes were annotated and tumor purity was accounted for when correlating tumors and cell lines. The results suggest some commonly used cell lines, including AM38 and U87MG, display relatively little resemblance to tumors membranome. Differential gene expression analysis and subsequent gene set enrichment showed numerous genes related to neurexin/neuroligin, ion homeostasis, and synaptic signaling were downregulated in cell lines' membranomes compared to that of GBM tumors. The findings suggest that the membranome of GBM cell lines exhibit pronounced changes in gene expression compared to primary tumors and may not be completely representative of the disease process."
"37035245","Dual inhibition of EZH2 and G9A/GLP histone methyltransferases by HKMTI-1-005 promotes differentiation of acute myeloid leukemia cells.","Front Cell Dev Biol","All-trans-retinoic acid (ATRA)-based differentiation therapy of acute promyelocytic leukemia (APL) represents one of the most clinically effective examples of precision medicine and the first example of targeted oncoprotein degradation. The success of ATRA in APL, however, remains to be translated to non-APL acute myeloid leukemia (AML). We previously showed that aberrant histone modifications, including histone H3 lysine 4 (H3K4) and lysine 27 (H3K27) methylation, were associated with this lack of response and that epigenetic therapy with small molecule inhibitors of the H3K4 demethylase LSD1/KDM1A could reprogram AML cells to respond to ATRA. Serving as the enzymatic component of Polycomb Repressive Complex 2, EZH2/KMT6A methyltransferase plays a critical role in normal hematopoiesis by affecting the balance between self-renewal and differentiation. The canonical function of EZH2 is methylation of H3K27, although important non-canonical roles have recently been described. EZH2 mutation or deregulated expression has been conclusively demonstrated in the pathogenesis of AML and response to treatment, thus making it an attractive therapeutic target. In this study, we therefore investigated whether inhibition of EZH2 might also improve the response of non-APL AML cells to ATRA-based therapy. We focused on GSK-343, a pyridone-containing S-adenosyl-L-methionine cofactor-competitive EZH2 inhibitor that is representative of its class, and HKMTI-1-005, a substrate-competitive dual inhibitor targeting EZH2 and the closely related G9A/GLP H3K9 methyltransferases. We found that treatment with HKMTI-1-005 phenocopiedEZH2knockdown and was more effective in inducing differentiation than GSK-343, despite the efficacy of GSK-343 in terms of abolishing H3K27 trimethylation. Furthermore, transcriptomic analysis revealed that in contrast to treatment with GSK-343, HKMTI-1-005 upregulated the expression of differentiation pathway genes with and without ATRA, while downregulating genes associated with a hematopoietic stem cell phenotype. These results pointed to a non-canonical role for EZH2, which was supported by the finding that EZH2 associates with the master regulator of myeloid differentiation, RARα, in an ATRA-dependent manner that was enhanced by HKMTI-1-005, possibly playing a role in co-regulator complex exchange during transcriptional activation. In summary, our results strongly suggest that addition of HKMTI-1-005 to ATRA is a new therapeutic approach against AML that warrants further investigation.Copyright © 2023 Sbirkov, Schenk, Kwok, Stengel, Brown, Brown, Chesler, Zelent, Fuchter and Petrie."
"37034740","Replicative stress in gastroesophageal adenocarcinoma is associated with chromosomal instability and sensitivity to DNA damage response inhibitors.","bioRxiv","Gastroesophageal adenocarcinoma (GEA) is an aggressive, often lethal, malignancy that displays marked chromosomal instability (CIN). To understand adaptive responses that enable CIN, we analyzed paired normal, premalignant, and malignant gastric lesions from human specimens and a carcinogen-induced mouse model, observing activation of replication stress, DNA damage response (DDR), and cell cycle regulator p21 in neoplastic progression. In GEA cell lines, expression of DDR markers correlated with ploidy abnormalities, including high-level focal amplifications and whole-genome duplication (WGD). Moreover, high expression of DNA damage markerH2AXcorrelated with CIN, WGD, and inferior patient survival. By developing and implementing a composite diagnostic score that incorporatesTP53mutation status, ploidy abnormalities, andH2AXexpression, among other genomic information, we can identify GEA cell lines with enhanced sensitivity to DDR pathway inhibitors targeting Chk1/2 and Wee1. Anti-tumor properties were further augmented in combination with irinotecan (SN38) but not gemcitabine chemotherapy. These results implicate specific DDR biomarkers and ploidy abnormalities as diagnostic proxy that may predict premalignant progression and response to DDR pathway inhibitors."
"37033467","Federated learning framework integrating REFINED CNN and Deep Regression Forests.","Bioinform Adv","Predictive learning from medical data incurs additional challenge due to concerns over privacy and security of personal data. Federated learning, intentionally structured to preserve high level of privacy, is emerging to be an attractive way to generate cross-silo predictions in medical scenarios. However, the impact of severe population-level heterogeneity on federated learners is not well explored. In this article, we propose a methodology to detect presence of population heterogeneity in federated settings and propose a solution to handle such heterogeneity by developing a federated version of Deep Regression Forests. Additionally, we demonstrate that the recently conceptualized REpresentation of Features as Images with NEighborhood Dependencies CNN framework can be combined with the proposed Federated Deep Regression Forests to provide improved performance as compared to existing approaches.The Python source code for reproducing the main results are available on GitHub: https://github.com/DanielNolte/FederatedDeepRegressionForests.ranadip.pal@ttu.edu.Supplementary data are available atBioinformatics Advancesonline.© The Author(s) 2023. Published by Oxford University Press."
"37020040","ROS-mediated SRMS activation confers platinum resistance in ovarian cancer.","Oncogene","Ovarian cancer is the leading cause of death among gynecological malignancies. Checkpoint blockade immunotherapy has so far only shown modest efficacy in ovarian cancer and platinum-based chemotherapy remains the front-line treatment. Development of platinum resistance is one of the most important factors contributing to ovarian cancer recurrence and mortality. Through kinome-wide synthetic lethal RNAi screening combined with unbiased datamining of cell line platinum response in CCLE and GDSC databases, here we report that Src-Related Kinase Lacking C-Terminal Regulatory Tyrosine And N-Terminal Myristylation Sites (SRMS), a non-receptor tyrosine kinase, is a novel negative regulator of MKK4-JNK signaling under platinum treatment and plays an important role in dictating platinum efficacy in ovarian cancer. Suppressing SRMS specifically sensitizes p53-deficient ovarian cancer cells to platinum in vitro and in vivo. Mechanistically, SRMS serves as a ""sensor"" for platinum-induced ROS. Platinum treatment-induced ROS activates SRMS, which inhibits MKK4 kinase activity by directly phosphorylating MKK4 at Y269 and Y307, and consequently attenuates MKK4-JNK activation. Suppressing SRMS leads to enhanced MKK4-JNK-mediated apoptosis by inhibiting MCL1 transcription, thereby boosting platinum efficacy. Importantly, through a ""drug repurposing"" strategy, we uncovered that PLX4720, a small molecular selective inhibitor of B-RafV600E, is a novel SRMS inhibitor that can potently boost platinum efficacy in ovarian cancer in vitro and in vivo. Therefore, targeting SRMS with PLX4720 holds the promise to improve the efficacy of platinum-based chemotherapy and overcome chemoresistance in ovarian cancer.© 2023. The Author(s), under exclusive licence to Springer Nature Limited."
"37013003","Integration of pharmacoproteomic and computational approaches reveals the cellular signal transduction pathways affected by apatinib in gastric cancer cell lines.","Comput Struct Biotechnol J","Apatinib is known to be a highly selective vascular endothelial growth factor receptor 2 (VEGFR2) inhibitor with anti-angiogenic and anti-tumor properties. In a phase III study, the objective response rate to apatinib was low. It remains unclear why the effectivity of apatinib varies among patients and what type of patients are candidates for the treatment. In this study, we investigated the anti-tumor efficacy of apatinib against 13 gastric cancer cell lines and found that it differed depending on the cell line. Using integrated wet and dry approaches, we showed that apatinib was a multi-kinase inhibitor of c-Kit, RAF1, VEGFR1, VEGFR2, and VEGFR3, predominantly inhibiting c-Kit. Notably, KATO-III, which was the most apatinib-sensitive among the gastric cancer cell lines investigated, was the only cell line expressing c-Kit, RAF1, VEGFR1, and VEGFR3 but not VEGFR2. Furthermore, we identified SNW1 as a molecule affected by apatinib that plays an important role in cell survival. Finally, we identified the molecular network related to SNW1 that was affected by treatment with apatinib. These results suggest that the mechanism of action of apatinib in KATO-III cells is independent of VEGFR2 and that the differential efficacy of apatinib was due to differences in expression patterns of receptor tyrosine kinases. Furthermore, our results suggest that the differential efficacy of apatinib in gastric cell lines may be attributed to SNW1 phosphorylation levels at a steady state. These findings contribute to a deeper understanding of the mechanism of action of apatinib in gastric cancer cells.© 2023 The Author(s)."
"36993718","Ras-dependent activation of BMAL2 regulates hypoxic metabolism in pancreatic cancer.","bioRxiv","To identify novel drivers of malignancy in pancreatic ductal adenocarcinoma (PDAC), we employed regulatory network analysis, which calculates the activity of transcription factors and other regulatory proteins based on the integrated expression of their positive and negative target genes. We generated a regulatory network for the malignant epithelial cells of human PDAC using gene expression data from a set of 197 laser capture microdissected human PDAC samples and 45 low-grade precursors, for which we had matched histopathological, clinical, and epidemiological annotation. We then identified the most highly activated and repressed regulatory proteins (e.g. master regulators or MRs) associated with four malignancy phenotypes: precursors vs. PDAC (initiation), low-grade vs. high grade histopathology (progression), survival post resection, and association with KRAS activity. Integrating across these phenotypes, the top MR of PDAC malignancy was found to be BMAL2, a member of the PAS family of bHLH transcription factors. Although the canonical function of BMAL2 is linked to the circadian rhythm protein CLOCK, annotation of BMAL2 target genes highlighted a potential role in hypoxia response. We previously demonstrated that PDAC is hypovascularized and hypoperfused, and here show that PDAC from the genetically engineered KPC model exists in a state of extreme hypoxia, with a partial oxygen pressure of <1mmHg. Given the close homology of BMAL2 to HIF1β (ARNT) and its potential to heterodimerize with HIF1A and HIF2A, we investigated whether BMAL2 plays a role in the hypoxic response of PDAC. Indeed, BMAL2 controlled numerous hypoxia response genes and could be inhibited following treatment with multiple RAF, MEK, and ERK inhibitors, validating its association with RAS activity. Knockout of BMAL2 in four human PDAC cell lines led to defects in growth and invasion in the setting of hypoxia. Strikingly, BMAL2 null cells failed to induce glycolysis upon exposure to severe hypoxia and this was associated with a loss of expression of the glycolytic enzyme LDHA. Moreover, HIF1A was no longer stabilized under hypoxia in BMAL2 knockout cells. By contrast, HIF2A was hyper-stabilized under hypoxia, indicating a dysregulation of hypoxia metabolism in response to BMAL2 loss. We conclude that BMAL2 is a master regulator of hypoxic metabolism in PDAC, serving as a molecular switch between the disparate metabolic roles of HIF1A- and HIF2A-dependent hypoxia responses.There is a surprising disconnect between the genomic alterations present in pancreatic ductal adenocarcinoma and key phenotypes of malignancy, suggesting that non-genetic factors must play a role. Here we analyze changes in regulatory state - calculated from network analysis of RNA expression data - to identify transcription factors and other regulatory proteins whose activities drive pancreatic cancer malignancy. We identified the top candidate, BMAL2, as a novel, KRAS-responsive regulator of hypoxic response in pancreatic cancer, serving as a switch between HIF1A and HIF2A expression. These data help explain how KRAS coordinates cell regulatory state to enable tumor cells to survive extreme hypoxia, and highlight the ability of regulatory network analysis to identify overlooked, key drivers of biological phenotypes."
"36993432","NOMAD2 provides ultra-efficient, scalable, and unsupervised discovery on raw sequencing reads.","bioRxiv","NOMAD is a new, unsupervised, reference-free, and unifying algorithm that discovers regulated sequence variation through statistical analysis ofk-mer composition in DNA or RNA sequencing experiments. It subsumes many application-specific algorithms, from splicing detection to RNA editing to applications in DNA-sequencing and beyond. Here, we introduce NOMAD2, a fast, scalable, and user-friendly implementation of NOMAD based on KMC, an efficient k-mer counting approach. The pipeline has minimal installation requirements, and can be executed with a single command. NOMAD2 enables efficient analysis of massive RNA-Seq datasets where it reveals novel biology, showcased by rapid analysis of 1,553 human muscle cells, the entire Cancer Cell Line Encyclopedia (671 cell lines, 5.7 TB) and a deep RNAseq study of Amyotrophic Lateral Sclerosis (ALS) with âˆ¼2 fold less computational resource and time than state of the art alignment methods. NOMAD2 enables reference-free biological discovery at unmatched scale and speed. By bypassing genome alignment, we provide examples of its new insights into RNA expression in normal and disease tissue, to introduce NOMAD2 to enable expansive biological discovery not previously possible."
"36952569","A systematic evaluation of deep learning methods for the prediction of drug synergy in cancer.","PLoS Comput Biol","One of the main obstacles to the successful treatment of cancer is the phenomenon of drug resistance. A common strategy to overcome resistance is the use of combination therapies. However, the space of possibilities is huge and efficient search strategies are required. Machine Learning (ML) can be a useful tool for the discovery of novel, clinically relevant anti-cancer drug combinations. In particular, deep learning (DL) has become a popular choice for modeling drug combination effects. Here, we set out to examine the impact of different methodological choices on the performance of multimodal DL-based drug synergy prediction methods, including the use of different input data types, preprocessing steps and model architectures. Focusing on the NCI ALMANAC dataset, we found that feature selection based on prior biological knowledge has a positive impact-limiting gene expression data to cancer or drug response-specific genes improved performance. Drug features appeared to be more predictive of drug response, with a 41% increase in coefficient of determination (R2) and 26% increase in Spearman correlation relative to a baseline model that used only cell line and drug identifiers. Molecular fingerprint-based drug representations performed slightly better than learned representations-ECFP4 fingerprints increased R2 by 5.3% and Spearman correlation by 2.8% w.r.t the best learned representations. In general, fully connected feature-encoding subnetworks outperformed other architectures. DL outperformed other ML methods by more than 35% (R2) and 14% (Spearman). Additionally, an ensemble combining the top DL and ML models improved performance by about 6.5% (R2) and 4% (Spearman). Using a state-of-the-art interpretability method, we showed that DL models can learn to associate drug and cell line features with drug response in a biologically meaningful way. The strategies explored in this study will help to improve the development of computational methods for the rational design of effective drug combinations for cancer therapy.Copyright: © 2023 Baptista et al. This is an open access article distributed under the terms of the Creative Commons Attribution License, which permits unrestricted use, distribution, and reproduction in any medium, provided the original author and source are credited."
"36916735","Prediction and curation of missing biomedical identifier mappings with Biomappings.","Bioinformatics","Biomedical identifier resources (such as ontologies, taxonomies, and controlled vocabularies) commonly overlap in scope and contain equivalent entries under different identifiers. Maintaining mappings between these entries is crucial for interoperability and the integration of data and knowledge. However, there are substantial gaps in available mappings motivating their semi-automated curation.Biomappings implements a curation workflow for missing mappings which combines automated prediction with human-in-the-loop curation. It supports multiple prediction approaches and provides a web-based user interface for reviewing predicted mappings for correctness, combined with automated consistency checking. Predicted and curated mappings are made available in public, version-controlled resource files on GitHub. Biomappings currently makes available 9274 curated mappings and 40 691 predicted ones, providing previously missing mappings between widely used identifier resources covering small molecules, cell lines, diseases, and other concepts. We demonstrate the value of Biomappings on case studies involving predicting and curating missing mappings among cancer cell lines as well as small molecules tested in clinical trials. We also present how previously missing mappings curated using Biomappings were contributed back to multiple widely used community ontologies.The data and code are available under the CC0 and MIT licenses at https://github.com/biopragmatics/biomappings.© The Author(s) 2023. Published by Oxford University Press."
"37064175","Association between CORIN promoter methylation and stroke: Results from two independent samples of Chinese adults.","Front Neurol","As the physical activator of natriuretic peptides, corin has been associated with stroke, but the underlying mechanism is not very clear. Here, we examined whether theCORINpromoter's methylation, an epigenetic DNA modification, was associated with the risk of stroke in two independent samples.A total of 1771 participants including 853 stroke cases and 918 healthy controls were included as a discovery sample and 2,498 community members with 10 years of follow-up were included as a replication sample. DNA methylation of theCORINpromoter was quantified by target bisulfite sequencing in both samples. We first examined the single CpG association, followed by a gene-based analysis of the joint association between multiple CpG methylation and stroke, adjusting for conventional risk factors.The single CpG association analysis found that hypermethylation at all of the 9 CpG sites assayed was significantly associated with lower odds of prevalent stroke in the discovery sample (allp < 0.05), and three of them located at Chr4:47840038 (HR = 0.74,p = 0.015), Chr4:47839941 (HR = 0.80,p = 0.047), and Chr4:47839933 (HR = 0.82,p = 0.050) were also significantly associated with incident stroke in the replication sample. The gene-based association analysis found that DNA methylation of the 9 CpG sites at theCORINpromoter was jointly associated with stroke in both samples (allp < 0.05).DNA methylation levels of theCORINgene promoter were lower in stroke patients and predicted a higher risk of incident stroke in Chinese adults. The underlying causality warranted further investigation.Copyright © 2023 Chen, Jiang, Yao, Lu, Zhang, Zhang, Zhang and Peng."
"36993393","HIV-1 Vpr combats the PU.1-driven antiviral response in primary human macrophages.","bioRxiv","The HIV-1 accessory protein, Vpr, is an enigmatic protein required for efficient spread of HIV from macrophages to T cells, a necessary step for propagation of infection. To illuminate the role of Vpr in HIV-infection of primary macrophages, we used single-cell RNA sequencing to capture the transcriptional changes during an HIV-1 spreading infection plus and minus Vpr. We found that Vpr reprogramed HIV-infected macrophage gene expression by targeting the master transcriptional regulator, PU.1. PU.1 was required for efficient induction of the host innate immune response to HIV, including upregulation ofISG15,LY96,andIFI6. In contrast, we did not observe direct effects of PU.1 on HIV gene transcription. Single cell gene expression analysis also revealed Vpr countered an innate immune response to HIV-infection within bystander macrophages via a PU.1-independent mechanism. The capacity of Vpr to target PU.1 and disrupt the anti-viral response was highly conserved across primate lentiviruses including HIV-2 and several SIVs. By demonstrating how Vpr overcomes a critical early warning system of infection, we identify a crucial reason why Vpr is necessary for HIV infection and spread."
"36993284","scMultiSim: simulation of multi-modality single cell data guided by cell-cell interactions and gene regulatory networks.","Res Sq","Simulated single-cell data is essential for designing and evaluating computational methods in the absence of experimental ground truth. Existing simulators typically focus on modeling one or two specific biological factors or mechanisms that affect the output data, which limits their capacity to simulate the complexity and multi-modality in real data. Here, we present scMultiSim, an in silico simulator that generates multi-modal single-cell data, including gene expression, chromatin accessibility, RNA velocity, and spatial cell locations while accounting for the relationships between modalities. scMultiSim jointly models various biological factors that affect the output data, including cell identity, within-cell gene regulatory networks (GRNs), cell-cell interactions (CCIs), and chromatin accessibility, while also incorporating technical noises. Moreover, it allows users to adjust each factor's effect easily. We validated scMultiSimâ€™s simulated biological effects and demonstrated its applications by benchmarking a wide range of computational tasks, including cell clustering and trajectory inference, multi-modal and multi-batch data integration, RNA velocity estimation, GRN inference and CCI inference using spatially resolved gene expression data. Compared to existing simulators, scMultiSim can benchmark a much broader range of existing computational problems and even new potential tasks."
