who,EC,date,type,pmid,title,source,abstract
Sarah,No,20230427,dnamage,34951641,Associations Between Life-Course Socioeconomic Conditions and the Pace of Aging,J Gerontol A Biol Sci Med Sci,"Background: Socioeconomic disadvantage is a well-established predictor of morbidity and mortality, and is thought to accelerate the aging process. This study examined associations between life-course socioeconomic conditions and the Pace of Aging, a longitudinal measure of age-related physiological decline.

Methods: Data were drawn from a Swiss population-based cohort of individuals originally recruited between 2003 and 2006, and followed up for 11 years (2 834 women, 2 475 men aged 35-75 years [mean 52]). Pace of Aging was measured using 3 repeated assessments of 12 biomarkers reflecting multiple body systems. Analysis tested associations of socioeconomic conditions with physiological status at baseline and with the Pace of Aging.

Results: Participants with more life-course socioeconomic disadvantage were physiologically older at baseline and experienced faster Pace of Aging. Effect sizes (?) for associations of childhood socioeconomic disadvantage with baseline physiological status ranged from 0.1 to 0.2; for adulthood socioeconomic disadvantage, effect sizes ranged from 0.2 to 0.3. Effect sizes were smaller for associations with the Pace of Aging (<0.05 for childhood disadvantage, 0.05-0.1 for adulthood disadvantage). Those who experienced disadvantaged socioeconomic conditions from childhood to adulthood aged 10% faster over the 11 years of follow-up as compared with those who experienced consistently advantaged socioeconomic conditions. Covariate adjustment for health behaviors attenuated associations, but most remained statistically significant.

Conclusions: Socioeconomic inequalities contribute to a faster Pace of Aging, partly through differences in health behaviors. Intervention to slow aging in at-risk individuals is needed by midlife, before etiology of aging-related diseases become established."
Ryan,No,20230427,ctdna,37055640,Tracking early lung cancer metastatic dissemination in TRACERx using ctDNA.,Nature,"Circulating tumour DNA (ctDNA) can be used to detect and profile residual tumour cells persisting after curative intent therapy1. The study of large patient cohorts incorporating longitudinal plasma sampling and extended follow-up is required to determine the role of ctDNA as a phylogenetic biomarker of relapse in early-stage non-small-cell lung cancer (NSCLC). Here we developed ctDNA methods tracking a median of 200 mutations identified in resected NSCLC tissue across 1,069 plasma samples collected from 197 patients enrolled in the TRACERx study2. A lack of preoperative ctDNA detection distinguished biologically indolent lung adenocarcinoma with good clinical outcome. Postoperative plasma analyses were interpreted within the context of standard-of-care radiological surveillance and administration of cytotoxic adjuvant therapy. Landmark analyses of plasma samples collected within 120 days after surgery revealed ctDNA detection in 25% of patients, including 49% of all patients who experienced clinical relapse; 3 to 6 monthly ctDNA surveillance identified impending disease relapse in an additional 20% of landmark-negative patients. We developed a bioinformatic tool (ECLIPSE) for non-invasive tracking of subclonal architecture at low ctDNA levels. ECLIPSE identified patients with polyclonal metastatic dissemination, which was associated with a poor clinical outcome. By measuring subclone cancer cell fractions in preoperative plasma, we found that subclones seeding future metastases were significantly more expanded compared with non-metastatic subclones. Our findings will support (neo)adjuvant trial advances and provide insights into the process of metastatic dissemination using low-ctDNA-level liquid biopsy.© 2023. The Author(s)."
?,No,20230427,aging,37046086,Ageing-associated changes in transcriptional elongation influence longevity,Nature,"Physiological homeostasis becomes compromised during ageing, as a result of impairment of cellular processes, including transcription and RNA splicing1-4. However, the molecular mechanisms leading to the loss of transcriptional fidelity are so far elusive, as are ways of preventing it. Here we profiled and analysed genome-wide, ageing-related changes in transcriptional processes across different organisms: nematodes, fruitflies, mice, rats and humans. The average transcriptional elongation speed (RNA polymerase II speed) increased with age in all five species. Along with these changes in elongation speed, we observed changes in splicing, including a reduction of unspliced transcripts and the formation of more circular RNAs. Two lifespan-extending interventions, dietary restriction and lowered insulin-IGF signalling, both reversed most of these ageing-related changes. Genetic variants in RNA polymerase II that reduced its speed in worms5 and flies6 increased their lifespan. Similarly, reducing the speed of RNA polymerase II by overexpressing histone components, to counter age-associated changes in nucleosome positioning, also extended lifespan in flies and the division potential of human cells. Our findings uncover fundamental molecular mechanisms underlying animal ageing and lifespan-extending interventions, and point to possible preventive measures."
?,No,20230427,methods,36747096,Simultaneous sequencing of genetic and epigenetic bases in DNA,Nat Biotechnol,"DNA comprises molecular information stored in genetic and epigenetic bases, both of which are vital to our understanding of biology. Most DNA sequencing approaches address either genetics or epigenetics and thus capture incomplete information. Methods widely used to detect epigenetic DNA bases fail to capture common C-to-T mutations or distinguish 5-methylcytosine from 5-hydroxymethylcytosine. We present a single base-resolution sequencing methodology that sequences complete genetics and the two most common cytosine modifications in a single workflow. DNA is copied and bases are enzymatically converted. Coupled decoding of bases across the original and copy strand provides a phased digital readout. Methods are demonstrated on human genomic DNA and cell-free DNA from a blood sample of a patient with cancer. The approach is accurate, requires low DNA input and has a simple workflow and analysis pipeline. Simultaneous, phased reading of genetic and epigenetic bases provides a more complete picture of the information stored in genomes and has applications throughout biomedicine."
