"pmid","title","source","abstract"
"37065763","Effects of assisted reproductive technology on gene expression in heart and spleen tissues of adult offspring mouse.","Front Endocrinol (Lausanne)","Assisted reproductive technology (ART) is an important part of reproductive medicine, whose possible effects on offspring's health have drawn widespread attention in recent years. However, relevant studies are limited to postnatal short-term follow-up and lack of diverse sample sources analysis other than blood.In this study, a mouse model was used to explore the effects of ART on fetal development and gene expression in the organs of offspring in the adulthood using next-generation sequencing. The sequencing results were then analyzed.The results showed that it caused abnormal expression in 1060 genes and 179 genes in the heart and spleen, respectively. Differentially expressed genes (DEGs) in the heart are mainly enriched in RNA synthesis and processing, and the cardiovascular system development also shows enrichment. STRING analysis identifiedCcl2, Ptgs2, Rock1, Mapk14, Agt, andWnt5aas the core interacting factors. DEGs in the spleen are significantly enriched in anti-infection and immune responses, which include the core factorsFos, JunandIl1r2. Further exploration revealed the abnormal expression of 42 and 5 epigenetic modifiers in the heart and spleen, respectively. The expression of the imprinted genesDhcr7, Igf2, MestandSmoc1decreased in the hearts of ART offspring, and the DNA methylation levels ofIgf2-andMest-imprinting control regions (ICRs) increased abnormally.In the mouse model, ART can interfere with the gene expression pattern in the heart and spleen of the adult offspring and that these changes are related to the aberrant expression of epigenetic regulators.Copyright © 2023 Chen, Zhang, Yue, Cui, Li, Zhang, Liang, Meng and Zhang."
"37024927","Flexible and efficient handling of nanopore sequencing signal data with slow5tools.","Genome Biol","Nanopore sequencing is being rapidly adopted in genomics. We recently developed SLOW5, a new file format with advantages for storage and analysis of raw signal data from nanopore experiments. Here we introduce slow5tools, an intuitive toolkit for handling nanopore data in SLOW5 format. Slow5tools enables lossless data conversion and a range of tools for interacting with SLOW5 files. Slow5tools uses multi-threading, multi-processing, and other engineering strategies to achieve fast data conversion and manipulation, including live FAST5-to-SLOW5 conversion during sequencing. We provide examples and benchmarking experiments to illustrate slow5tools usage, and describe the engineering principles underpinning its performance.© 2023. The Author(s)."
"37064330","Transcriptional memory of dFOXO activation in youth curtails later-life mortality through chromatin remodelling and Xbp1.","Nat Aging","A transient, homeostatic transcriptional response can result in transcriptional memory, programming subsequent transcriptional outputs. Transcriptional memory has great but unappreciated potential to alter animal ageing as animals encounter a multitude of diverse stimuli throughout their lifespan. Here we show that activating an evolutionarily conserved, longevity-promoting transcription factor, dFOXO, solely in early adulthood of female fruit flies is sufficient to improve their subsequent health and survival in mid- and late life. This youth-restricted dFOXO activation causes persistent changes to chromatin landscape in the fat body and requires chromatin remodellers such as the SWI/SNF and ISWI complexes to program health and longevity. Chromatin remodelling is accompanied by a long-lasting transcriptional programme that is distinct from that observed during acute dFOXO activation and includes induction ofXbp1.We show that this later-life induction ofXbp1is sufficient to curtail later-life mortality. Our study demonstrates that transcriptional memory can profoundly alter how animals age."
"37048071","Rejuvenation of Mesenchymal Stem Cells to Ameliorate Skeletal Aging.","Cells","Advanced age is a shared risk factor for many chronic and debilitating skeletal diseases including osteoporosis and periodontitis. Mesenchymal stem cells develop various aging phenotypes including the onset of senescence, intrinsic loss of regenerative potential and exacerbation of inflammatory microenvironment via secretory factors. This review elaborates on the emerging concepts on the molecular and epigenetic mechanisms of MSC senescence, such as the accumulation of oxidative stress, DNA damage and mitochondrial dysfunction. Senescent MSCs aggravate local inflammation, disrupt bone remodeling and bone-fat balance, thereby contributing to the progression of age-related bone diseases. Various rejuvenation strategies to target senescent MSCs could present a promising paradigm to restore skeletal aging."
"37020120","Proteome alterations in human autopsy tissues in relation to time after death.","Cell Mol Life Sci","Protein expression is a primary area of interest for routine histological diagnostics and tissue-based research projects, but the limitations of its post-mortem applicability remain largely unclear. On the other hand, tissue specimens obtained during autopsies can provide unique insight into advanced disease states, especially in cancer research. Therefore, we aimed to identify the maximum post-mortem interval (PMI) which is still suitable for characterizing protein expression patterns, to explore organ-specific differences in protein degradation, and to investigate whether certain proteins follow specific degradation kinetics. Therefore, the proteome of human tissue samples obtained during routine autopsies of deceased patients with accurate PMI (6, 12, 18, 24, 48, 72, 96 h) and without specific diseases that significantly affect tissue preservation, from lungs, kidneys and livers, was analyzed by liquid chromatography-tandem mass spectrometry (LC-MS/MS). For the kidney and liver, significant protein degradation became apparent at 48 h. For the lung, the proteome composition was rather static for up to 48 h and substantial protein degradation was detected only at 72 h suggesting that degradation kinetics appear to be organ specific. More detailed analyses suggested that proteins with similar post-mortem kinetics are not primarily shared in their biological functions. The overrepresentation of protein families with analogous structural motifs in the kidney indicates that structural features may be a common factor in determining similar postmortem stability. Our study demonstrates that a longer post-mortem period may have a significant impact on proteome composition, but sampling within 24 h may be appropriate, as degradation is within acceptable limits even in organs with faster autolysis.© 2023. The Author(s)."
"36985286","Should We Expect an Increase in the Number of Cancer Cases in People with Long COVID?","Microorganisms","The relationship between viral infections and the risk of developing cancer is well known. Multiple mechanisms participate in and determine this process. The COVID-19 pandemic caused by the SARS-CoV-2 virus has resulted in the deaths of millions of people worldwide. Although the effects of COVID-19 are limited for most people, a large number of people continue to show symptoms for a long period of time (long COVID). Several studies have suggested that cancer could also be a potential long-term complication of the virus; however, the causes of this risk are not yet well understood. In this review, we investigated arguments that could support or reject this possibility."
"37047309","Genetic Evidence for Endolysosomal Dysfunction in Parkinson's Disease: A Critical Overview.","Int J Mol Sci","Parkinson's disease (PD) is the second most common neurodegenerative disorder in the aging population, and no disease-modifying therapy has been approved to date. The pathogenesis of PD has been related to many dysfunctional cellular mechanisms, however, most of its monogenic forms are caused by pathogenic variants in genes involved in endolysosomal function (LRRK2,VPS35,VPS13C, andATP13A2) and synaptic vesicle trafficking (SNCA,RAB39B,SYNJ1, andDNAJC6). Moreover, an extensive search for PD risk variants revealed strong risk variants in several lysosomal genes (e.g.,GBA1,SMPD1,TMEM175, andSCARB2) highlighting the key role of lysosomal dysfunction in PD pathogenesis. Furthermore, large genetic studies revealed that PD status is associated with the overall ""lysosomal genetic burden"", namely the cumulative effect of strong and weak risk variants affecting lysosomal genes. In this context, understanding the complex mechanisms of impaired vesicular trafficking and dysfunctional endolysosomes in dopaminergic neurons of PD patients is a fundamental step to identifying precise therapeutic targets and developing effective drugs to modify the neurodegenerative process in PD."
"37045857","Characterization of genome-wide STR variation in 6487 human genomes.","Nat Commun","Short tandem repeats (STRs) are abundant and highly mutagenic in the human genome. Many STR loci have been associated with a range of human genetic disorders. However, most population-scale studies on STR variation in humans have focused on European ancestry cohorts or are limited by sequencing depth. Here, we depicted a comprehensive map of 366,013 polymorphic STRs (pSTRs) constructed from 6487 deeply sequenced genomes, comprising 3983 Chinese samples (~31.5x, NyuWa) and 2504 samples from the 1000 Genomes Project (~33.3x, 1KGP). We found that STR mutations were affected by motif length, chromosome context and epigenetic features. We identified 3273 and 1117 pSTRs whose repeat numbers were associated with gene expression and 3'UTR alternative polyadenylation, respectively. We also implemented population analysis, investigated population differentiated signatures, and genotyped 60 known disease-causing STRs. Overall, this study further extends the scale of STR variation in humans and propels our understanding of the semantics of STRs.© 2023. The Author(s)."
"37034151","Advances and potential of omics studies for understanding the development of food allergy.","Front Allergy","The prevalence of food allergy continues to rise globally, carrying with it substantial safety, economic, and emotional burdens. Although preventative strategies do exist, the heterogeneity of allergy trajectories and clinical phenotypes has made it difficult to identify patients who would benefit from these strategies. Therefore, further studies investigating the molecular mechanisms that differentiate these trajectories are needed. Large-scale omics studies have identified key insights into the molecular mechanisms for many different diseases, however the application of these technologies to uncover the drivers of food allergy development is in its infancy. Here we review the use of omics approaches in food allergy and highlight key gaps in knowledge for applying these technologies for the characterization of food allergy development.© 2023 Sindher, Chin, Aghaeepour, Prince, Maecker, Shaw, Stevenson, Nadeau, Snyder, Khatri, Boyd, Winn, Angst and Chinthrajah."
"37041327","Cloning by SCNT: Integrating Technical and Biology-Driven Advances.","Methods Mol Biol","Somatic cell nuclear transfer (SCNT) into enucleated oocytes initiates nuclear reprogramming of lineage-committed cells to totipotency. Pioneer SCNT work culminated with cloned amphibians from tadpoles, while technical and biology-driven advances led to cloned mammals from adult animals. Cloning technology has been addressing fundamental questions in biology, propagating desired genomes, and contributing to the generation of transgenic animals or patient-specific stem cells. Nonetheless, SCNT remains technically complex and cloning efficiency relatively low. Genome-wide technologies revealed barriers to nuclear reprogramming, such as persistent epigenetic marks of somatic origin and reprogramming resistant regions of the genome. To decipher the rare reprogramming events that are compatible with full-term cloned development, it will likely require technical advances for large-scale production of SCNT embryos alongside extensive profiling by single-cell multi-omics. Altogether, cloning by SCNT remains a versatile technology, while further advances should continuously refresh the excitement of its applications.© 2023. The Author(s), under exclusive license to Springer Science+Business Media, LLC, part of Springer Nature."
"37021042","Precision sirolimus dosing in children: The potential for model-informed dosing and novel drug monitoring.","Front Pharmacol","The mTOR inhibitor sirolimus is prescribed to treat children with varying diseases, ranging from vascular anomalies to sporadic lymphangioleiomyomatosis to transplantation (solid organ or hematopoietic cell). Precision dosing of sirolimus using therapeutic drug monitoring (TDM) of sirolimus concentrations in whole blood drawn at the trough (before the next dose) time-point is the current standard of care. For sirolimus, trough concentrations are only modestly correlated with the area under the curve, withR2values ranging from 0.52 to 0.84. Thus, it should not be surprising, even with the use of sirolimus TDM, that patients treated with sirolimus have variable pharmacokinetics, toxicity, and effectiveness. Model-informed precision dosing (MIPD) will be beneficial and should be implemented. The data do not suggest dried blood spots point-of-care sampling of sirolimus concentrations for precision dosing of sirolimus. Future research on precision dosing of sirolimus should focus on pharmacogenomic and pharmacometabolomic tools to predict sirolimus pharmacokinetics and wearables for point-of-care quantitation and MIPD.Copyright © 2023 Shen, Moua, Perkins, Johnson, Li, Curtin, Gao and McCune."
"37041195","Engineered CRISPR-OsCas12f1 and RhCas12f1 with robust activities and expanded target range for genome editing.","Nat Commun","The type V-F CRISPR-Cas12f system is a strong candidate for therapeutic applications due to the compact size of the Cas12f proteins. In this work, we identify six uncharacterized Cas12f1 proteins with nuclease activity in mammalian cells from assembled bacterial genomes. Among them, OsCas12f1 (433 aa) from Oscillibacter sp. and RhCas12f1 (415 aa) from Ruminiclostridium herbifermentans, which respectively target 5' T-rich Protospacer Adjacent Motifs (PAMs) and 5' C-rich PAMs, show the highest editing activity. Through protein and sgRNA engineering, we generate enhanced OsCas12f1 (enOsCas12f1) and enRhCas12f1 variants, with 5'-TTN and 5'-CCD (D = not C) PAMs respectively, exhibiting much higher editing efficiency and broader PAMs, compared with the engineered variant Un1Cas12f1 (Un1Cas12f1_ge4.1). Furthermore, by fusing the destabilized domain with enOsCas12f1, we generate inducible-enOsCas12f1 and demonstate its activity in vivo by single adeno-associated virus delivery. Finally, dead enOsCas12f1-based epigenetic editing and gene activation can also be achieved in mammalian cells. This study thus provides compact gene editing tools for basic research with remarkable promise for therapeutic applications.© 2023. The Author(s)."
"37027099","Recent advances in therapeutic CRISPR-Cas9 genome editing: mechanisms and applications.","Mol Biomed","Recently, clustered regularly interspaced palindromic repeats (CRISPR)-Cas9 derived editing tools had significantly improved our ability to make desired changes in the genome. Wild-type Cas9 protein recognizes the target genomic loci and induced local double strand breaks (DSBs) in the guidance of small RNA molecule. In mammalian cells, the DSBs are mainly repaired by endogenous non-homologous end joining (NHEJ) pathway, which is error prone and results in the formation of indels. The indels can be harnessed to interrupt gene coding sequences or regulation elements. The DSBs can also be fixed by homology directed repair (HDR) pathway to introduce desired changes, such as base substitution and fragment insertion, when proper donor templates are provided, albeit in a less efficient manner. Besides making DSBs, Cas9 protein can be mutated to serve as a DNA binding platform to recruit functional modulators to the target loci, performing local transcriptional regulation, epigenetic remolding, base editing or prime editing. These Cas9 derived editing tools, especially base editors and prime editors, can introduce precise changes into the target loci at a single-base resolution and in an efficient and irreversible manner. Such features make these editing tools very promising for therapeutic applications. This review focuses on the evolution and mechanisms of CRISPR-Cas9 derived editing tools and their applications in the field of gene therapy.© 2023. The Author(s)."
"36930221","Long noncoding RNAs in cardiovascular disease.","Curr Opin Cardiol","Here, we review recent findings on the role of long noncoding RNAs (lncRNAs) in cardiovascular disease (CVD). In addition, we highlight some of the latest findings in lncRNA biology, providing an outlook for future avenues of lncRNA research in CVD.Recent publications provide translational evidence from patient studies and animal models for the role of specific lncRNAs in CVD. The molecular effector mechanisms of these lncRNAs are diverse. Overall, cell-type selective modulation of gene expression is the largest common denominator. New methods, such as single-cell profiling and CRISPR/Cas9-screening, reveal additional novel mechanistic principles: For example, many lncRNAs establish RNA-based spatial compartments that concentrate effector proteins. Also, RNA modifications and splicing features can be determinants of lncRNA function.lncRNA research is passing the stage of enumerating lncRNAs or recording simplified on-off expression switches. Mechanistic analyses are starting to reveal overarching principles of how lncRNAs can function. Exploring these principles with decisive genetic testing in vivo remains the ultimate test to discern how lncRNA loci, by RNA motifs or DNA elements, affect CVD pathophysiology.Copyright © 2023 The Author(s). Published by Wolters Kluwer Health, Inc."
"37059810","Variant calling and benchmarking in an era of complete human genome sequences.","Nat Rev Genet","Genetic variant calling from DNA sequencing has enabled understanding of germline variation in hundreds of thousands of humans. Sequencing technologies and variant-calling methods have advanced rapidly, routinely providing reliable variant calls in most of the human genome. We describe how advances in long reads, deep learning, de novo assembly and pangenomes have expanded access to variant calls in increasingly challenging, repetitive genomic regions, including medically relevant regions, and how new benchmark sets and benchmarking methods illuminate their strengths and limitations. Finally, we explore the possible future of more complete characterization of human genome variation in light of the recent completion of a telomere-to-telomere human genome reference assembly and human pangenomes, and we consider the innovations needed to benchmark their newly accessible repetitive regions and complex variants.© 2023. This is a U.S. Government work and not under copyright protection in the US; foreign copyright protection may apply."
"37037837","Restoring bone marrow niche function rejuvenates aged hematopoietic stem cells by reactivating the DNA Damage Response.","Nat Commun","Aging associated defects within stem cell-supportive niches contribute towards age-related decline in stem cell activity. However, mechanisms underlying age-related niche defects, and whether restoring niche function can improve stem cell fitness, remain unclear. Here, we sought to determine whether aged blood stem cell function can be restored by rejuvenating their supportive niches within the bone marrow (BM). We identify Netrin-1 as a critical regulator of BM niche cell aging. Niche-specific deletion of Netrin-1 induces premature aging phenotypes within the BM microenvironment, while supplementation of aged mice with Netrin-1 rejuvenates aged niche cells and restores competitive fitness of aged blood stem cells to youthful levels. We show that Netrin-1 plays an essential role in maintaining active DNA damage responses (DDR), and that aging-associated decline in niche-derived Netrin-1 results in DNA damage accumulation within the BM microenvironment. We show that Netrin-1 supplementation is sufficient to resolve DNA damage and restore regenerative potential of the aged BM niche and blood stem cells to endure serial chemotherapy regimens.© 2023. The Author(s)."
"37025175","Emerging roles of interferon-stimulated gene-15 in age-related telomere attrition, the DNA damage response, and cardiovascular disease.","Front Cell Dev Biol","Population aging and age-related cardiovascular disease (CVD) are becoming increasingly prevalent worldwide, generating a huge medical and socioeconomic burden. The complex regulation of aging and CVD and the interaction between these processes are crucially dependent on cellular stress responses. Interferon-stimulated gene-15 (ISG15) encodes a ubiquitin-like protein expressed in many vertebrate cell types that can be found both free and conjugated to lysine residues of target proteinsviaa post-translational process termed ISGylation. Deconjugation of ISG15 (deISGylation) is catalyzed by the ubiquitin-specific peptidase 18 (USP18). The ISG15 pathway has mostly been studied in the context of viral and bacterial infections and in cancer. This minireview summarizes current knowledge on the role of ISG15 in age-related telomere shortening, genomic instability, and DNA damage accumulation, as well as in hypertension, diabetes, and obesity, major CVD risk factors prevalent in the elderly population.Copyright © 2023 González-Amor, Dorado and Andrés."
"37017692","Copper chaperone antioxidant 1: multiple roles and a potential therapeutic target.","J Mol Med (Berl)","Copper (Cu) was recently demonstrated to play a critical role in cellular physiological and biochemical processes, including energy production and maintenance, antioxidation and enzymatic activity, and signal transduction. Antioxidant 1 (ATOX1), a chaperone of Cu previously named human ATX1 homologue (HAH1), has been found to play an indispensable role in maintaining cellular Cu homeostasis, antioxidative stress, and transcriptional regulation. In the past decade, it has also been found to be involved in a variety of diseases, including numerous neurodegenerative diseases, cancers, and metabolic diseases. Recently, increasing evidence has revealed that ATOX1 is involved in the regulation of cell migration, proliferation, autophagy, DNA damage repair (DDR), and death, as well as in organism development and reproduction. This review summarizes recent advances in the research on the diverse physiological and cytological functions of ATOX1 and the underlying mechanisms of its action in human health and diseases. The potential of ATOX1 as a therapeutic target is also discussed. This review aims to pose unanswered questions related to ATOX1 biology and explore the potential use of ATOX1 as a therapeutic target.© 2023. The Author(s), under exclusive licence to Springer-Verlag GmbH Germany, part of Springer Nature."
"37013186","Age or lifestyle-induced accumulation of genotoxicity is associated with a length-dependent decrease in gene expression.","iScience","DNA damage has long been advocated as a molecular driver of aging. DNA damage occurs in a stochastic manner, and is therefore more likely to accumulate in longer genes. The length-dependent accumulation of transcription-blocking damage, unlike that of somatic mutations, should be reflected in gene expression datasets of aging. We analyzed gene expression as a function of gene length in several single-cell RNA sequencing datasets of mouse and human aging. We found a pervasive age-associated length-dependent underexpression of genes across species, tissues, and cell types. Furthermore, we observed length-dependent underexpression associated with UV-radiation and smoke exposure, and in progeroid diseases, Cockayne syndrome, and trichothiodystrophy. Finally, we studied published gene sets showing global age-related changes. Genes underexpressed with aging were significantly longer than overexpressed genes. These data highlight a previously undetected hallmark of aging and show that accumulation of genotoxicity in long genes could lead to reduced RNA polymerase II processivity.© 2023 The Author(s)."
