"pmid","title","source","abstract"
"37024583","Precise modulation of transcription factor levels identifies features underlying dosage sensitivity.","Nat Genet","Transcriptional regulation exhibits extensive robustness, but human genetics indicates sensitivity to transcription factor (TF) dosage. Reconciling such observations requires quantitative studies of TF dosage effects at trait-relevant ranges, largely lacking so far. TFs play central roles in both normal-range and disease-associated variation in craniofacial morphology; we therefore developed an approach to precisely modulate TF levels in human facial progenitor cells and applied it to SOX9, a TF associated with craniofacial variation and disease (Pierre Robin sequence (PRS)). Most SOX9-dependent regulatory elements (REs) are buffered against small decreases in SOX9 dosage, but REs directly and primarily regulated by SOX9 show heightened sensitivity to SOX9 dosage; these RE responses partially predict gene expression responses. Sensitive REs and genes preferentially affect functional chondrogenesis and PRS-like craniofacial shape variation. We propose that such REs and genes underlie the sensitivity of specific phenotypes to TF dosage, while buffering of other genes leads to robust, nonlinear dosage-to-phenotype relationships.© 2023. The Author(s)."
"37041330","Mitochondrial Inheritance Following Nuclear Transfer: From Cloned Animals to Patients with Mitochondrial Disease.","Methods Mol Biol","Mitochondria are indispensable power plants of eukaryotic cells that also act as a major biochemical hub. As such, mitochondrial dysfunction, which can originate from mutations in the mitochondrial genome (mtDNA), may impair organism fitness and lead to severe diseases in humans. MtDNA is a multi-copy, highly polymorphic genome that is uniparentally transmitted through the maternal line. Several mechanisms act in the germline to counteract heteroplasmy (i.e., coexistence of two or more mtDNA variants) and prevent expansion of mtDNA mutations. However, reproductive biotechnologies such as cloning by nuclear transfer can disrupt mtDNA inheritance, resulting in new genetic combinations that may be unstable and have physiological consequences. Here, we review the current understanding of mitochondrial inheritance, with emphasis on its pattern in animals and human embryos generated by nuclear transfer.© 2023. The Author(s), under exclusive license to Springer Science+Business Media, LLC, part of Springer Nature."
"37033694","The Growing Liberality Observed in Primary Animal and Plant Cultures is Common to the Social Amoeba.","J Bioinform Syst Biol","Tissue culture environment liberates cells fromordinary laws of multi-cellular organisms. This liberation enables cells several behaviors, such as proliferation, dedifferentiation, acquisition of pluripotency, immortalization, and reprogramming. Recently, the quantitative value of cellular dedifferentiation and differentiation was defined as ""liberality"", which is measurable as Shannon entropy of numerical transcriptome data and Lempel-Zip complexity of nucleotide sequence transcriptome data. The increasing liberality induced by the culture environment had first been observed in animal cells and had reconfirmed in plant cells.The phenomena may be common across the kingdom, also in a social amoeba. We measured the liberality of the social amoeba which disaggregated from multicellular aggregates and transferred into a liquid medium."
"37043948","Impact of COVID-19 lockdown on smoking and vaping: systematic review and meta-analysis.","Public Health","COVID-19 and the implementation of lockdowns have impacted daily lives worldwide. This systematic review and meta-analysis aimed to investigate the impact of lockdowns on the smoking and vaping behaviours of adults during the pandemic.This was a systematic review and meta-analysis.A systematic literature search was conducted up to 28 April 2022 in the following databases: PubMed, Embase and Web of Science.In total, 77 studies met the inclusion criteria for this review. In 34 studies, an increase in smoking behaviour was reported for the majority of participants; however, in 21 and 18 studies, 'no change' and 'decrease' in smoking were the predominant responses, respectively. The results from the meta-analysis, which examined the change in the number of cigarettes smoked per day, showed no difference between the pre- and post-lockdown periods: 0.81 weighted mean difference (95% confidence interval, -0.59 to 2.21). Regarding vaping, three of seven studies reported an increase in smoking for the majority of participants, whereas 'no change' and 'decrease' were the predominant answers in the other four studies.The results show that lockdowns led most participants to increase smoking/vaping, whereas a decrease or cessation of smoking/vaping was only reported in the minority of participants. Attention should be given to the non-communicable diseases that could arise as a result of the increase in smoking/vaping during lockdowns, and further research in this area is needed.Copyright © 2023 The Royal Society for Public Health. Published by Elsevier Ltd. All rights reserved."
"37038196","Distinct CSF biomarker-associated DNA methylation in Alzheimer's disease and cognitively normal subjects.","Alzheimers Res Ther","Growing evidence has demonstrated that DNA methylation (DNAm) plays an important role in Alzheimer's disease (AD) and that DNAm differences can be detected in the blood of AD subjects. Most studies have correlated blood DNAm with the clinical diagnosis of AD in living individuals. However, as the pathophysiological process of AD can begin many years before the onset of clinical symptoms, there is often disagreement between neuropathology in the brain and clinical phenotypes. Therefore, blood DNAm associated with AD neuropathology, rather than with clinical data, would provide more relevant information on AD pathogenesis.We performed a comprehensive analysis to identify blood DNAm associated with cerebrospinal fluid (CSF) pathological biomarkers for AD. Our study included matched samples of whole blood DNA methylation, CSF Aβ42, phosphorylated tau181(pTau181), and total tau (tTau) biomarkers data, measured on the same subjects and at the same clinical visits from a total of 202 subjects (123 CN or cognitively normal, 79 AD) in the Alzheimer's Disease Neuroimaging Initiative (ADNI) cohort. To validate our findings, we also examined the association between premortem blood DNAm and postmortem brain neuropathology measured on a group of 69 subjects in the London dataset.We identified a number of novel associations between blood DNAm and CSF biomarkers, demonstrating that changes in pathological processes in the CSF are reflected in the blood epigenome. Overall, the CSF biomarker-associated DNAm is relatively distinct in CN and AD subjects, highlighting the importance of analyzing omics data measured on cognitively normal subjects (which includes preclinical AD subjects) to identify diagnostic biomarkers, and considering disease stages in the development and testing of AD treatment strategies. Moreover, our analysis revealed biological processes associated with early brain impairment relevant to AD are marked by DNAm in the blood, and blood DNAm at several CpGs in the DMR on HOXA5 gene are associated with pTau181in the CSF, as well as tau-pathology and DNAm in the brain, nominating DNAm at this locus as a promising candidate AD biomarker.Our study provides a valuable resource for future mechanistic and biomarker studies of DNAm in AD.© 2023. The Author(s)."
"36975052","Systematic review of the diagnostic role of neutrophil to lymphocyte ratio in sarcoidosis.","Sarcoidosis Vasc Diffuse Lung Dis","To outline the observations of studies evaluating the prominence of Neutrophil to Lymphocyte Ratio (NLR) in sarcoidosis.The search was performed on PubMed, Scopus, and web of science up until November 21, 2021. Eventually, a number of 17 papers were incorporated into this review.The results of this analysis showed no significant difference of NLR values between sarcoidosis patients and tuberculosis patients (SMD=-0.36, 95% CI= -0.92-0.21). The results showed high heterogeneity (I2=90.83%, p<0.001). So, we used random-effects model. However, NLR can be utilized to identify the radiological severity and staging of pulmonary sarcoidosis due to statistically significant variations. An elevation in NLR values may assist both sarcoidosis diagnosis and lung parenchyma involvement. Also, extra-pulmonary involvement was just more probable to be found in individuals diagnosed with sarcoidosis inhibiting high rates of NLR. High NLR levels were found to be associated with an accelerated rate of progression, revealing that NLR might be used to detect Pulmonary Hypertension (PH) as a complication of sarcoidosis.In the visualizations of the disease, NLR was revealed to be a beneficial and straightforward fundamental laboratory biomarker connected to disease severity and requirement for therapy."
"37046086","Ageing-associated changes in transcriptional elongation influence longevity.","Nature","Physiological homeostasis becomes compromised during ageing, as a result of impairment of cellular processes, including transcription and RNA splicing1-4. However, the molecular mechanisms leading to the loss of transcriptional fidelity are so far elusive, as are ways of preventing it. Here we profiled and analysed genome-wide, ageing-related changes in transcriptional processes across different organisms: nematodes, fruitflies, mice, rats and humans. The average transcriptional elongation speed (RNA polymerase II speed) increased with age in all five species. Along with these changes in elongation speed, we observed changes in splicing, including a reduction of unspliced transcripts and the formation of more circular RNAs. Two lifespan-extending interventions, dietary restriction and lowered insulin-IGF signalling, both reversed most of these ageing-related changes. Genetic variants in RNA polymerase II that reduced its speed in worms5and flies6increased their lifespan. Similarly, reducing the speed of RNA polymerase II by overexpressing histone components, to counter age-associated changes in nucleosome positioning, also extended lifespan in flies and the division potential of human cells. Our findings uncover fundamental molecular mechanisms underlying animal ageing and lifespan-extending interventions, and point to possible preventive measures.© 2023. The Author(s)."
"37053216","Synonymous alterations of cancer-associated Trp53 CpG mutational hotspots cause fatal developmental jaw malocclusions but no tumors in knock-in mice.","PLoS One","Intragenic CpG dinucleotides are tightly conserved in evolution yet are also vulnerable to methylation-dependent mutation, raising the question as to why these functionally critical sites have not been deselected by more stable coding sequences. We previously showed in cell lines that altered exonic CpG methylation can modify promoter start sites, and hence protein isoform expression, for the human TP53 tumor suppressor gene. Here we extend this work to the in vivo setting by testing whether synonymous germline modifications of exonic CpG sites affect murine development, fertility, longevity, or cancer incidence. We substituted the DNA-binding exons 5-8 of Trp53, the mouse ortholog of human TP53, with variant-CpG (either CpG-depleted or -enriched) sequences predicted to encode the normal p53 amino acid sequence; a control construct was also created in which all non-CpG sites were synonymously substituted. Homozygous Trp53-null mice were the only genotype to develop tumors. Mice with variant-CpG Trp53 sequences remained tumor-free, but were uniquely prone to dental anomalies causing jaw malocclusion (p < .0001). Since the latter phenotype also characterises murine Rett syndrome due to dysfunction of the trans-repressive MeCP2 methyl-CpG-binding protein, we hypothesise that CpG sites may exert non-coding phenotypic effects via pre-translational cis-interactions of 5-methylcytosine with methyl-binding proteins which regulate mRNA transcript initiation, expression or splicing, although direct effects on mRNA structure or translation are also possible.Copyright: © 2023 Epstein et al. This is an open access article distributed under the terms of the Creative Commons Attribution License, which permits unrestricted use, distribution, and reproduction in any medium, provided the original author and source are credited."
"37047469","Impact of Environmental and Epigenetic Changes on Mesenchymal Stem Cells during Aging.","Int J Mol Sci","Many crucial epigenetic changes occur during early skeletal development and throughout life due to aging, disease and are heavily influenced by an individual's lifestyle. Epigenetics is the study of heritable changes in gene expression as the result of changes in the environment without any mutation in the underlying DNA sequence. The epigenetic profiles of cells are dynamic and mediated by different mechanisms, including histone modifications, non-coding RNA-associated gene silencing and DNA methylation. Given the underlining role of dysfunctional mesenchymal tissues in common age-related skeletal diseases such as osteoporosis and osteoarthritis, investigations into skeletal stem cells or mesenchymal stem cells (MSC) and their functional deregulation during aging has been of great interest and how this is mediated by an evolving epigenetic landscape. The present review describes the recent findings in epigenetic changes of MSCs that effect growth and cell fate determination in the context of aging, diet, exercise and bone-related diseases."
"37025591","Histone methyltransferase SETD2: An epigenetic driver in clear cell renal cell carcinoma.","Front Oncol","SET domain-containing 2 (SETD2) is a lysine methyltransferase that catalyzes histone H3 lysine36 trimethylation (H3K36me3) and has been revealed to play important roles in the regulation of transcriptional elongation, RNA splicing, and DNA damage repair.SETD2mutations have been documented in several cancers, including clear cell renal cell carcinoma (ccRCC).SETD2deficiency is associated with cancer occurrence and progression by regulating autophagy flux, general metabolic activity, and replication fork speed. Therefore, SETD2 is considered a potential epigenetic therapeutic target and is the subject of ongoing research on cancer-related diagnosis and treatment. This review presents an overview of the molecular functions of SETD2 in H3K36me3 regulation and its relationship with ccRCC, providing a theoretical basis for subsequent antitumor therapy based on SETD2 or H3K36me3 targets.Copyright © 2023 Yu, Qian, Wang, Xiao, Zhu and Ju."
"36993548","ZFP281 coordinates DNMT3 and TET1 for transcriptional and epigenetic control in pluripotent state transitions.","bioRxiv","The progression from naive through formative to primedin vitropluripotent stem cell states recapitulates the development of the epiblastin vivoduring the peri-implantation period of mammalian development. Activation of thede novoDNA methyltransferases and reorganization of transcriptional and epigenetic landscapes are key events occurring during these pluripotent state transitions. However, the upstream regulators that coordinate these events are relatively underexplored. Here, usingZfp281knockout mouse and degron knock-in cell models, we uncover the direct transcriptional activation ofDnmt3a/3bby ZFP281 in pluripotent stem cells. Chromatin co-occupancy of ZFP281 and DNA hydroxylase TET1, dependent on the formation of R loops in ZFP281-targeted gene promoters, undergoes a ""high-low-high"" bimodal pattern regulating dynamic DNA methylation and gene expression during the naïve-formative-primed transitions. ZFP281 also safeguards DNA methylation in maintaining primed pluripotency. Our study demonstrates a previously unappreciated role for ZFP281 in coordinating DNMT3A/3B and TET1 functions to promote pluripotent state transitions.The naive, formative, and primed pluripotent states and their interconversions recapitulate pluripotency continuum during early development. Huang and colleagues investigated the transcriptional programs during successive pluripotent state transitions and revealed an essential role for ZFP281 in coordinating DNMT3A/3B and TET1 to establish the DNA methylation and gene expression programs during the transitions.ZFP281 activatesDnmt3a/3b in vitroin pluripotent stem cells andin vivoin epiblast. ZFP281 and TET1 undergo bimodal chromatin occupancy in pluripotent state transitions.Chromatin-binding of ZFP281 and TET1 depends on the formation of R-loops at promoters.ZFP281 is necessary for the establishment and maintenance of primed pluripotency."
"36961833","Phenotypic plasticity evolves at multiple biological levels in response to environmental predictability in a long-term experiment with a halotolerant microalga.","PLoS Biol","Phenotypic plasticity, the change in the phenotype of a given genotype in response to its environment of development, is a ubiquitous feature of life, enabling organisms to cope with variation in their environment. Theoretical studies predict that, under stationary environmental variation, the level of plasticity should evolve to match the predictability of selection at the timing of development. However, the extent to which patterns of evolution of plasticity for more integrated traits are mirrored by their underlying molecular mechanisms remains unclear, especially in response to well-characterized selective pressures exerted by environmental predictability. Here, we used experimental evolution with the microalgae Dunaliella salina under controlled environmental fluctuations, to test whether the evolution of phenotypic plasticity in responses to environmental predictability (as measured by the squared autocorrelation ρ2) occurred across biological levels, going from DNA methylation to gene expression to cell morphology. Transcriptomic analysis indicates clear effects of salinity and ρ2 × salinity interaction on gene expression, thus identifying sets of genes involved in plasticity and its evolution. These transcriptomic effects were independent of DNA methylation changes in cis. However, we did find ρ2-specific responses of DNA methylation to salinity change, albeit weaker than for gene expression. Overall, we found consistent evolution of reduced plasticity in less predictable environments for DNA methylation, gene expression, and cell morphology. Our results provide the first clear empirical signature of plasticity evolution at multiple levels in response to environmental predictability, and highlight the importance of experimental evolution to address predictions from evolutionary theory, as well as investigate the molecular basis of plasticity evolution.Copyright: © 2023 Leung et al. This is an open access article distributed under the terms of the Creative Commons Attribution License, which permits unrestricted use, distribution, and reproduction in any medium, provided the original author and source are credited."
"37026147","The impact of monthly air pollution exposure and its interaction with individual factors: Insight from a large cohort study of comprehensive hospitalizations in Guangzhou area.","Front Public Health","Although the association between short-term air pollution exposure and certain hospitalizations has been well documented, evidence on the effect of longer-term (e. g., monthly) air pollution on a comprehensive set of outcomes is still limited.A total of 68,416 people in South China were enrolled and followed up during 2019-2020. Monthly air pollution level was estimated using a validated ordinary Kriging method and assigned to individuals. Time-dependent Cox models were developed to estimate the relationship between monthly PM10and O3exposures and the all-cause and cause-specific hospitalizations after adjusting for confounders. The interaction between air pollution and individual factors was also investigated.Overall, each 10 μg/m3increase in PM10concentration was associated with a 3.1% (95%CI: 1.3%-4.9%) increment in the risk of all-cause hospitalization. The estimate was even greater following O3exposure (6.8%, 5.5%-8.2%). Furthermore, each 10 μg/m3increase in PM10was associated with a 2.3%-9.1% elevation in all the cause-specific hospitalizations except for those related to respiratory and digestive diseases. The same increment in O3was relevant to a 4.7%-22.8% elevation in the risk except for respiratory diseases. Additionally, the older individuals tended to be more vulnerable to PM10exposure (Pinteraction: 0.002), while the alcohol abused and those with an abnormal BMI were more vulnerable to the impact of O3(Pinteraction: 0.052 and 0.011). However, the heavy smokers were less vulnerable to O3exposure (Pinteraction: 0.032).We provide comprehensive evidence on the hospitalization hazard of monthly PM10and O3exposure and their interaction with individual factors.Copyright © 2023 Ju, Yimaer, Du, Wang, Cai, Chen, Zhang, Wu, Wu, Lin, Wang, Jiang, Hu, Zhang and Hao."
"36993614","MIMOSA: A resource consisting of improved methylome imputation models increases power to identify DNA methylation-phenotype associations.","medRxiv","DNA methylation has been shown to be involved in the etiology of many complex diseases, yet the specific key underlying methylation sites remain largely unknown. One strategy to identify putative causal CpG sites and enhance disease etiology understanding is to conduct methylome-wide association studies (MWASs), in which predicted or measured DNA methylation that is associated with complex diseases can be identified. However, current MWAS models are trained with relatively small reference datasets, limiting the ability to adequately handle CpG sites with low genetic heritability. Here, we introduce a new resource, MWAS Imputing Methylome Obliging Summary-level mQTLs and Associated LD matrices (MIMOSA), a set of models that substantially improve the prediction accuracy of DNA methylation and subsequent MWAS power through the use of a large, summary-level mQTL dataset provided by the Genetics of DNA Methylation Consortium (GoDMC). With the analyses of GWAS summary statistics for 28 complex traits and diseases, we demonstrate that MIMOSA considerably increases the accuracy of DNA methylation prediction in blood, crafts fruitful prediction models for low heritability CpG sites, and determines markedly more CpG site-phenotype associations than preceding methods."
"37071275","A Phenome-Wide Association Study (PheWAS) of Late Onset Alzheimer Disease Genetic Risk in Children of European Ancestry at Middle Childhood: Results from the ABCD Study.","Behav Genet","Genetic risk for Late Onset Alzheimer Disease (AD) has been associated with lower cognition and smaller hippocampal volume in healthy young adults. However, whether these and other associations are present during childhood remains unclear. Using data from 5556 genomically-confirmed European ancestry youth who completed the baseline session of the ongoing the Adolescent Brain Cognitive DevelopmentSMStudy (ABCD Study®), our phenome-wide association study estimating associations between four indices of genetic risk for late-onset AD (i.e., AD polygenic risk scores (PRS), APOE rs429358 genotype, AD PRS with the APOE region removed (ADPRS-APOE), and an interaction between ADPRS-APOEand APOE genotype) and 1687 psychosocial, behavioral, and neural phenotypes revealed no significant associations after correction for multiple testing (all ps > 0.0002; all pfdr > 0.07). These data suggest that AD genetic risk may not phenotypically manifest during middle-childhood or that effects are smaller than this sample is powered to detect.© 2023. The Author(s), under exclusive licence to Springer Science+Business Media, LLC, part of Springer Nature."
